"No.","Time","Source","Destination","Protocol","Length","Info"
"1","0.000000","157.240.196.60","10.0.2.15","TLSv1.2","221","Application Data"
"2","0.000052","10.0.2.15","157.240.196.60","TCP","54","43620  >  443 [ACK] Seq=1 Ack=168 Win=65535 Len=0"
"3","0.034385","10.0.2.15","157.240.196.60","TLSv1.2","146","Application Data"
"4","0.035257","157.240.196.60","10.0.2.15","TCP","54","443  >  43620 [ACK] Seq=168 Ack=93 Win=65535 Len=0"
"5","0.099608","10.0.2.15","157.240.196.60","TLSv1.2","148","Application Data"
"6","0.099991","157.240.196.60","10.0.2.15","TCP","54","443  >  43620 [ACK] Seq=168 Ack=187 Win=65535 Len=0"
"7","3.117292","157.240.196.60","10.0.2.15","TLSv1.2","891","Application Data"
"8","3.157761","10.0.2.15","157.240.196.60","TCP","54","43620  >  443 [ACK] Seq=187 Ack=1005 Win=65535 Len=0"
"9","3.229806","157.240.196.60","10.0.2.15","TLSv1.2","1567","Application Data"
"10","3.229830","10.0.2.15","157.240.196.60","TCP","54","43620  >  443 [ACK] Seq=187 Ack=2518 Win=65535 Len=0"
"11","3.247323","157.240.196.60","10.0.2.15","TLSv1.2","1934","Application Data, Application Data"
"12","3.247344","10.0.2.15","157.240.196.60","TCP","54","43620  >  443 [ACK] Seq=187 Ack=4398 Win=65535 Len=0"
"13","3.336784","157.240.196.60","10.0.2.15","TLSv1.2","1567","Application Data"
"14","3.336809","10.0.2.15","157.240.196.60","TCP","54","43620  >  443 [ACK] Seq=187 Ack=5911 Win=65535 Len=0"
"15","3.341582","157.240.196.60","10.0.2.15","TLSv1.2","1790","Application Data, Application Data"
"16","3.341602","10.0.2.15","157.240.196.60","TCP","54","43620  >  443 [ACK] Seq=187 Ack=7647 Win=65535 Len=0"
"17","3.344870","10.0.2.15","157.240.196.60","TLSv1.2","143","Application Data"
"18","3.345356","157.240.196.60","10.0.2.15","TCP","54","443  >  43620 [ACK] Seq=7647 Ack=276 Win=65535 Len=0"
"19","3.516891","157.240.196.60","10.0.2.15","TLSv1.2","181","Application Data"
"20","3.525168","157.240.196.60","10.0.2.15","TLSv1.2","181","Application Data"
"21","3.525270","10.0.2.15","157.240.196.60","TCP","54","43620  >  443 [ACK] Seq=276 Ack=7901 Win=65535 Len=0"
"22","3.580081","157.240.196.60","10.0.2.15","TLSv1.2","181","Application Data"
"23","3.626218","10.0.2.15","157.240.196.60","TCP","54","43620  >  443 [ACK] Seq=276 Ack=8028 Win=65535 Len=0"
"24","3.629115","10.0.2.15","157.240.196.60","TLSv1.2","147","Application Data"
"25","3.629831","157.240.196.60","10.0.2.15","TCP","54","443  >  43620 [ACK] Seq=8028 Ack=369 Win=65535 Len=0"
"26","3.630576","10.0.2.15","157.240.196.60","TLSv1.2","147","Application Data"
"27","3.630954","157.240.196.60","10.0.2.15","TCP","54","443  >  43620 [ACK] Seq=8028 Ack=462 Win=65535 Len=0"
"28","3.635940","10.0.2.15","157.240.196.60","TLSv1.2","147","Application Data"
"29","3.636434","157.240.196.60","10.0.2.15","TCP","54","443  >  43620 [ACK] Seq=8028 Ack=555 Win=65535 Len=0"
"30","4.705213","10.0.2.15","157.240.196.60","TLSv1.2","143","Application Data"
"31","4.721258","157.240.196.60","10.0.2.15","TCP","54","443  >  43620 [ACK] Seq=8028 Ack=644 Win=65535 Len=0"
"32","5.249379","10.0.2.15","34.117.237.239","TLSv1.2","93","Application Data"
"33","5.250064","34.117.237.239","10.0.2.15","TCP","54","443  >  45806 [ACK] Seq=1 Ack=40 Win=65535 Len=0"
"34","5.641170","10.0.2.15","34.120.208.123","TLSv1.2","93","Application Data"
"35","5.642137","10.0.2.15","34.117.237.239","TLSv1.2","78","Application Data"
"36","5.642150","10.0.2.15","34.117.237.239","TCP","54","45806  >  443 [FIN, ACK] Seq=64 Ack=1 Win=64028 Len=0"
"37","5.659230","34.120.208.123","10.0.2.15","TCP","54","443  >  44146 [ACK] Seq=1 Ack=40 Win=65535 Len=0"
"38","5.659231","34.117.237.239","10.0.2.15","TCP","54","443  >  45806 [ACK] Seq=1 Ack=64 Win=65535 Len=0"
"39","5.659231","34.117.237.239","10.0.2.15","TCP","54","443  >  45806 [ACK] Seq=1 Ack=65 Win=65535 Len=0"
"40","5.659231","34.117.237.239","10.0.2.15","TCP","54","443  >  45806 [FIN, ACK] Seq=1 Ack=65 Win=65535 Len=0"
"41","5.659284","10.0.2.15","34.117.237.239","TCP","54","45806  >  443 [ACK] Seq=65 Ack=2 Win=64028 Len=0"
"42","5.789406","10.0.2.15","34.120.208.123","TLSv1.2","78","Application Data"
"43","5.789484","10.0.2.15","34.120.208.123","TCP","54","44146  >  443 [FIN, ACK] Seq=64 Ack=1 Win=63874 Len=0"
"44","5.790230","34.120.208.123","10.0.2.15","TCP","54","443  >  44146 [ACK] Seq=1 Ack=64 Win=65535 Len=0"
"45","5.790230","34.120.208.123","10.0.2.15","TCP","54","443  >  44146 [ACK] Seq=1 Ack=65 Win=65535 Len=0"
"46","5.876203","34.120.208.123","10.0.2.15","TCP","54","443  >  44146 [FIN, ACK] Seq=1 Ack=65 Win=65535 Len=0"
"47","5.876231","10.0.2.15","34.120.208.123","TCP","54","44146  >  443 [ACK] Seq=65 Ack=2 Win=63874 Len=0"
"48","7.687665","10.0.2.15","157.240.196.60","TLSv1.2","143","Application Data"
"49","7.688172","157.240.196.60","10.0.2.15","TCP","54","443  >  43620 [ACK] Seq=8028 Ack=733 Win=65535 Len=0"
"50","8.719597","10.0.2.15","157.240.196.60","TLSv1.2","122","Application Data"
"51","8.732485","157.240.196.60","10.0.2.15","TCP","54","443  >  43620 [ACK] Seq=8028 Ack=801 Win=65535 Len=0"
"52","9.658081","10.0.2.15","157.240.195.56","TLSv1.2","93","Application Data"
"53","9.658338","10.0.2.15","157.240.195.56","TLSv1.2","78","Application Data"
"54","9.658579","157.240.195.56","10.0.2.15","TCP","54","443  >  56294 [ACK] Seq=1 Ack=40 Win=65535 Len=0"
"55","9.658857","157.240.195.56","10.0.2.15","TCP","54","443  >  56294 [ACK] Seq=1 Ack=65 Win=65535 Len=0"
"56","9.706079","157.240.195.56","10.0.2.15","TLSv1.2","93","Application Data"
"57","9.706109","10.0.2.15","157.240.195.56","TCP","54","56294  >  443 [RST] Seq=65 Win=0 Len=0"
"58","9.706079","157.240.195.56","10.0.2.15","TCP","54","443  >  56294 [FIN, ACK] Seq=40 Ack=65 Win=65535 Len=0"
"59","9.706181","10.0.2.15","157.240.195.56","TCP","54","56294  >  443 [RST] Seq=65 Win=0 Len=0"
"60","9.706452","157.240.195.56","10.0.2.15","TCP","54","443  >  56294 [RST, ACK] Seq=4077811769 Ack=65 Win=0 Len=0"
"61","17.851909","10.0.2.15","157.240.196.60","TLSv1.2","124","Application Data"
"62","17.852644","157.240.196.60","10.0.2.15","TCP","54","443  >  43620 [ACK] Seq=8028 Ack=871 Win=65535 Len=0"
"63","18.003019","157.240.196.60","10.0.2.15","TLSv1.2","126","Application Data"
"64","18.003044","10.0.2.15","157.240.196.60","TCP","54","43620  >  443 [ACK] Seq=871 Ack=8100 Win=65535 Len=0"
"65","19.033544","157.240.196.60","10.0.2.15","TLSv1.2","1567","Application Data"
"66","19.034809","10.0.2.15","157.240.196.60","TCP","54","43620  >  443 [ACK] Seq=871 Ack=9613 Win=65535 Len=0"
"67","19.033544","157.240.196.60","10.0.2.15","TLSv1.2","1560","Application Data"
"68","19.035220","10.0.2.15","157.240.196.60","TCP","54","43620  >  443 [ACK] Seq=871 Ack=11119 Win=65535 Len=0"
"69","19.202330","157.240.196.60","10.0.2.15","TLSv1.2","1567","Application Data"
"70","19.202355","10.0.2.15","157.240.196.60","TCP","54","43620  >  443 [ACK] Seq=871 Ack=12632 Win=65535 Len=0"
"71","19.204657","157.240.196.60","10.0.2.15","TCP","1446","443  >  43620 [PSH, ACK] Seq=12632 Ack=871 Win=65535 Len=1392 [TCP segment of a reassembled PDU]"
"72","19.204669","10.0.2.15","157.240.196.60","TCP","54","43620  >  443 [ACK] Seq=871 Ack=14024 Win=65535 Len=0"
"73","19.204657","157.240.196.60","10.0.2.15","TLSv1.2","766","Application Data, Application Data"
"74","19.205230","10.0.2.15","157.240.196.60","TCP","54","43620  >  443 [ACK] Seq=871 Ack=14736 Win=65535 Len=0"
"75","19.336367","157.240.196.60","10.0.2.15","TLSv1.2","181","Application Data"
"76","19.336391","10.0.2.15","157.240.196.60","TCP","54","43620  >  443 [ACK] Seq=871 Ack=14863 Win=65535 Len=0"
"77","19.369840","10.0.2.15","157.240.196.60","TLSv1.2","143","Application Data"
"78","19.379410","157.240.196.60","10.0.2.15","TCP","54","443  >  43620 [ACK] Seq=14863 Ack=960 Win=65535 Len=0"
"79","19.415764","157.240.196.60","10.0.2.15","TLSv1.2","181","Application Data"
"80","19.457966","10.0.2.15","157.240.196.60","TCP","54","43620  >  443 [ACK] Seq=960 Ack=14990 Win=65535 Len=0"
"81","19.606187","157.240.196.60","10.0.2.15","TLSv1.2","907","Application Data"
"82","19.606213","10.0.2.15","157.240.196.60","TCP","54","43620  >  443 [ACK] Seq=960 Ack=15843 Win=65535 Len=0"
"83","19.855151","157.240.196.60","10.0.2.15","TLSv1.2","181","Application Data"
"84","19.855176","10.0.2.15","157.240.196.60","TCP","54","43620  >  443 [ACK] Seq=960 Ack=15970 Win=65535 Len=0"
"85","19.980349","10.0.2.15","157.240.196.60","TLSv1.2","147","Application Data"
"86","19.982365","157.240.196.60","10.0.2.15","TCP","54","443  >  43620 [ACK] Seq=15970 Ack=1053 Win=65535 Len=0"
"87","20.027043","157.240.196.60","10.0.2.15","TLSv1.2","1567","Application Data"
"88","20.027069","10.0.2.15","157.240.196.60","TCP","54","43620  >  443 [ACK] Seq=1053 Ack=17483 Win=65535 Len=0"
"89","20.037255","157.240.196.60","10.0.2.15","TLSv1.2","1678","Application Data, Application Data"
"90","20.037276","10.0.2.15","157.240.196.60","TCP","54","43620  >  443 [ACK] Seq=1053 Ack=19107 Win=65535 Len=0"
"91","20.294677","157.240.196.60","10.0.2.15","TLSv1.2","181","Application Data"
"92","20.298530","10.0.2.15","157.240.196.60","TCP","54","43620  >  443 [ACK] Seq=1053 Ack=19234 Win=65535 Len=0"
"93","20.352351","10.0.2.15","157.240.196.60","TLSv1.2","147","Application Data"
"94","20.423502","157.240.196.60","10.0.2.15","TCP","54","443  >  43620 [ACK] Seq=19234 Ack=1146 Win=65535 Len=0"
"95","20.741052","157.240.196.60","10.0.2.15","TLSv1.2","1567","Application Data"
"96","20.744887","10.0.2.15","157.240.196.60","TCP","54","43620  >  443 [ACK] Seq=1146 Ack=20747 Win=65535 Len=0"
"97","20.741053","157.240.196.60","10.0.2.15","TLSv1.2","1368","Application Data"
"98","20.745293","10.0.2.15","157.240.196.60","TCP","54","43620  >  443 [ACK] Seq=1146 Ack=22061 Win=65535 Len=0"
"99","21.061252","157.240.196.60","10.0.2.15","TLSv1.2","181","Application Data"
"100","21.061279","10.0.2.15","157.240.196.60","TCP","54","43620  >  443 [ACK] Seq=1146 Ack=22188 Win=65535 Len=0"
"101","21.126900","10.0.2.15","157.240.196.60","TLSv1.2","147","Application Data"
"102","21.134880","157.240.196.60","10.0.2.15","TCP","54","443  >  43620 [ACK] Seq=22188 Ack=1239 Win=65535 Len=0"
"103","21.155582","10.0.2.15","157.240.196.60","TLSv1.2","147","Application Data"
"104","21.156192","157.240.196.60","10.0.2.15","TCP","54","443  >  43620 [ACK] Seq=22188 Ack=1332 Win=65535 Len=0"
"105","21.176869","157.240.196.60","10.0.2.15","TLSv1.2","907","Application Data"
"106","21.176915","10.0.2.15","157.240.196.60","TCP","54","43620  >  443 [ACK] Seq=1332 Ack=23041 Win=65535 Len=0"
"107","21.353752","10.0.2.15","157.240.196.60","TLSv1.2","147","Application Data"
"108","21.369526","157.240.196.60","10.0.2.15","TCP","54","443  >  43620 [ACK] Seq=23041 Ack=1425 Win=65535 Len=0"
"109","21.463261","157.240.196.60","10.0.2.15","TLSv1.2","181","Application Data"
"110","21.463286","10.0.2.15","157.240.196.60","TCP","54","43620  >  443 [ACK] Seq=1425 Ack=23168 Win=65535 Len=0"
"111","21.464227","10.0.2.15","10.0.0.138","DNS","87","Standard query 0xcaaa A web.whatsapp.com OPT"
"112","21.464504","10.0.2.15","10.0.0.138","DNS","87","Standard query 0x0e61 AAAA web.whatsapp.com OPT"
"113","21.488390","10.0.0.138","10.0.2.15","DNS","140","Standard query response 0xcaaa A web.whatsapp.com CNAME mmx-ds.cdn.whatsapp.net A 157.240.195.56 OPT"
"114","21.846161","157.240.196.60","10.0.2.15","TLSv1.2","891","Application Data"
"115","21.846192","10.0.2.15","157.240.196.60","TCP","54","43620  >  443 [ACK] Seq=1425 Ack=24005 Win=65535 Len=0"
"116","22.077391","157.240.196.60","10.0.2.15","TCP","1446","443  >  43620 [PSH, ACK] Seq=24005 Ack=1425 Win=65535 Len=1392 [TCP segment of a reassembled PDU]"
"117","22.077415","10.0.2.15","157.240.196.60","TCP","54","43620  >  443 [ACK] Seq=1425 Ack=25397 Win=65535 Len=0"
"118","22.077391","157.240.196.60","10.0.2.15","TLSv1.2","1217","Application Data, Application Data"
"119","22.077802","10.0.2.15","157.240.196.60","TCP","54","43620  >  443 [ACK] Seq=1425 Ack=26560 Win=65535 Len=0"
"120","22.138218","157.240.196.60","10.0.2.15","TLSv1.2","181","Application Data"
"121","22.138243","10.0.2.15","157.240.196.60","TCP","54","43620  >  443 [ACK] Seq=1425 Ack=26687 Win=65535 Len=0"
"122","22.249467","157.240.196.60","10.0.2.15","TLSv1.2","891","Application Data"
"123","22.249492","10.0.2.15","157.240.196.60","TCP","54","43620  >  443 [ACK] Seq=1425 Ack=27524 Win=65535 Len=0"
"124","22.295647","157.240.196.60","10.0.2.15","TLSv1.2","181","Application Data"
"125","22.295671","10.0.2.15","157.240.196.60","TCP","54","43620  >  443 [ACK] Seq=1425 Ack=27651 Win=65535 Len=0"
"126","22.471719","157.240.196.60","10.0.2.15","TLSv1.2","181","Application Data"
"127","22.471744","10.0.2.15","157.240.196.60","TCP","54","43620  >  443 [ACK] Seq=1425 Ack=27778 Win=65535 Len=0"
"128","23.018991","10.0.2.15","157.240.196.60","TLSv1.2","147","Application Data"
"129","23.019106","10.0.2.15","157.240.196.60","TLSv1.2","240","Application Data, Application Data"
"130","23.020059","157.240.196.60","10.0.2.15","TCP","54","443  >  43620 [ACK] Seq=27778 Ack=1518 Win=65535 Len=0"
"131","23.020059","157.240.196.60","10.0.2.15","TCP","54","443  >  43620 [ACK] Seq=27778 Ack=1704 Win=65535 Len=0"
"132","24.039112","10.0.2.15","157.240.196.60","TLSv1.2","147","Application Data"
"133","24.049354","157.240.196.60","10.0.2.15","TCP","54","443  >  43620 [ACK] Seq=27778 Ack=1797 Win=65535 Len=0"
"134","26.100429","10.0.2.15","157.240.196.60","TLSv1.2","143","Application Data"
"135","26.102537","157.240.196.60","10.0.2.15","TCP","54","443  >  43620 [ACK] Seq=27778 Ack=1886 Win=65535 Len=0"
"136","26.384674","157.240.196.60","10.0.2.15","TLSv1.2","333","Application Data"
"137","26.385071","10.0.2.15","157.240.196.60","TCP","54","43620  >  443 [ACK] Seq=1886 Ack=28057 Win=65535 Len=0"
"138","26.466921","10.0.2.15","10.0.0.138","DNS","94","Standard query 0x433a AAAA mmx-ds.cdn.whatsapp.net OPT"
"139","26.481868","10.0.0.138","10.0.2.15","DNS","122","Standard query response 0x433a AAAA mmx-ds.cdn.whatsapp.net AAAA 2a03:2880:f242:c8:face:b00c:0:167 OPT"
"140","26.647084","10.0.2.15","157.240.196.60","TLSv1.2","126","Application Data"
"141","26.647662","157.240.196.60","10.0.2.15","TCP","54","443  >  43620 [ACK] Seq=28057 Ack=1958 Win=65535 Len=0"
"142","27.107864","10.0.2.15","157.240.196.60","TLSv1.2","143","Application Data"
"143","27.108594","157.240.196.60","10.0.2.15","TCP","54","443  >  43620 [ACK] Seq=28057 Ack=2047 Win=65535 Len=0"
"144","28.487453","10.0.2.15","157.240.196.60","TLSv1.2","143","Application Data"
"145","28.495485","157.240.196.60","10.0.2.15","TCP","54","443  >  43620 [ACK] Seq=28057 Ack=2136 Win=65535 Len=0"
"146","30.547331","10.0.2.15","157.240.196.60","TLSv1.2","143","Application Data"
"147","30.551391","157.240.196.60","10.0.2.15","TCP","54","443  >  43620 [ACK] Seq=28057 Ack=2225 Win=65535 Len=0"
"148","32.897756","10.0.2.15","157.240.196.60","TLSv1.2","122","Application Data"
"149","32.902060","157.240.196.60","10.0.2.15","TCP","54","443  >  43620 [ACK] Seq=28057 Ack=2293 Win=65535 Len=0"
"150","34.009869","10.0.2.15","157.240.196.60","TLSv1.2","143","Application Data"
"151","34.053774","157.240.196.60","10.0.2.15","TCP","54","443  >  43620 [ACK] Seq=28057 Ack=2382 Win=65535 Len=0"
"152","35.889038","10.0.2.15","157.240.196.60","TLSv1.2","143","Application Data"
"153","35.894906","157.240.196.60","10.0.2.15","TCP","54","443  >  43620 [ACK] Seq=28057 Ack=2471 Win=65535 Len=0"
"154","40.753562","10.0.2.15","157.240.196.60","TLSv1.2","124","Application Data"
"155","40.757151","157.240.196.60","10.0.2.15","TCP","54","443  >  43620 [ACK] Seq=28057 Ack=2541 Win=65535 Len=0"
"156","40.764185","10.0.2.15","157.240.196.60","TLSv1.2","143","Application Data"
"157","40.764704","157.240.196.60","10.0.2.15","TCP","54","443  >  43620 [ACK] Seq=28057 Ack=2630 Win=65535 Len=0"
"158","40.894343","157.240.196.60","10.0.2.15","TLSv1.2","126","Application Data"
"159","40.894367","10.0.2.15","157.240.196.60","TCP","54","43620  >  443 [ACK] Seq=2630 Ack=28129 Win=65535 Len=0"
"160","42.120647","10.0.2.15","157.240.196.60","TLSv1.2","143","Application Data"
"161","42.121190","157.240.196.60","10.0.2.15","TCP","54","443  >  43620 [ACK] Seq=28129 Ack=2719 Win=65535 Len=0"
"162","42.481244","157.240.196.60","10.0.2.15","TCP","1446","443  >  43620 [PSH, ACK] Seq=28129 Ack=2719 Win=65535 Len=1392 [TCP segment of a reassembled PDU]"
"163","42.481363","10.0.2.15","157.240.196.60","TCP","54","43620  >  443 [ACK] Seq=2719 Ack=29521 Win=65535 Len=0"
"164","42.481605","157.240.196.60","10.0.2.15","TLSv1.2","1249","Application Data, Application Data"
"165","42.481615","10.0.2.15","157.240.196.60","TCP","54","43620  >  443 [ACK] Seq=2719 Ack=30716 Win=65535 Len=0"
"166","43.263023","10.0.2.15","157.240.196.60","TLSv1.2","143","Application Data"
"167","43.282353","157.240.196.60","10.0.2.15","TCP","54","443  >  43620 [ACK] Seq=30716 Ack=2808 Win=65535 Len=0"
"168","44.342201","157.240.196.60","10.0.2.15","TLSv1.2","1567","Application Data"
"169","44.342232","10.0.2.15","157.240.196.60","TCP","54","43620  >  443 [ACK] Seq=2808 Ack=32229 Win=65535 Len=0"
"170","44.342201","157.240.196.60","10.0.2.15","TCP","1446","443  >  43620 [PSH, ACK] Seq=32229 Ack=2808 Win=65535 Len=1392 [TCP segment of a reassembled PDU]"
"171","44.351628","10.0.2.15","157.240.196.60","TCP","54","43620  >  443 [ACK] Seq=2808 Ack=33621 Win=65535 Len=0"
"172","44.342201","157.240.196.60","10.0.2.15","TLSv1.2","1006","Application Data, Application Data"
"173","44.352032","10.0.2.15","157.240.196.60","TCP","54","43620  >  443 [ACK] Seq=2808 Ack=34573 Win=65535 Len=0"
"174","45.404012","10.0.2.15","157.240.196.60","TLSv1.2","143","Application Data"
"175","45.410652","157.240.196.60","10.0.2.15","TCP","54","443  >  43620 [ACK] Seq=34573 Ack=2897 Win=65535 Len=0"
"176","45.801451","157.240.196.60","10.0.2.15","TLSv1.2","1567","Application Data"
"177","45.801481","10.0.2.15","157.240.196.60","TCP","54","43620  >  443 [ACK] Seq=2897 Ack=36086 Win=65535 Len=0"
"178","45.801451","157.240.196.60","10.0.2.15","TCP","1446","443  >  43620 [PSH, ACK] Seq=36086 Ack=2897 Win=65535 Len=1392 [TCP segment of a reassembled PDU]"
"179","45.801560","10.0.2.15","157.240.196.60","TCP","54","43620  >  443 [ACK] Seq=2897 Ack=37478 Win=65535 Len=0"
"180","45.801451","157.240.196.60","10.0.2.15","TLSv1.2","702","Application Data, Application Data"
"181","45.808499","10.0.2.15","157.240.196.60","TCP","54","43620  >  443 [ACK] Seq=2897 Ack=38126 Win=65535 Len=0"
"182","47.306535","10.0.2.15","157.240.196.60","TLSv1.2","143","Application Data"
"183","47.306975","157.240.196.60","10.0.2.15","TCP","54","443  >  43620 [ACK] Seq=38126 Ack=2986 Win=65535 Len=0"
"184","49.634721","157.240.196.60","10.0.2.15","TCP","1514","443  >  43620 [ACK] Seq=38126 Ack=2986 Win=65535 Len=1460 [TCP segment of a reassembled PDU]"
"185","49.634751","10.0.2.15","157.240.196.60","TCP","54","43620  >  443 [ACK] Seq=2986 Ack=39586 Win=65535 Len=0"
"186","49.635178","157.240.196.60","10.0.2.15","TLSv1.2","107","Application Data"
"187","49.635188","10.0.2.15","157.240.196.60","TCP","54","43620  >  443 [ACK] Seq=2986 Ack=39639 Win=65535 Len=0"
"188","49.636041","157.240.196.60","10.0.2.15","TLSv1.2","1950","Application Data, Application Data"
"189","49.636050","10.0.2.15","157.240.196.60","TCP","54","43620  >  443 [ACK] Seq=2986 Ack=41535 Win=65535 Len=0"
"190","49.659213","10.0.2.15","157.240.195.56","TLSv1.2","93","Application Data"
"191","49.659748","157.240.195.56","10.0.2.15","TCP","54","443  >  38684 [ACK] Seq=1 Ack=40 Win=65535 Len=0"
"192","49.659966","10.0.2.15","157.240.195.56","TLSv1.2","78","Application Data"
"193","49.660572","157.240.195.56","10.0.2.15","TCP","54","443  >  38684 [ACK] Seq=1 Ack=64 Win=65535 Len=0"
"194","49.660589","10.0.2.15","157.240.195.56","TCP","54","38684  >  443 [FIN, ACK] Seq=64 Ack=1 Win=62780 Len=0"
"195","49.661031","157.240.195.56","10.0.2.15","TCP","54","443  >  38684 [ACK] Seq=1 Ack=65 Win=65535 Len=0"
"196","49.717999","157.240.195.56","10.0.2.15","TLSv1.2","78","Application Data"
"197","49.718192","10.0.2.15","157.240.195.56","TCP","54","38684  >  443 [RST] Seq=65 Win=0 Len=0"
"198","49.717999","157.240.195.56","10.0.2.15","TCP","54","443  >  38684 [FIN, ACK] Seq=25 Ack=65 Win=65535 Len=0"
"199","49.718514","10.0.2.15","157.240.195.56","TCP","54","38684  >  443 [RST] Seq=65 Win=0 Len=0"
"200","49.719122","157.240.195.56","10.0.2.15","TCP","54","443  >  38684 [RST, ACK] Seq=4073395004 Ack=65 Win=0 Len=0"
"201","49.976888","10.0.2.15","157.240.196.60","TLSv1.2","143","Application Data"
"202","49.977516","157.240.196.60","10.0.2.15","TCP","54","443  >  43620 [ACK] Seq=41535 Ack=3075 Win=65535 Len=0"
"203","70.332852","10.0.2.15","157.240.196.60","TLSv1.2","124","Application Data"
"204","70.334820","157.240.196.60","10.0.2.15","TCP","54","443  >  43620 [ACK] Seq=41535 Ack=3145 Win=65535 Len=0"
"205","70.475605","157.240.196.60","10.0.2.15","TLSv1.2","126","Application Data"
"206","70.475676","10.0.2.15","157.240.196.60","TCP","54","43620  >  443 [ACK] Seq=3145 Ack=41607 Win=65535 Len=0"
"207","72.807301","10.0.2.15","157.240.195.56","TCP","74","45396  >  443 [SYN] Seq=0 Win=64240 Len=0 MSS=1460 SACK_PERM TSval=3538030205 TSecr=0 WS=128"
"208","72.859357","157.240.195.56","10.0.2.15","TCP","58","443  >  45396 [SYN, ACK] Seq=0 Ack=1 Win=65535 Len=0 MSS=1460"
"209","72.859587","10.0.2.15","157.240.195.56","TCP","54","45396  >  443 [ACK] Seq=1 Ack=1 Win=64240 Len=0"
"210","72.864687","10.0.2.15","157.240.195.56","TLSv1.3","614","Client Hello"
"211","72.865577","157.240.195.56","10.0.2.15","TCP","54","443  >  45396 [ACK] Seq=1 Ack=561 Win=65535 Len=0"
"212","72.923344","157.240.195.56","10.0.2.15","TLSv1.3","266","Server Hello, Change Cipher Spec, Application Data"
"213","72.923370","10.0.2.15","157.240.195.56","TCP","54","45396  >  443 [ACK] Seq=561 Ack=213 Win=64028 Len=0"
"214","72.924183","10.0.2.15","157.240.195.56","TLSv1.3","118","Change Cipher Spec, Application Data"
"215","72.924627","10.0.2.15","157.240.195.56","TLSv1.3","224","Application Data"
"216","72.924733","10.0.2.15","157.240.195.56","TLSv1.3","332","Application Data"
"217","72.925043","157.240.195.56","10.0.2.15","TCP","54","443  >  45396 [ACK] Seq=213 Ack=625 Win=65535 Len=0"
"218","72.925043","157.240.195.56","10.0.2.15","TCP","54","443  >  45396 [ACK] Seq=213 Ack=795 Win=65535 Len=0"
"219","72.925043","157.240.195.56","10.0.2.15","TCP","54","443  >  45396 [ACK] Seq=213 Ack=1073 Win=65535 Len=0"
"220","72.976662","157.240.195.56","10.0.2.15","TLSv1.3","225","Application Data"
"221","72.976662","157.240.195.56","10.0.2.15","TLSv1.3","128","Application Data"
"222","72.976662","157.240.195.56","10.0.2.15","TLSv1.3","85","Application Data"
"223","72.978757","157.240.195.56","10.0.2.15","TLSv1.3","89","Application Data"
"224","72.979567","10.0.2.15","157.240.195.56","TLSv1.3","85","Application Data"
"225","72.981471","157.240.195.56","10.0.2.15","TCP","54","443  >  45396 [ACK] Seq=524 Ack=1104 Win=65535 Len=0"
"226","73.029632","157.240.195.56","10.0.2.15","TCP","1446","443  >  45396 [PSH, ACK] Seq=524 Ack=1104 Win=65535 Len=1392 [TCP segment of a reassembled PDU]"
"227","73.029633","157.240.195.56","10.0.2.15","TLSv1.3","287","Application Data, Application Data"
"228","73.035934","10.0.2.15","157.240.195.56","TCP","54","45396  >  443 [ACK] Seq=1104 Ack=2149 Win=62640 Len=0"
"229","79.248740","157.240.196.60","10.0.2.15","TCP","1514","443  >  43620 [ACK] Seq=41607 Ack=3145 Win=65535 Len=1460 [TCP segment of a reassembled PDU]"
"230","79.249032","10.0.2.15","157.240.196.60","TCP","54","43620  >  443 [ACK] Seq=3145 Ack=43067 Win=65535 Len=0"
"231","79.250830","157.240.196.60","10.0.2.15","TLSv1.2","107","Application Data"
"232","79.250861","10.0.2.15","157.240.196.60","TCP","54","43620  >  443 [ACK] Seq=3145 Ack=43120 Win=65535 Len=0"
"233","79.253756","157.240.196.60","10.0.2.15","TLSv1.2","1400","Application Data"
"234","79.253792","10.0.2.15","157.240.196.60","TCP","54","43620  >  443 [ACK] Seq=3145 Ack=44466 Win=65535 Len=0"
"235","80.659913","10.0.2.15","157.240.196.60","TLSv1.2","143","Application Data"
"236","80.660454","157.240.196.60","10.0.2.15","TCP","54","443  >  43620 [ACK] Seq=44466 Ack=3234 Win=65535 Len=0"
"237","89.153301","10.0.2.15","157.240.196.60","TLSv1.2","124","Application Data"
"238","89.154500","157.240.196.60","10.0.2.15","TCP","54","443  >  43620 [ACK] Seq=44466 Ack=3304 Win=65535 Len=0"
"239","89.296053","157.240.196.60","10.0.2.15","TLSv1.2","126","Application Data"
"240","89.296083","10.0.2.15","157.240.196.60","TCP","54","43620  >  443 [ACK] Seq=3304 Ack=44538 Win=65535 Len=0"
"241","94.480155","10.0.2.15","10.0.0.138","DNS","100","Standard query 0x186a AAAA connectivity-check.ubuntu.com OPT"
"242","94.493406","10.0.0.138","10.0.2.15","DNS","332","Standard query response 0x186a AAAA connectivity-check.ubuntu.com AAAA 2620:2d:4000:1::23 AAAA 2620:2d:4000:1::2a AAAA 2620:2d:4000:1::2b AAAA 2001:67c:1562::23 AAAA 2620:2d:4000:1::22 AAAA 2001:67c:1562::24 NS ns2.canonical.com NS ns1.canonical.com NS ns3.canonical.com OPT"
"243","101.587432","157.240.196.60","10.0.2.15","TLSv1.2","1504","Application Data"
"244","101.587753","10.0.2.15","157.240.196.60","TCP","54","43620  >  443 [ACK] Seq=3304 Ack=45988 Win=65535 Len=0"
"245","101.589176","157.240.196.60","10.0.2.15","TLSv1.2","1741","Application Data, Application Data"
"246","101.589211","10.0.2.15","157.240.196.60","TCP","54","43620  >  443 [ACK] Seq=3304 Ack=47675 Win=65535 Len=0"
"247","102.027056","157.240.196.60","10.0.2.15","TLSv1.2","238","Application Data"
"248","102.027079","10.0.2.15","157.240.196.60","TCP","54","43620  >  443 [ACK] Seq=3304 Ack=47859 Win=65535 Len=0"
"249","102.603023","10.0.2.15","157.240.196.60","TLSv1.2","143","Application Data"
"250","102.604826","157.240.196.60","10.0.2.15","TCP","54","443  >  43620 [ACK] Seq=47859 Ack=3393 Win=65535 Len=0"
"251","103.181359","10.0.2.15","157.240.196.60","TLSv1.2","126","Application Data"
"252","103.182335","157.240.196.60","10.0.2.15","TCP","54","443  >  43620 [ACK] Seq=47859 Ack=3465 Win=65535 Len=0"
"253","108.325589","157.240.196.60","10.0.2.15","TCP","1514","443  >  43620 [ACK] Seq=47859 Ack=3465 Win=65535 Len=1460 [TCP segment of a reassembled PDU]"
"254","108.325994","10.0.2.15","157.240.196.60","TCP","54","43620  >  443 [ACK] Seq=3465 Ack=49319 Win=65535 Len=0"
"255","108.327545","157.240.196.60","10.0.2.15","TLSv1.2","1843","Application Data, Application Data, Application Data"
"256","108.327583","10.0.2.15","157.240.196.60","TCP","54","43620  >  443 [ACK] Seq=3465 Ack=51108 Win=65535 Len=0"
"257","108.958168","10.0.2.15","157.240.196.60","TLSv1.2","143","Application Data"
"258","108.972270","157.240.196.60","10.0.2.15","TCP","54","443  >  43620 [ACK] Seq=51108 Ack=3554 Win=65535 Len=0"
"259","113.838494","157.240.196.60","10.0.2.15","TCP","1446","443  >  43620 [PSH, ACK] Seq=51108 Ack=3554 Win=65535 Len=1392 [TCP segment of a reassembled PDU]"
"260","113.838588","10.0.2.15","157.240.196.60","TCP","54","43620  >  443 [ACK] Seq=3554 Ack=52500 Win=65535 Len=0"
"261","113.838924","157.240.196.60","10.0.2.15","TLSv1.2","2199","Application Data, Application Data, Application Data"
"262","113.838934","10.0.2.15","157.240.196.60","TCP","54","43620  >  443 [ACK] Seq=3554 Ack=54645 Win=65535 Len=0"
"263","115.368124","10.0.2.15","157.240.196.60","TLSv1.2","143","Application Data"
"264","115.368697","157.240.196.60","10.0.2.15","TCP","54","443  >  43620 [ACK] Seq=54645 Ack=3643 Win=65535 Len=0"
"265","116.855326","10.0.2.15","157.240.196.60","TLSv1.2","124","Application Data"
"266","116.858205","157.240.196.60","10.0.2.15","TCP","54","443  >  43620 [ACK] Seq=54645 Ack=3713 Win=65535 Len=0"
"267","116.997547","157.240.196.60","10.0.2.15","TLSv1.2","126","Application Data"
"268","116.997606","10.0.2.15","157.240.196.60","TCP","54","43620  >  443 [ACK] Seq=3713 Ack=54717 Win=65535 Len=0"
"269","122.055703","157.240.196.60","10.0.2.15","TCP","1514","443  >  43620 [ACK] Seq=54717 Ack=3713 Win=65535 Len=1460 [TCP segment of a reassembled PDU]"
"270","122.055794","10.0.2.15","157.240.196.60","TCP","54","43620  >  443 [ACK] Seq=3713 Ack=56177 Win=65535 Len=0"
"271","122.057220","157.240.196.60","10.0.2.15","TLSv1.2","107","Application Data"
"272","122.057253","10.0.2.15","157.240.196.60","TCP","54","43620  >  443 [ACK] Seq=3713 Ack=56230 Win=65535 Len=0"
"273","122.059556","157.240.196.60","10.0.2.15","TLSv1.2","2222","Application Data, Application Data"
"274","122.059600","10.0.2.15","157.240.196.60","TCP","54","43620  >  443 [ACK] Seq=3713 Ack=58398 Win=65535 Len=0"
"275","123.840357","10.0.2.15","157.240.196.60","TLSv1.2","143","Application Data"
"276","123.840890","157.240.196.60","10.0.2.15","TCP","54","443  >  43620 [ACK] Seq=58398 Ack=3802 Win=65535 Len=0"
"277","125.177385","157.240.196.60","10.0.2.15","TLSv1.2","186","Application Data"
"278","125.177418","10.0.2.15","157.240.196.60","TCP","54","43620  >  443 [ACK] Seq=3802 Ack=58530 Win=65535 Len=0"
"279","125.180319","157.240.196.60","10.0.2.15","TLSv1.2","198","Application Data"
"280","125.180332","10.0.2.15","157.240.196.60","TCP","54","43620  >  443 [ACK] Seq=3802 Ack=58674 Win=65535 Len=0"
"281","125.182208","157.240.196.60","10.0.2.15","TLSv1.2","201","Application Data"
"282","125.182224","10.0.2.15","157.240.196.60","TCP","54","43620  >  443 [ACK] Seq=3802 Ack=58821 Win=65535 Len=0"
"283","125.184527","157.240.196.60","10.0.2.15","TLSv1.2","331","Application Data"
"284","125.184543","10.0.2.15","157.240.196.60","TCP","54","43620  >  443 [ACK] Seq=3802 Ack=59098 Win=65535 Len=0"
"285","125.185060","157.240.196.60","10.0.2.15","TLSv1.2","230","Application Data"
"286","125.185070","10.0.2.15","157.240.196.60","TCP","54","43620  >  443 [ACK] Seq=3802 Ack=59274 Win=65535 Len=0"
"287","125.186972","157.240.196.60","10.0.2.15","TLSv1.2","181","Application Data"
"288","125.186987","10.0.2.15","157.240.196.60","TCP","54","43620  >  443 [ACK] Seq=3802 Ack=59401 Win=65535 Len=0"
"289","125.188884","157.240.196.60","10.0.2.15","TLSv1.2","219","Application Data"
"290","125.188905","10.0.2.15","157.240.196.60","TCP","54","43620  >  443 [ACK] Seq=3802 Ack=59566 Win=65535 Len=0"
"291","125.207582","157.240.196.60","10.0.2.15","TLSv1.2","195","Application Data"
"292","125.207607","10.0.2.15","157.240.196.60","TCP","54","43620  >  443 [ACK] Seq=3802 Ack=59707 Win=65535 Len=0"
"293","125.207583","157.240.196.60","10.0.2.15","TLSv1.2","188","Application Data"
"294","125.208108","10.0.2.15","157.240.196.60","TCP","54","43620  >  443 [ACK] Seq=3802 Ack=59841 Win=65535 Len=0"
"295","125.207583","157.240.196.60","10.0.2.15","TLSv1.2","186","Application Data"
"296","125.208622","10.0.2.15","157.240.196.60","TCP","54","43620  >  443 [ACK] Seq=3802 Ack=59973 Win=65535 Len=0"
"297","125.207583","157.240.196.60","10.0.2.15","TLSv1.2","186","Application Data"
"298","125.208627","10.0.2.15","157.240.196.60","TCP","54","43620  >  443 [ACK] Seq=3802 Ack=60105 Win=65535 Len=0"
"299","125.207583","157.240.196.60","10.0.2.15","TLSv1.2","241","Application Data"
"300","125.208630","10.0.2.15","157.240.196.60","TCP","54","43620  >  443 [ACK] Seq=3802 Ack=60292 Win=65535 Len=0"
"301","125.207583","157.240.196.60","10.0.2.15","TLSv1.2","186","Application Data"
"302","125.208632","10.0.2.15","157.240.196.60","TCP","54","43620  >  443 [ACK] Seq=3802 Ack=60424 Win=65535 Len=0"
"303","125.207583","157.240.196.60","10.0.2.15","TLSv1.2","186","Application Data"
"304","125.208636","10.0.2.15","157.240.196.60","TCP","54","43620  >  443 [ACK] Seq=3802 Ack=60556 Win=65535 Len=0"
"305","125.208646","157.240.196.60","10.0.2.15","TLSv1.2","186","Application Data"
"306","125.208649","10.0.2.15","157.240.196.60","TCP","54","43620  >  443 [ACK] Seq=3802 Ack=60688 Win=65535 Len=0"
"307","125.213825","157.240.196.60","10.0.2.15","TLSv1.2","183","Application Data"
"308","125.213840","10.0.2.15","157.240.196.60","TCP","54","43620  >  443 [ACK] Seq=3802 Ack=60817 Win=65535 Len=0"
"309","125.213825","157.240.196.60","10.0.2.15","TLSv1.2","198","Application Data"
"310","125.213907","10.0.2.15","157.240.196.60","TCP","54","43620  >  443 [ACK] Seq=3802 Ack=60961 Win=65535 Len=0"
"311","125.213825","157.240.196.60","10.0.2.15","TLSv1.2","198","Application Data"
"312","125.214198","10.0.2.15","157.240.196.60","TCP","54","43620  >  443 [ACK] Seq=3802 Ack=61105 Win=65535 Len=0"
"313","125.215417","157.240.196.60","10.0.2.15","TLSv1.2","188","Application Data"
"314","125.215428","10.0.2.15","157.240.196.60","TCP","54","43620  >  443 [ACK] Seq=3802 Ack=61239 Win=65535 Len=0"
"315","125.231957","157.240.196.60","10.0.2.15","TLSv1.2","198","Application Data"
"316","125.231982","10.0.2.15","157.240.196.60","TCP","54","43620  >  443 [ACK] Seq=3802 Ack=61383 Win=65535 Len=0"
"317","125.270273","10.0.2.15","157.240.196.60","TLSv1.2","151","Application Data"
"318","125.270485","10.0.2.15","157.240.196.60","TLSv1.2","157","Application Data"
"319","125.282514","157.240.196.60","10.0.2.15","TLSv1.2","2256","Application Data, Application Data"
"320","125.282538","10.0.2.15","157.240.196.60","TCP","54","43620  >  443 [ACK] Seq=4002 Ack=63585 Win=65535 Len=0"
"321","125.282514","157.240.196.60","10.0.2.15","TCP","54","443  >  43620 [ACK] Seq=63585 Ack=3899 Win=65535 Len=0"
"322","125.282514","157.240.196.60","10.0.2.15","TCP","54","443  >  43620 [ACK] Seq=63585 Ack=4002 Win=65535 Len=0"
"323","125.282514","157.240.196.60","10.0.2.15","TLSv1.2","825","Application Data"
"324","125.283142","10.0.2.15","157.240.196.60","TCP","54","43620  >  443 [ACK] Seq=4002 Ack=64356 Win=65535 Len=0"
"325","125.282514","157.240.196.60","10.0.2.15","TLSv1.2","964","Application Data"
"326","125.283778","10.0.2.15","157.240.196.60","TCP","54","43620  >  443 [ACK] Seq=4002 Ack=65266 Win=65535 Len=0"
"327","125.282514","157.240.196.60","10.0.2.15","TLSv1.2","183","Application Data"
"328","125.283782","10.0.2.15","157.240.196.60","TCP","54","43620  >  443 [ACK] Seq=4002 Ack=65395 Win=65535 Len=0"
"329","125.282514","157.240.196.60","10.0.2.15","TLSv1.2","195","Application Data"
"330","125.283785","10.0.2.15","157.240.196.60","TCP","54","43620  >  443 [ACK] Seq=4002 Ack=65536 Win=65535 Len=0"
"331","125.283792","157.240.196.60","10.0.2.15","TLSv1.2","250","Application Data"
"332","125.283794","10.0.2.15","157.240.196.60","TCP","54","43620  >  443 [ACK] Seq=4002 Ack=65732 Win=65535 Len=0"
"333","125.283792","157.240.196.60","10.0.2.15","TLSv1.2","198","Application Data"
"334","125.283797","10.0.2.15","157.240.196.60","TCP","54","43620  >  443 [ACK] Seq=4002 Ack=65876 Win=65535 Len=0"
"335","125.283792","157.240.196.60","10.0.2.15","TLSv1.2","195","Application Data"
"336","125.283800","10.0.2.15","157.240.196.60","TCP","54","43620  >  443 [ACK] Seq=4002 Ack=66017 Win=65535 Len=0"
"337","125.283792","157.240.196.60","10.0.2.15","TLSv1.2","198","Application Data"
"338","125.283804","10.0.2.15","157.240.196.60","TCP","54","43620  >  443 [ACK] Seq=4002 Ack=66161 Win=65535 Len=0"
"339","125.293321","157.240.196.60","10.0.2.15","TLSv1.2","195","Application Data"
"340","125.293337","10.0.2.15","157.240.196.60","TCP","54","43620  >  443 [ACK] Seq=4002 Ack=66302 Win=65535 Len=0"
"341","125.293322","157.240.196.60","10.0.2.15","TLSv1.2","185","Application Data"
"342","125.311246","10.0.2.15","157.240.196.60","TCP","54","43620  >  443 [ACK] Seq=4002 Ack=66433 Win=65535 Len=0"
"343","125.293322","157.240.196.60","10.0.2.15","TLSv1.2","183","Application Data"
"344","125.311764","10.0.2.15","157.240.196.60","TCP","54","43620  >  443 [ACK] Seq=4002 Ack=66562 Win=65535 Len=0"
"345","125.293322","157.240.196.60","10.0.2.15","TLSv1.2","186","Application Data"
"346","125.311834","10.0.2.15","157.240.196.60","TCP","54","43620  >  443 [ACK] Seq=4002 Ack=66694 Win=65535 Len=0"
"347","125.293322","157.240.196.60","10.0.2.15","TLSv1.2","181","Application Data"
"348","125.311838","10.0.2.15","157.240.196.60","TCP","54","43620  >  443 [ACK] Seq=4002 Ack=66821 Win=65535 Len=0"
"349","125.293322","157.240.196.60","10.0.2.15","TLSv1.2","183","Application Data"
"350","125.311841","10.0.2.15","157.240.196.60","TCP","54","43620  >  443 [ACK] Seq=4002 Ack=66950 Win=65535 Len=0"
"351","125.311863","157.240.196.60","10.0.2.15","TLSv1.2","202","Application Data"
"352","125.311867","10.0.2.15","157.240.196.60","TCP","54","43620  >  443 [ACK] Seq=4002 Ack=67098 Win=65535 Len=0"
"353","125.311863","157.240.196.60","10.0.2.15","TLSv1.2","185","Application Data"
"354","125.311870","10.0.2.15","157.240.196.60","TCP","54","43620  >  443 [ACK] Seq=4002 Ack=67229 Win=65535 Len=0"
"355","125.311864","157.240.196.60","10.0.2.15","TLSv1.2","222","Application Data"
"356","125.311872","10.0.2.15","157.240.196.60","TCP","54","43620  >  443 [ACK] Seq=4002 Ack=67397 Win=65535 Len=0"
"357","125.311864","157.240.196.60","10.0.2.15","TLSv1.2","199","Application Data"
"358","125.311875","10.0.2.15","157.240.196.60","TCP","54","43620  >  443 [ACK] Seq=4002 Ack=67542 Win=65535 Len=0"
"359","125.311864","157.240.196.60","10.0.2.15","TLSv1.2","186","Application Data"
"360","125.311878","10.0.2.15","157.240.196.60","TCP","54","43620  >  443 [ACK] Seq=4002 Ack=67674 Win=65535 Len=0"
"361","125.311864","157.240.196.60","10.0.2.15","TLSv1.2","198","Application Data"
"362","125.311881","10.0.2.15","157.240.196.60","TCP","54","43620  >  443 [ACK] Seq=4002 Ack=67818 Win=65535 Len=0"
"363","125.311864","157.240.196.60","10.0.2.15","TLSv1.2","243","Application Data"
"364","125.311885","10.0.2.15","157.240.196.60","TCP","54","43620  >  443 [ACK] Seq=4002 Ack=68007 Win=65535 Len=0"
"365","125.311864","157.240.196.60","10.0.2.15","TLSv1.2","222","Application Data"
"366","125.311888","10.0.2.15","157.240.196.60","TCP","54","43620  >  443 [ACK] Seq=4002 Ack=68175 Win=65535 Len=0"
"367","125.311891","157.240.196.60","10.0.2.15","TLSv1.2","222","Application Data"
"368","125.311893","10.0.2.15","157.240.196.60","TCP","54","43620  >  443 [ACK] Seq=4002 Ack=68343 Win=65535 Len=0"
"369","125.311891","157.240.196.60","10.0.2.15","TLSv1.2","183","Application Data"
"370","125.311897","10.0.2.15","157.240.196.60","TCP","54","43620  >  443 [ACK] Seq=4002 Ack=68472 Win=65535 Len=0"
"371","125.311891","157.240.196.60","10.0.2.15","TLSv1.2","195","Application Data"
"372","125.319547","157.240.196.60","10.0.2.15","TLSv1.2","202","Application Data"
"373","125.319547","157.240.196.60","10.0.2.15","TLSv1.2","248","Application Data"
"374","125.319547","157.240.196.60","10.0.2.15","TLSv1.2","183","Application Data"
"375","125.319547","157.240.196.60","10.0.2.15","TLSv1.2","195","Application Data"
"376","125.321917","10.0.2.15","157.240.196.60","TCP","54","43620  >  443 [ACK] Seq=4002 Ack=69225 Win=65535 Len=0"
"377","125.327038","157.240.196.60","10.0.2.15","TLSv1.2","186","Application Data"
"378","125.327039","157.240.196.60","10.0.2.15","TLSv1.2","275","Application Data"
"379","125.327039","157.240.196.60","10.0.2.15","TLSv1.2","202","Application Data"
"380","125.327039","157.240.196.60","10.0.2.15","TLSv1.2","198","Application Data"
"381","125.336137","157.240.196.60","10.0.2.15","TLSv1.2","185","Application Data"
"382","125.336137","157.240.196.60","10.0.2.15","TLSv1.2","195","Application Data"
"383","125.336137","157.240.196.60","10.0.2.15","TLSv1.2","199","Application Data"
"384","125.336137","157.240.196.60","10.0.2.15","TLSv1.2","185","Application Data"
"385","125.336137","157.240.196.60","10.0.2.15","TLSv1.2","198","Application Data"
"386","125.341019","10.0.2.15","157.240.196.60","TCP","54","43620  >  443 [ACK] Seq=4002 Ack=70562 Win=65535 Len=0"
"387","125.370006","157.240.196.60","10.0.2.15","TCP","1446","443  >  43620 [PSH, ACK] Seq=70562 Ack=4002 Win=65535 Len=1392 [TCP segment of a reassembled PDU]"
"388","125.370031","10.0.2.15","157.240.196.60","TCP","54","43620  >  443 [ACK] Seq=4002 Ack=71954 Win=65535 Len=0"
"389","125.370006","157.240.196.60","10.0.2.15","TLSv1.2","841","Application Data, Application Data"
"390","125.400846","10.0.2.15","157.240.196.60","TCP","54","43620  >  443 [ACK] Seq=4002 Ack=72741 Win=65535 Len=0"
"391","125.370007","157.240.196.60","10.0.2.15","TLSv1.2","241","Application Data"
"392","125.370007","157.240.196.60","10.0.2.15","TLSv1.2","183","Application Data"
"393","125.370007","157.240.196.60","10.0.2.15","TLSv1.2","186","Application Data"
"394","125.370007","157.240.196.60","10.0.2.15","TLSv1.2","186","Application Data"
"395","125.401898","157.240.196.60","10.0.2.15","TLSv1.2","186","Application Data"
"396","125.401899","157.240.196.60","10.0.2.15","TLSv1.2","185","Application Data"
"397","125.401899","157.240.196.60","10.0.2.15","TLSv1.2","195","Application Data"
"398","125.401899","157.240.196.60","10.0.2.15","TLSv1.2","181","Application Data"
"399","125.401899","157.240.196.60","10.0.2.15","TLSv1.2","198","Application Data"
"400","125.401899","157.240.196.60","10.0.2.15","TLSv1.2","222","Application Data"
"401","125.401899","157.240.196.60","10.0.2.15","TLSv1.2","198","Application Data"
"402","125.401918","10.0.2.15","157.240.196.60","TCP","54","43620  >  443 [ACK] Seq=4002 Ack=74308 Win=65535 Len=0"
"403","125.401899","157.240.196.60","10.0.2.15","TLSv1.2","214","Application Data"
"404","125.401989","157.240.196.60","10.0.2.15","TLSv1.2","186","Application Data"
"405","125.401990","157.240.196.60","10.0.2.15","TLSv1.2","188","Application Data"
"406","125.401990","157.240.196.60","10.0.2.15","TLSv1.2","198","Application Data"
"407","125.401990","157.240.196.60","10.0.2.15","TLSv1.2","183","Application Data"
"408","125.401990","157.240.196.60","10.0.2.15","TLSv1.2","185","Application Data"
"409","125.401990","157.240.196.60","10.0.2.15","TLSv1.2","183","Application Data"
"410","125.401990","157.240.196.60","10.0.2.15","TLSv1.2","198","Application Data"
"411","125.401990","157.240.196.60","10.0.2.15","TLSv1.2","476","Application Data"
"412","125.402003","10.0.2.15","157.240.196.60","TCP","54","43620  >  443 [ACK] Seq=4002 Ack=75833 Win=65535 Len=0"
"413","125.402224","157.240.196.60","10.0.2.15","TLSv1.2","183","Application Data"
"414","125.402224","157.240.196.60","10.0.2.15","TLSv1.2","185","Application Data"
"415","125.402261","10.0.2.15","157.240.196.60","TCP","54","43620  >  443 [ACK] Seq=4002 Ack=76093 Win=65535 Len=0"
"416","125.405542","157.240.196.60","10.0.2.15","TLSv1.2","330","Application Data, Application Data"
"417","125.405557","10.0.2.15","157.240.196.60","TCP","54","43620  >  443 [ACK] Seq=4002 Ack=76369 Win=65535 Len=0"
"418","125.405542","157.240.196.60","10.0.2.15","TLSv1.2","195","Application Data"
"419","125.406280","10.0.2.15","157.240.196.60","TCP","54","43620  >  443 [ACK] Seq=4002 Ack=76510 Win=65535 Len=0"
"420","125.410747","157.240.196.60","10.0.2.15","TLSv1.2","186","Application Data"
"421","125.410747","157.240.196.60","10.0.2.15","TLSv1.2","202","Application Data"
"422","125.413774","10.0.2.15","157.240.196.60","TCP","54","43620  >  443 [ACK] Seq=4002 Ack=76790 Win=65535 Len=0"
"423","125.433031","10.0.2.15","157.240.196.60","TLSv1.2","149","Application Data"
"424","125.435005","157.240.196.60","10.0.2.15","TCP","54","443  >  43620 [ACK] Seq=76790 Ack=4097 Win=65535 Len=0"
"425","125.436703","10.0.2.15","157.240.196.60","TLSv1.2","154","Application Data"
"426","125.437257","157.240.196.60","10.0.2.15","TCP","54","443  >  43620 [ACK] Seq=76790 Ack=4197 Win=65535 Len=0"
"427","125.439718","10.0.2.15","157.240.196.60","TLSv1.2","150","Application Data"
"428","125.440200","10.0.2.15","157.240.196.60","TLSv1.2","247","Application Data, Application Data"
"429","125.440304","10.0.2.15","157.240.196.60","TLSv1.2","252","Application Data, Application Data"
"430","125.443750","157.240.196.60","10.0.2.15","TCP","54","443  >  43620 [ACK] Seq=76790 Ack=4293 Win=65535 Len=0"
"431","125.443769","10.0.2.15","157.240.196.60","TLSv1.2","151","Application Data"
"432","125.443750","157.240.196.60","10.0.2.15","TCP","54","443  >  43620 [ACK] Seq=76790 Ack=4486 Win=65535 Len=0"
"433","125.443750","157.240.196.60","10.0.2.15","TCP","54","443  >  43620 [ACK] Seq=76790 Ack=4684 Win=65535 Len=0"
"434","125.451510","157.240.196.60","10.0.2.15","TCP","54","443  >  43620 [ACK] Seq=76790 Ack=4781 Win=65535 Len=0"
"435","125.483146","10.0.2.15","157.240.196.60","TLSv1.2","151","Application Data"
"436","125.483254","10.0.2.15","157.240.196.60","TLSv1.2","154","Application Data"
"437","125.483339","10.0.2.15","157.240.196.60","TLSv1.2","248","Application Data, Application Data"
"438","125.483438","10.0.2.15","157.240.196.60","TLSv1.2","348","Application Data, Application Data, Application Data"
"439","125.488442","157.240.196.60","10.0.2.15","TCP","54","443  >  43620 [ACK] Seq=76790 Ack=4878 Win=65535 Len=0"
"440","125.488442","157.240.196.60","10.0.2.15","TCP","54","443  >  43620 [ACK] Seq=76790 Ack=4978 Win=65535 Len=0"
"441","125.488442","157.240.196.60","10.0.2.15","TCP","54","443  >  43620 [ACK] Seq=76790 Ack=5172 Win=65535 Len=0"
"442","125.488442","157.240.196.60","10.0.2.15","TCP","54","443  >  43620 [ACK] Seq=76790 Ack=5466 Win=65535 Len=0"
"443","125.494609","10.0.2.15","157.240.196.60","TLSv1.2","157","Application Data"
"444","125.495040","157.240.196.60","10.0.2.15","TCP","54","443  >  43620 [ACK] Seq=76790 Ack=5569 Win=65535 Len=0"
"445","125.495056","10.0.2.15","157.240.196.60","TLSv1.2","152","Application Data"
"446","125.495475","157.240.196.60","10.0.2.15","TCP","54","443  >  43620 [ACK] Seq=76790 Ack=5667 Win=65535 Len=0"
"447","125.618745","157.240.196.60","10.0.2.15","TLSv1.2","136","Application Data"
"448","125.665258","10.0.2.15","157.240.196.60","TCP","54","43620  >  443 [ACK] Seq=5667 Ack=76872 Win=65535 Len=0"
"449","125.712039","10.0.2.15","157.240.196.60","TLSv1.2","157","Application Data"
"450","125.712635","157.240.196.60","10.0.2.15","TCP","54","443  >  43620 [ACK] Seq=76872 Ack=5770 Win=65535 Len=0"
"451","126.067792","10.0.2.15","157.240.196.60","TLSv1.2","133","Application Data"
"452","126.068432","157.240.196.60","10.0.2.15","TCP","54","443  >  43620 [ACK] Seq=76872 Ack=5849 Win=65535 Len=0"
"453","126.074101","10.0.2.15","157.240.196.60","TLSv1.2","157","Application Data"
"454","126.076596","157.240.196.60","10.0.2.15","TCP","54","443  >  43620 [ACK] Seq=76872 Ack=5952 Win=65535 Len=0"
"455","126.077403","10.0.2.15","157.240.196.60","TLSv1.2","157","Application Data"
"456","126.077532","10.0.2.15","157.240.196.60","TLSv1.2","248","Application Data, Application Data"
"457","126.077893","10.0.2.15","157.240.196.60","TLSv1.2","249","Application Data, Application Data"
"458","126.078080","10.0.2.15","157.240.196.60","TLSv1.2","331","Application Data, Application Data, Application Data"
"459","126.078199","10.0.2.15","157.240.196.60","TLSv1.2","351","Application Data, Application Data, Application Data"
"460","126.078409","10.0.2.15","157.240.196.60","TLSv1.2","451","Application Data, Application Data, Application Data, Application Data"
"461","126.078679","10.0.2.15","157.240.196.60","TLSv1.2","539","Application Data, Application Data, Application Data, Application Data, Application Data"
"462","126.078757","157.240.196.60","10.0.2.15","TCP","54","443  >  43620 [ACK] Seq=76872 Ack=6055 Win=65535 Len=0"
"463","126.078757","157.240.196.60","10.0.2.15","TCP","54","443  >  43620 [ACK] Seq=76872 Ack=6249 Win=65535 Len=0"
"464","126.078757","157.240.196.60","10.0.2.15","TCP","54","443  >  43620 [ACK] Seq=76872 Ack=6444 Win=65535 Len=0"
"465","126.078757","157.240.196.60","10.0.2.15","TCP","54","443  >  43620 [ACK] Seq=76872 Ack=6721 Win=65535 Len=0"
"466","126.078757","157.240.196.60","10.0.2.15","TCP","54","443  >  43620 [ACK] Seq=76872 Ack=7018 Win=65535 Len=0"
"467","126.078757","157.240.196.60","10.0.2.15","TCP","54","443  >  43620 [ACK] Seq=76872 Ack=7415 Win=65535 Len=0"
"468","126.079034","157.240.196.60","10.0.2.15","TCP","54","443  >  43620 [ACK] Seq=76872 Ack=7900 Win=65535 Len=0"
"469","126.078966","10.0.2.15","157.240.196.60","TLSv1.2","628","Application Data, Application Data, Application Data, Application Data, Application Data, Application Data"
"470","126.079117","10.0.2.15","157.240.196.60","TLSv1.2","148","Application Data"
"471","126.079199","10.0.2.15","157.240.196.60","TLSv1.2","154","Application Data"
"472","126.079281","10.0.2.15","157.240.196.60","TLSv1.2","243","Application Data, Application Data"
"473","126.079364","10.0.2.15","157.240.196.60","TLSv1.2","247","Application Data, Application Data"
"474","126.079447","10.0.2.15","157.240.196.60","TLSv1.2","257","Application Data, Application Data"
"475","126.079534","10.0.2.15","157.240.196.60","TLSv1.2","352","Application Data, Application Data, Application Data"
"476","126.079895","157.240.196.60","10.0.2.15","TCP","54","443  >  43620 [ACK] Seq=76872 Ack=8474 Win=65535 Len=0"
"477","126.079895","157.240.196.60","10.0.2.15","TCP","54","443  >  43620 [ACK] Seq=76872 Ack=8568 Win=65535 Len=0"
"478","126.079895","157.240.196.60","10.0.2.15","TCP","54","443  >  43620 [ACK] Seq=76872 Ack=8668 Win=65535 Len=0"
"479","126.079895","157.240.196.60","10.0.2.15","TCP","54","443  >  43620 [ACK] Seq=76872 Ack=8857 Win=65535 Len=0"
"480","126.079895","157.240.196.60","10.0.2.15","TCP","54","443  >  43620 [ACK] Seq=76872 Ack=9050 Win=65535 Len=0"
"481","126.079896","157.240.196.60","10.0.2.15","TCP","54","443  >  43620 [ACK] Seq=76872 Ack=9253 Win=65535 Len=0"
"482","126.079896","157.240.196.60","10.0.2.15","TCP","54","443  >  43620 [ACK] Seq=76872 Ack=9551 Win=65535 Len=0"
"483","126.087380","10.0.2.15","157.240.196.60","TLSv1.2","148","Application Data"
"484","126.087543","10.0.2.15","157.240.196.60","TLSv1.2","151","Application Data"
"485","126.087631","10.0.2.15","157.240.196.60","TLSv1.2","241","Application Data, Application Data"
"486","126.089384","10.0.2.15","157.240.196.60","TLSv1.2","333","Application Data, Application Data, Application Data"
"487","126.095320","157.240.196.60","10.0.2.15","TCP","54","443  >  43620 [ACK] Seq=76872 Ack=9645 Win=65535 Len=0"
"488","126.095320","157.240.196.60","10.0.2.15","TCP","54","443  >  43620 [ACK] Seq=76872 Ack=9742 Win=65535 Len=0"
"489","126.095320","157.240.196.60","10.0.2.15","TCP","54","443  >  43620 [ACK] Seq=76872 Ack=9929 Win=65535 Len=0"
"490","126.095320","157.240.196.60","10.0.2.15","TCP","54","443  >  43620 [ACK] Seq=76872 Ack=10208 Win=65535 Len=0"
"491","126.105423","10.0.2.15","157.240.196.60","TLSv1.2","148","Application Data"
"492","126.107743","10.0.2.15","157.240.196.60","TLSv1.2","151","Application Data"
"493","126.108280","10.0.2.15","157.240.196.60","TLSv1.2","157","Application Data"
"494","126.108922","157.240.196.60","10.0.2.15","TCP","54","443  >  43620 [ACK] Seq=76872 Ack=10302 Win=65535 Len=0"
"495","126.116743","157.240.196.60","10.0.2.15","TCP","54","443  >  43620 [ACK] Seq=76872 Ack=10399 Win=65535 Len=0"
"496","126.116758","10.0.2.15","157.240.196.60","TLSv1.2","250","Application Data, Application Data"
"497","126.116743","157.240.196.60","10.0.2.15","TCP","54","443  >  43620 [ACK] Seq=76872 Ack=10502 Win=65535 Len=0"
"498","126.124549","157.240.196.60","10.0.2.15","TCP","54","443  >  43620 [ACK] Seq=76872 Ack=10698 Win=65535 Len=0"
"499","126.128943","10.0.2.15","157.240.196.60","TLSv1.2","157","Application Data"
"500","126.129047","10.0.2.15","157.240.196.60","TLSv1.2","248","Application Data, Application Data"
"501","126.129545","157.240.196.60","10.0.2.15","TCP","54","443  >  43620 [ACK] Seq=76872 Ack=10801 Win=65535 Len=0"
"502","126.129560","10.0.2.15","157.240.196.60","TLSv1.2","149","Application Data"
"503","126.129545","157.240.196.60","10.0.2.15","TCP","54","443  >  43620 [ACK] Seq=76872 Ack=10995 Win=65535 Len=0"
"504","126.129945","10.0.2.15","157.240.196.60","TLSv1.2","243","Application Data, Application Data"
"505","126.130379","157.240.196.60","10.0.2.15","TCP","54","443  >  43620 [ACK] Seq=76872 Ack=11090 Win=65535 Len=0"
"506","126.130380","157.240.196.60","10.0.2.15","TCP","54","443  >  43620 [ACK] Seq=76872 Ack=11279 Win=65535 Len=0"
"507","126.130412","10.0.2.15","157.240.196.60","TLSv1.2","154","Application Data"
"508","126.130830","10.0.2.15","157.240.196.60","TLSv1.2","247","Application Data, Application Data"
"509","126.147462","157.240.196.60","10.0.2.15","TCP","54","443  >  43620 [ACK] Seq=76872 Ack=11379 Win=65535 Len=0"
"510","126.147492","10.0.2.15","157.240.196.60","TLSv1.2","543","Application Data, Application Data, Application Data, Application Data, Application Data"
"511","126.147462","157.240.196.60","10.0.2.15","TCP","54","443  >  43620 [ACK] Seq=76872 Ack=11572 Win=65535 Len=0"
"512","126.156144","157.240.196.60","10.0.2.15","TCP","54","443  >  43620 [ACK] Seq=76872 Ack=12061 Win=65535 Len=0"
"513","126.166206","10.0.2.15","157.240.196.60","TLSv1.2","149","Application Data"
"514","126.173891","10.0.2.15","157.240.196.60","TLSv1.2","157","Application Data"
"515","126.174475","10.0.2.15","157.240.196.60","TLSv1.2","249","Application Data, Application Data"
"516","126.184198","157.240.196.60","10.0.2.15","TCP","54","443  >  43620 [ACK] Seq=76872 Ack=12156 Win=65535 Len=0"
"517","126.184220","10.0.2.15","157.240.196.60","TLSv1.2","1626","Application Data, Application Data, Application Data, Application Data, Application Data, Application Data, Application Data, Application Data, Application Data, Application Data, Application Data, Application Data, Application Data, Application Data, Application Data, Application Data"
"518","126.184198","157.240.196.60","10.0.2.15","TCP","54","443  >  43620 [ACK] Seq=76872 Ack=12259 Win=65535 Len=0"
"519","126.184198","157.240.196.60","10.0.2.15","TCP","54","443  >  43620 [ACK] Seq=76872 Ack=12454 Win=65535 Len=0"
"520","126.194529","157.240.196.60","10.0.2.15","TCP","54","443  >  43620 [ACK] Seq=76872 Ack=13914 Win=65535 Len=0"
"521","126.194548","10.0.2.15","157.240.196.60","TLSv1.2","148","Application Data"
"522","126.194529","157.240.196.60","10.0.2.15","TCP","54","443  >  43620 [ACK] Seq=76872 Ack=14026 Win=65535 Len=0"
"523","126.208902","157.240.196.60","10.0.2.15","TCP","54","443  >  43620 [ACK] Seq=76872 Ack=14120 Win=65535 Len=0"
"524","126.222713","10.0.2.15","157.240.196.60","TLSv1.2","151","Application Data"
"525","126.229702","157.240.196.60","10.0.2.15","TCP","54","443  >  43620 [ACK] Seq=76872 Ack=14217 Win=65535 Len=0"
"526","126.256471","10.0.2.15","157.240.196.60","TLSv1.2","151","Application Data"
"527","126.257009","10.0.2.15","157.240.196.60","TLSv1.2","246","Application Data, Application Data"
"528","126.265160","157.240.196.60","10.0.2.15","TCP","54","443  >  43620 [ACK] Seq=76872 Ack=14314 Win=65535 Len=0"
"529","126.265184","10.0.2.15","157.240.196.60","TLSv1.2","851","Application Data, Application Data, Application Data, Application Data, Application Data, Application Data, Application Data, Application Data"
"530","126.265160","157.240.196.60","10.0.2.15","TCP","54","443  >  43620 [ACK] Seq=76872 Ack=14506 Win=65535 Len=0"
"531","126.265252","10.0.2.15","157.240.196.60","TLSv1.2","157","Application Data"
"532","126.272451","10.0.2.15","157.240.196.60","TLSv1.2","243","Application Data, Application Data"
"533","126.273010","10.0.2.15","157.240.196.60","TLSv1.2","251","Application Data, Application Data"
"534","126.283714","157.240.196.60","10.0.2.15","TCP","54","443  >  43620 [ACK] Seq=76872 Ack=15303 Win=65535 Len=0"
"535","126.283737","10.0.2.15","157.240.196.60","TLSv1.2","840","Application Data, Application Data, Application Data, Application Data, Application Data, Application Data, Application Data, Application Data"
"536","126.283714","157.240.196.60","10.0.2.15","TCP","54","443  >  43620 [ACK] Seq=76872 Ack=15406 Win=65535 Len=0"
"537","126.283714","157.240.196.60","10.0.2.15","TCP","54","443  >  43620 [ACK] Seq=76872 Ack=15595 Win=65535 Len=0"
"538","126.283714","157.240.196.60","10.0.2.15","TCP","54","443  >  43620 [ACK] Seq=76872 Ack=15792 Win=65535 Len=0"
"539","126.289967","157.240.196.60","10.0.2.15","TCP","54","443  >  43620 [ACK] Seq=76872 Ack=16578 Win=65535 Len=0"
"540","126.303935","10.0.2.15","157.240.196.60","TLSv1.2","122","Application Data"
"541","126.312389","157.240.196.60","10.0.2.15","TCP","54","443  >  43620 [ACK] Seq=76872 Ack=16646 Win=65535 Len=0"
"542","129.019328","10.0.2.15","157.240.196.60","TLSv1.2","149","Application Data"
"543","129.019892","157.240.196.60","10.0.2.15","TCP","54","443  >  43620 [ACK] Seq=76872 Ack=16741 Win=65535 Len=0"
"544","129.038808","10.0.2.15","10.0.0.138","DNS","87","Standard query 0x83c9 A web.whatsapp.com OPT"
"545","129.038958","10.0.2.15","10.0.0.138","DNS","87","Standard query 0x983c AAAA web.whatsapp.com OPT"
"546","129.055302","10.0.0.138","10.0.2.15","DNS","140","Standard query response 0x83c9 A web.whatsapp.com CNAME mmx-ds.cdn.whatsapp.net A 157.240.195.56 OPT"
"547","129.057337","10.0.0.138","10.0.2.15","DNS","152","Standard query response 0x983c AAAA web.whatsapp.com CNAME mmx-ds.cdn.whatsapp.net AAAA 2a03:2880:f242:c8:face:b00c:0:167 OPT"
"548","129.221796","157.240.196.60","10.0.2.15","TLSv1.2","388","Application Data"
"549","129.221821","10.0.2.15","157.240.196.60","TCP","54","43620  >  443 [ACK] Seq=16741 Ack=77206 Win=65535 Len=0"
"550","129.546987","fe80::422e:3b36:b882:4dba","ff02::fb","MDNS","107","Standard query 0x0000 PTR _ipp._tcp.local, ""QM"" question PTR _ipps._tcp.local, ""QM"" question"
"551","129.571024","10.0.2.15","224.0.0.251","MDNS","87","Standard query 0x0000 PTR _ipp._tcp.local, ""QM"" question PTR _ipps._tcp.local, ""QM"" question"
"552","130.886951","157.240.196.60","10.0.2.15","TCP","1514","443  >  43620 [ACK] Seq=77206 Ack=16741 Win=65535 Len=1460 [TCP segment of a reassembled PDU]"
"553","130.887053","10.0.2.15","157.240.196.60","TCP","54","43620  >  443 [ACK] Seq=16741 Ack=78666 Win=65535 Len=0"
"554","130.887362","157.240.196.60","10.0.2.15","TLSv1.2","2099","Application Data, Application Data, Application Data"
"555","130.887372","10.0.2.15","157.240.196.60","TCP","54","43620  >  443 [ACK] Seq=16741 Ack=80711 Win=65535 Len=0"
"556","131.877123","10.0.2.15","157.240.195.56","TLSv1.3","93","Application Data"
"557","131.890630","157.240.195.56","10.0.2.15","TCP","54","443  >  45396 [ACK] Seq=2149 Ack=1143 Win=65535 Len=0"
"558","131.936428","157.240.195.56","10.0.2.15","TLSv1.3","93","Application Data"
"559","131.984669","10.0.2.15","157.240.195.56","TCP","54","45396  >  443 [ACK] Seq=1143 Ack=2188 Win=64032 Len=0"
"560","133.587322","157.240.196.60","10.0.2.15","TLSv1.2","181","Application Data"
"561","133.587347","10.0.2.15","157.240.196.60","TCP","54","43620  >  443 [ACK] Seq=16741 Ack=80838 Win=65535 Len=0"
"562","134.941861","10.0.2.15","157.240.196.60","TLSv1.2","147","Application Data"
"563","134.942300","157.240.196.60","10.0.2.15","TCP","54","443  >  43620 [ACK] Seq=80838 Ack=16834 Win=65535 Len=0"
"564","135.591571","10.0.2.15","157.240.196.60","TLSv1.2","143","Application Data"
"565","135.600436","157.240.196.60","10.0.2.15","TCP","54","443  >  43620 [ACK] Seq=80838 Ack=16923 Win=65535 Len=0"
"566","136.107404","157.240.196.60","10.0.2.15","TLSv1.2","1567","Application Data"
"567","136.107434","10.0.2.15","157.240.196.60","TCP","54","43620  >  443 [ACK] Seq=16923 Ack=82351 Win=65535 Len=0"
"568","136.114981","157.240.196.60","10.0.2.15","TLSv1.2","2046","Application Data, Application Data"
"569","136.114995","10.0.2.15","157.240.196.60","TCP","54","43620  >  443 [ACK] Seq=16923 Ack=84343 Win=65535 Len=0"
"570","136.416554","157.240.196.60","10.0.2.15","TLSv1.2","181","Application Data"
"571","136.416582","10.0.2.15","157.240.196.60","TCP","54","43620  >  443 [ACK] Seq=16923 Ack=84470 Win=65535 Len=0"
"572","136.678011","10.0.2.15","157.240.196.60","TLSv1.2","147","Application Data"
"573","136.678600","157.240.196.60","10.0.2.15","TCP","54","443  >  43620 [ACK] Seq=84470 Ack=17016 Win=65535 Len=0"
"574","139.072650","10.0.2.15","157.240.196.60","TLSv1.2","143","Application Data"
"575","139.074862","157.240.196.60","10.0.2.15","TCP","54","443  >  43620 [ACK] Seq=84470 Ack=17105 Win=65535 Len=0"
"576","142.597030","157.240.196.60","10.0.2.15","TCP","1514","443  >  43620 [ACK] Seq=84470 Ack=17105 Win=65535 Len=1460 [TCP segment of a reassembled PDU]"
"577","142.597064","10.0.2.15","157.240.196.60","TCP","54","43620  >  443 [ACK] Seq=17105 Ack=85930 Win=65535 Len=0"
"578","142.599871","157.240.196.60","10.0.2.15","TLSv1.2","107","Application Data"
"579","142.599885","10.0.2.15","157.240.196.60","TCP","54","43620  >  443 [ACK] Seq=17105 Ack=85983 Win=65535 Len=0"
"580","142.599871","157.240.196.60","10.0.2.15","TCP","1446","443  >  43620 [PSH, ACK] Seq=85983 Ack=17105 Win=65535 Len=1392 [TCP segment of a reassembled PDU]"
"581","142.605424","10.0.2.15","157.240.196.60","TCP","54","43620  >  443 [ACK] Seq=17105 Ack=87375 Win=65535 Len=0"
"582","142.599871","157.240.196.60","10.0.2.15","TLSv1.2","846","Application Data, Application Data"
"583","142.605968","10.0.2.15","157.240.196.60","TCP","54","43620  >  443 [ACK] Seq=17105 Ack=88167 Win=65535 Len=0"
"584","142.884260","157.240.196.60","10.0.2.15","TLSv1.2","181","Application Data"
"585","142.884290","10.0.2.15","157.240.196.60","TCP","54","43620  >  443 [ACK] Seq=17105 Ack=88294 Win=65535 Len=0"
"586","143.875328","10.0.2.15","157.240.196.60","TLSv1.2","147","Application Data"
"587","143.876032","157.240.196.60","10.0.2.15","TCP","54","443  >  43620 [ACK] Seq=88294 Ack=17198 Win=65535 Len=0"
"588","144.237366","10.0.2.15","157.240.196.60","TLSv1.2","143","Application Data"
"589","144.248060","157.240.196.60","10.0.2.15","TCP","54","443  >  43620 [ACK] Seq=88294 Ack=17287 Win=65535 Len=0"
"590","149.947757","10.0.2.15","157.240.196.60","TLSv1.2","124","Application Data"
"591","149.948489","157.240.196.60","10.0.2.15","TCP","54","443  >  43620 [ACK] Seq=88294 Ack=17357 Win=65535 Len=0"
"592","150.093826","157.240.196.60","10.0.2.15","TLSv1.2","126","Application Data"
"593","150.093883","10.0.2.15","157.240.196.60","TCP","54","43620  >  443 [ACK] Seq=17357 Ack=88366 Win=65535 Len=0"
"594","151.099976","157.240.196.60","10.0.2.15","TLSv1.2","1567","Application Data"
"595","151.100126","10.0.2.15","157.240.196.60","TCP","54","43620  >  443 [ACK] Seq=17357 Ack=89879 Win=65535 Len=0"
"596","151.099977","157.240.196.60","10.0.2.15","TLSv1.2","1934","Application Data, Application Data"
"597","151.100235","10.0.2.15","157.240.196.60","TCP","54","43620  >  443 [ACK] Seq=17357 Ack=91759 Win=65535 Len=0"
"598","151.363477","157.240.196.60","10.0.2.15","TLSv1.2","181","Application Data"
"599","151.363502","10.0.2.15","157.240.196.60","TCP","54","43620  >  443 [ACK] Seq=17357 Ack=91886 Win=65535 Len=0"
"600","151.504840","157.240.196.60","10.0.2.15","TLSv1.2","304","Application Data"
"601","151.504868","10.0.2.15","157.240.196.60","TCP","54","43620  >  443 [ACK] Seq=17357 Ack=92136 Win=65535 Len=0"
"602","153.057532","10.0.2.15","157.240.196.60","TLSv1.2","147","Application Data"
"603","153.088142","157.240.196.60","10.0.2.15","TCP","54","443  >  43620 [ACK] Seq=92136 Ack=17450 Win=65535 Len=0"
"604","153.090935","10.0.2.15","157.240.196.60","TLSv1.2","143","Application Data"
"605","153.094142","157.240.196.60","10.0.2.15","TCP","54","443  >  43620 [ACK] Seq=92136 Ack=17539 Win=65535 Len=0"
"606","154.670405","10.0.2.15","157.240.196.60","TLSv1.2","147","Application Data"
"607","154.671196","157.240.196.60","10.0.2.15","TCP","54","443  >  43620 [ACK] Seq=92136 Ack=17632 Win=65535 Len=0"
"608","154.816196","157.240.196.60","10.0.2.15","TLSv1.2","221","Application Data"
"609","154.816224","10.0.2.15","157.240.196.60","TCP","54","43620  >  443 [ACK] Seq=17632 Ack=92303 Win=65535 Len=0"
"610","154.863593","10.0.2.15","157.240.196.60","TLSv1.2","146","Application Data"
"611","154.870324","157.240.196.60","10.0.2.15","TCP","54","443  >  43620 [ACK] Seq=92303 Ack=17724 Win=65535 Len=0"
"612","154.876100","10.0.2.15","157.240.196.60","TLSv1.2","148","Application Data"
"613","154.876485","157.240.196.60","10.0.2.15","TCP","54","443  >  43620 [ACK] Seq=92303 Ack=17818 Win=65535 Len=0"
