"No.","Time","Source","Destination","Protocol","Length","Info"
"1","0.000000","10.0.2.15","157.240.196.60","TLSv1.2","143","Application Data"
"2","0.000717","157.240.196.60","10.0.2.15","TCP","54","443  >  59888 [ACK] Seq=1 Ack=90 Win=65535 Len=0"
"3","0.006702","157.240.196.60","10.0.2.15","TLSv1.2","294","Application Data"
"4","0.006728","10.0.2.15","157.240.196.60","TCP","54","59888  >  443 [ACK] Seq=90 Ack=241 Win=65535 Len=0"
"5","0.408621","157.240.196.60","10.0.2.15","TLSv1.2","310","Application Data"
"6","0.408652","10.0.2.15","157.240.196.60","TCP","54","59888  >  443 [ACK] Seq=90 Ack=497 Win=65535 Len=0"
"7","0.748441","10.0.2.15","157.240.196.60","TLSv1.2","143","Application Data"
"8","0.752444","157.240.196.60","10.0.2.15","TCP","54","443  >  59888 [ACK] Seq=497 Ack=179 Win=65535 Len=0"
"9","0.862629","10.0.2.15","157.240.196.60","TLSv1.2","143","Application Data"
"10","0.863163","157.240.196.60","10.0.2.15","TCP","54","443  >  59888 [ACK] Seq=497 Ack=268 Win=65535 Len=0"
"11","0.922398","157.240.196.60","10.0.2.15","TLSv1.2","310","Application Data"
"12","0.922422","10.0.2.15","157.240.196.60","TCP","54","59888  >  443 [ACK] Seq=268 Ack=753 Win=65535 Len=0"
"13","1.014151","10.0.2.15","157.240.196.60","TLSv1.2","143","Application Data"
"14","1.023939","157.240.196.60","10.0.2.15","TCP","54","443  >  59888 [ACK] Seq=753 Ack=357 Win=65535 Len=0"
"15","1.770770","157.240.196.60","10.0.2.15","TLSv1.2","310","Application Data"
"16","1.770897","10.0.2.15","157.240.196.60","TCP","54","59888  >  443 [ACK] Seq=357 Ack=1009 Win=65535 Len=0"
"17","1.830943","10.0.2.15","157.240.196.60","TLSv1.2","143","Application Data"
"18","1.831634","157.240.196.60","10.0.2.15","TCP","54","443  >  59888 [ACK] Seq=1009 Ack=446 Win=65535 Len=0"
"21","2.980191","157.240.196.60","10.0.2.15","TLSv1.2","310","Application Data"
"22","2.980317","10.0.2.15","157.240.196.60","TCP","54","59888  >  443 [ACK] Seq=446 Ack=1265 Win=65535 Len=0"
"23","3.103032","10.0.2.15","157.240.196.60","TLSv1.2","143","Application Data"
"24","3.103558","157.240.196.60","10.0.2.15","TCP","54","443  >  59888 [ACK] Seq=1265 Ack=535 Win=65535 Len=0"
"25","3.851619","10.0.2.15","157.240.196.60","TLSv1.2","123","Application Data"
"26","3.853253","157.240.196.60","10.0.2.15","TCP","54","443  >  59888 [ACK] Seq=1265 Ack=604 Win=65535 Len=0"
"27","3.997494","157.240.196.60","10.0.2.15","TLSv1.2","125","Application Data"
"28","3.997527","10.0.2.15","157.240.196.60","TCP","54","59888  >  443 [ACK] Seq=604 Ack=1336 Win=65535 Len=0"
"29","4.177192","157.240.196.60","10.0.2.15","TLSv1.2","310","Application Data"
"30","4.177324","10.0.2.15","157.240.196.60","TCP","54","59888  >  443 [ACK] Seq=604 Ack=1592 Win=65535 Len=0"
"31","4.264229","10.0.2.15","157.240.196.60","TLSv1.2","143","Application Data"
"32","4.271164","157.240.196.60","10.0.2.15","TCP","54","443  >  59888 [ACK] Seq=1592 Ack=693 Win=65535 Len=0"
"33","6.503373","157.240.196.60","10.0.2.15","TCP","1514","443  >  59888 [ACK] Seq=1592 Ack=693 Win=65535 Len=1460 [TCP segment of a reassembled PDU]"
"34","6.503555","10.0.2.15","157.240.196.60","TCP","54","59888  >  443 [ACK] Seq=693 Ack=3052 Win=65535 Len=0"
"35","6.504166","157.240.196.60","10.0.2.15","TLSv1.2","1515","Application Data, Application Data"
"36","6.504186","10.0.2.15","157.240.196.60","TCP","54","59888  >  443 [ACK] Seq=693 Ack=4513 Win=65535 Len=0"
"37","6.947196","10.0.2.15","157.240.196.60","TLSv1.2","143","Application Data"
"38","6.955263","157.240.196.60","10.0.2.15","TCP","54","443  >  59888 [ACK] Seq=4513 Ack=782 Win=65535 Len=0"
"39","8.315611","157.240.196.60","10.0.2.15","TLSv1.2","1663","Application Data, Application Data"
"40","8.317410","10.0.2.15","157.240.196.60","TCP","54","59888  >  443 [ACK] Seq=782 Ack=6122 Win=65535 Len=0"
"41","8.558724","10.0.2.15","157.240.196.60","TLSv1.2","143","Application Data"
"42","8.559526","157.240.196.60","10.0.2.15","TCP","54","443  >  59888 [ACK] Seq=6122 Ack=871 Win=65535 Len=0"
"43","11.068377","157.240.196.60","10.0.2.15","TLSv1.2","326","Application Data"
"44","11.068410","10.0.2.15","157.240.196.60","TCP","54","59888  >  443 [ACK] Seq=871 Ack=6394 Win=65535 Len=0"
"45","11.446595","10.0.2.15","157.240.196.60","TLSv1.2","143","Application Data"
"46","11.447121","157.240.196.60","10.0.2.15","TCP","54","443  >  59888 [ACK] Seq=6394 Ack=960 Win=65535 Len=0"
"47","12.473827","157.240.196.60","10.0.2.15","TLSv1.2","326","Application Data"
"48","12.473854","10.0.2.15","157.240.196.60","TCP","54","59888  >  443 [ACK] Seq=960 Ack=6666 Win=65535 Len=0"
"49","12.619819","10.0.2.15","157.240.196.60","TLSv1.2","143","Application Data"
"50","12.622500","157.240.196.60","10.0.2.15","TCP","54","443  >  59888 [ACK] Seq=6666 Ack=1049 Win=65535 Len=0"
"51","19.207487","157.240.196.60","10.0.2.15","TLSv1.2","342","Application Data"
"52","19.207581","10.0.2.15","157.240.196.60","TCP","54","59888  >  443 [ACK] Seq=1049 Ack=6954 Win=65535 Len=0"
"53","19.610969","10.0.2.15","157.240.196.60","TLSv1.2","143","Application Data"
"54","19.611359","157.240.196.60","10.0.2.15","TCP","54","443  >  59888 [ACK] Seq=6954 Ack=1138 Win=65535 Len=0"
"55","21.350072","157.240.196.60","10.0.2.15","TLSv1.2","342","Application Data"
"56","21.350391","10.0.2.15","157.240.196.60","TCP","54","59888  >  443 [ACK] Seq=1138 Ack=7242 Win=65535 Len=0"
"57","21.536914","10.0.2.15","157.240.196.60","TLSv1.2","143","Application Data"
"58","21.537410","157.240.196.60","10.0.2.15","TCP","54","443  >  59888 [ACK] Seq=7242 Ack=1227 Win=65535 Len=0"
"59","23.623285","157.240.196.60","10.0.2.15","TLSv1.2","342","Application Data"
"60","23.623313","10.0.2.15","157.240.196.60","TCP","54","59888  >  443 [ACK] Seq=1227 Ack=7530 Win=65535 Len=0"
"61","23.794588","10.0.2.15","157.240.196.60","TLSv1.2","143","Application Data"
"62","23.798453","157.240.196.60","10.0.2.15","TCP","54","443  >  59888 [ACK] Seq=7530 Ack=1316 Win=65535 Len=0"
"63","24.776015","10.0.2.15","157.240.196.60","TLSv1.2","123","Application Data"
"64","24.777558","157.240.196.60","10.0.2.15","TCP","54","443  >  59888 [ACK] Seq=7530 Ack=1385 Win=65535 Len=0"
"65","24.928139","157.240.196.60","10.0.2.15","TLSv1.2","125","Application Data"
"66","24.928197","10.0.2.15","157.240.196.60","TCP","54","59888  >  443 [ACK] Seq=1385 Ack=7601 Win=65535 Len=0"
"67","24.975659","157.240.196.60","10.0.2.15","TLSv1.2","326","Application Data"
"68","24.975724","10.0.2.15","157.240.196.60","TCP","54","59888  >  443 [ACK] Seq=1385 Ack=7873 Win=65535 Len=0"
"69","25.144137","10.0.2.15","157.240.196.60","TLSv1.2","143","Application Data"
"70","25.144927","157.240.196.60","10.0.2.15","TCP","54","443  >  59888 [ACK] Seq=7873 Ack=1474 Win=65535 Len=0"
"71","26.639184","157.240.196.60","10.0.2.15","TLSv1.2","326","Application Data"
"72","26.639377","10.0.2.15","157.240.196.60","TCP","54","59888  >  443 [ACK] Seq=1474 Ack=8145 Win=65535 Len=0"
"73","26.884962","10.0.2.15","157.240.196.60","TLSv1.2","143","Application Data"
"74","26.885441","157.240.196.60","10.0.2.15","TCP","54","443  >  59888 [ACK] Seq=8145 Ack=1563 Win=65535 Len=0"
"75","28.867840","157.240.196.60","10.0.2.15","TLSv1.2","326","Application Data"
"76","28.867922","10.0.2.15","157.240.196.60","TCP","54","59888  >  443 [ACK] Seq=1563 Ack=8417 Win=65535 Len=0"
"77","29.074226","10.0.2.15","157.240.196.60","TLSv1.2","143","Application Data"
"78","29.074769","157.240.196.60","10.0.2.15","TCP","54","443  >  59888 [ACK] Seq=8417 Ack=1652 Win=65535 Len=0"
"79","30.226466","157.240.196.60","10.0.2.15","TLSv1.2","310","Application Data"
"80","30.226548","10.0.2.15","157.240.196.60","TCP","54","59888  >  443 [ACK] Seq=1652 Ack=8673 Win=65535 Len=0"
"81","30.486748","10.0.2.15","157.240.196.60","TLSv1.2","143","Application Data"
"82","30.498708","157.240.196.60","10.0.2.15","TCP","54","443  >  59888 [ACK] Seq=8673 Ack=1741 Win=65535 Len=0"
"83","36.474857","157.240.196.60","10.0.2.15","TLSv1.2","374","Application Data"
"84","36.474895","10.0.2.15","157.240.196.60","TCP","54","59888  >  443 [ACK] Seq=1741 Ack=8993 Win=65535 Len=0"
"85","36.755678","10.0.2.15","157.240.196.60","TLSv1.2","143","Application Data"
"86","36.756218","157.240.196.60","10.0.2.15","TCP","54","443  >  59888 [ACK] Seq=8993 Ack=1830 Win=65535 Len=0"
"87","38.229607","157.240.196.60","10.0.2.15","TLSv1.2","1567","Application Data"
"88","38.229713","10.0.2.15","157.240.196.60","TCP","54","59888  >  443 [ACK] Seq=1830 Ack=10506 Win=65535 Len=0"
"89","38.229608","157.240.196.60","10.0.2.15","TCP","1446","443  >  59888 [PSH, ACK] Seq=10506 Ack=1830 Win=65535 Len=1392 [TCP segment of a reassembled PDU]"
"90","38.230022","10.0.2.15","157.240.196.60","TCP","54","59888  >  443 [ACK] Seq=1830 Ack=11898 Win=65535 Len=0"
"91","38.233975","157.240.196.60","10.0.2.15","TLSv1.2","1420","Application Data, Application Data"
"92","38.234009","10.0.2.15","157.240.196.60","TCP","54","59888  >  443 [ACK] Seq=1830 Ack=13264 Win=65535 Len=0"
"93","38.463517","10.0.2.15","157.240.196.60","TLSv1.2","143","Application Data"
"94","38.464146","157.240.196.60","10.0.2.15","TCP","54","443  >  59888 [ACK] Seq=13264 Ack=1919 Win=65535 Len=0"
"95","40.916715","157.240.196.60","10.0.2.15","TCP","1514","443  >  59888 [ACK] Seq=13264 Ack=1919 Win=65535 Len=1460 [TCP segment of a reassembled PDU]"
"96","40.917009","10.0.2.15","157.240.196.60","TCP","54","59888  >  443 [ACK] Seq=1919 Ack=14724 Win=65535 Len=0"
"97","40.918896","157.240.196.60","10.0.2.15","TLSv1.2","2974","Application Data, Application Data"
"98","40.918937","10.0.2.15","157.240.196.60","TCP","54","59888  >  443 [ACK] Seq=1919 Ack=17644 Win=65535 Len=0"
"99","40.920440","157.240.196.60","10.0.2.15","TLSv1.2","4434","Application Data"
"100","40.920477","10.0.2.15","157.240.196.60","TCP","54","59888  >  443 [ACK] Seq=1919 Ack=22024 Win=65535 Len=0"
"101","40.921414","157.240.196.60","10.0.2.15","TLSv1.2","883","Application Data"
"102","40.921444","10.0.2.15","157.240.196.60","TCP","54","59888  >  443 [ACK] Seq=1919 Ack=22853 Win=65535 Len=0"
"103","41.320464","10.0.2.15","157.240.196.60","TLSv1.2","143","Application Data"
"104","41.320983","157.240.196.60","10.0.2.15","TCP","54","443  >  59888 [ACK] Seq=22853 Ack=2008 Win=65535 Len=0"
"105","42.122653","157.240.196.60","10.0.2.15","TLSv1.2","513","Application Data"
"106","42.122750","10.0.2.15","157.240.196.60","TCP","54","59888  >  443 [ACK] Seq=2008 Ack=23312 Win=65535 Len=0"
"107","42.136339","10.0.2.15","157.240.196.60","TLSv1.2","147","Application Data"
"108","42.136974","157.240.196.60","10.0.2.15","TCP","54","443  >  59888 [ACK] Seq=23312 Ack=2101 Win=65535 Len=0"
"109","42.805725","157.240.196.60","10.0.2.15","TLSv1.2","310","Application Data"
"110","42.851686","10.0.2.15","157.240.196.60","TCP","54","59888  >  443 [ACK] Seq=2101 Ack=23568 Win=65535 Len=0"
"111","42.973911","10.0.2.15","157.240.196.60","TLSv1.2","143","Application Data"
"112","42.974568","157.240.196.60","10.0.2.15","TCP","54","443  >  59888 [ACK] Seq=23568 Ack=2190 Win=65535 Len=0"
"113","43.050086","157.240.196.60","10.0.2.15","TLSv1.2","181","Application Data"
"114","43.050109","10.0.2.15","157.240.196.60","TCP","54","59888  >  443 [ACK] Seq=2190 Ack=23695 Win=65535 Len=0"
"115","43.138569","10.0.2.15","157.240.196.60","TLSv1.2","147","Application Data"
"116","43.139722","157.240.196.60","10.0.2.15","TCP","54","443  >  59888 [ACK] Seq=23695 Ack=2283 Win=65535 Len=0"
"117","44.015296","157.240.196.60","10.0.2.15","TLSv1.2","310","Application Data"
"118","44.015332","10.0.2.15","157.240.196.60","TCP","54","59888  >  443 [ACK] Seq=2283 Ack=23951 Win=65535 Len=0"
"119","44.158820","10.0.2.15","157.240.196.60","TLSv1.2","143","Application Data"
"120","44.159378","157.240.196.60","10.0.2.15","TCP","54","443  >  59888 [ACK] Seq=23951 Ack=2372 Win=65535 Len=0"
"121","44.279723","157.240.196.60","10.0.2.15","TLSv1.2","181","Application Data"
"122","44.279747","10.0.2.15","157.240.196.60","TCP","54","59888  >  443 [ACK] Seq=2372 Ack=24078 Win=65535 Len=0"
"123","44.356062","10.0.2.15","157.240.196.60","TLSv1.2","147","Application Data"
"124","44.357270","157.240.196.60","10.0.2.15","TCP","54","443  >  59888 [ACK] Seq=24078 Ack=2465 Win=65535 Len=0"
"125","44.738324","157.240.196.60","10.0.2.15","TLSv1.2","310","Application Data"
"126","44.738360","10.0.2.15","157.240.196.60","TCP","54","59888  >  443 [ACK] Seq=2465 Ack=24334 Win=65535 Len=0"
"127","44.975739","157.240.196.60","10.0.2.15","TLSv1.2","181","Application Data"
"128","44.975765","10.0.2.15","157.240.196.60","TCP","54","59888  >  443 [ACK] Seq=2465 Ack=24461 Win=65535 Len=0"
"129","45.006935","10.0.2.15","157.240.196.60","TLSv1.2","147","Application Data"
"130","45.007363","157.240.196.60","10.0.2.15","TCP","54","443  >  59888 [ACK] Seq=24461 Ack=2558 Win=65535 Len=0"
"131","45.054486","10.0.2.15","157.240.196.60","TLSv1.2","143","Application Data"
"132","45.055150","157.240.196.60","10.0.2.15","TCP","54","443  >  59888 [ACK] Seq=24461 Ack=2647 Win=65535 Len=0"
"133","45.093499","157.240.196.60","10.0.2.15","TLSv1.2","294","Application Data"
"134","45.137726","10.0.2.15","157.240.196.60","TCP","54","59888  >  443 [ACK] Seq=2647 Ack=24701 Win=65535 Len=0"
"135","45.151040","10.0.2.15","157.240.196.60","TLSv1.2","143","Application Data"
"136","45.151600","157.240.196.60","10.0.2.15","TCP","54","443  >  59888 [ACK] Seq=24701 Ack=2736 Win=65535 Len=0"
"137","45.304774","157.240.196.60","10.0.2.15","TLSv1.2","181","Application Data"
"138","45.304815","10.0.2.15","157.240.196.60","TCP","54","59888  >  443 [ACK] Seq=2736 Ack=24828 Win=65535 Len=0"
"139","45.312054","10.0.2.15","157.240.196.60","TLSv1.2","147","Application Data"
"140","45.312611","157.240.196.60","10.0.2.15","TCP","54","443  >  59888 [ACK] Seq=24828 Ack=2829 Win=65535 Len=0"
"141","45.409677","157.240.196.60","10.0.2.15","TLSv1.2","294","Application Data"
"142","45.456326","10.0.2.15","157.240.196.60","TCP","54","59888  >  443 [ACK] Seq=2829 Ack=25068 Win=65535 Len=0"
"143","45.603266","10.0.2.15","157.240.196.60","TLSv1.2","143","Application Data"
"144","45.603853","157.240.196.60","10.0.2.15","TCP","54","443  >  59888 [ACK] Seq=25068 Ack=2918 Win=65535 Len=0"
"145","45.625239","157.240.196.60","10.0.2.15","TLSv1.2","181","Application Data"
"146","45.625361","10.0.2.15","157.240.196.60","TCP","54","59888  >  443 [ACK] Seq=2918 Ack=25195 Win=65535 Len=0"
"147","45.642452","10.0.2.15","157.240.196.60","TLSv1.2","147","Application Data"
"148","45.653956","157.240.196.60","10.0.2.15","TCP","54","443  >  59888 [ACK] Seq=25195 Ack=3011 Win=65535 Len=0"
"149","45.782615","157.240.196.60","10.0.2.15","TLSv1.2","310","Application Data"
"150","45.824638","10.0.2.15","157.240.196.60","TCP","54","59888  >  443 [ACK] Seq=3011 Ack=25451 Win=65535 Len=0"
"151","46.005023","157.240.196.60","10.0.2.15","TLSv1.2","181","Application Data"
"152","46.009882","10.0.2.15","157.240.196.60","TCP","54","59888  >  443 [ACK] Seq=3011 Ack=25578 Win=65535 Len=0"
"153","46.041912","10.0.2.15","157.240.196.60","TLSv1.2","147","Application Data"
"154","46.046590","157.240.196.60","10.0.2.15","TCP","54","443  >  59888 [ACK] Seq=25578 Ack=3104 Win=65535 Len=0"
"155","46.074111","157.240.196.60","10.0.2.15","TLSv1.2","310","Application Data"
"156","46.074136","10.0.2.15","157.240.196.60","TCP","54","59888  >  443 [ACK] Seq=3104 Ack=25834 Win=65535 Len=0"
"157","46.216399","157.240.196.60","10.0.2.15","TLSv1.2","310","Application Data"
"158","46.216426","10.0.2.15","157.240.196.60","TCP","54","59888  >  443 [ACK] Seq=3104 Ack=26090 Win=65535 Len=0"
"159","46.228699","10.0.2.15","157.240.196.60","TLSv1.2","143","Application Data"
"160","46.229169","157.240.196.60","10.0.2.15","TCP","54","443  >  59888 [ACK] Seq=26090 Ack=3193 Win=65535 Len=0"
"161","46.282936","10.0.2.15","157.240.196.60","TLSv1.2","143","Application Data"
"162","46.283529","157.240.196.60","10.0.2.15","TCP","54","443  >  59888 [ACK] Seq=26090 Ack=3282 Win=65535 Len=0"
"163","46.293979","157.240.196.60","10.0.2.15","TLSv1.2","181","Application Data"
"164","46.343412","10.0.2.15","157.240.196.60","TCP","54","59888  >  443 [ACK] Seq=3282 Ack=26217 Win=65535 Len=0"
"165","46.380109","10.0.2.15","157.240.196.60","TLSv1.2","147","Application Data"
"166","46.389701","157.240.196.60","10.0.2.15","TCP","54","443  >  59888 [ACK] Seq=26217 Ack=3375 Win=65535 Len=0"
"167","46.456026","157.240.196.60","10.0.2.15","TLSv1.2","181","Application Data"
"168","46.456051","10.0.2.15","157.240.196.60","TCP","54","59888  >  443 [ACK] Seq=3375 Ack=26344 Win=65535 Len=0"
"169","46.480994","10.0.2.15","157.240.196.60","TLSv1.2","147","Application Data"
"170","46.488126","157.240.196.60","10.0.2.15","TCP","54","443  >  59888 [ACK] Seq=26344 Ack=3468 Win=65535 Len=0"
"171","46.556713","157.240.196.60","10.0.2.15","TLSv1.2","310","Application Data"
"172","46.597034","10.0.2.15","157.240.196.60","TCP","54","59888  >  443 [ACK] Seq=3468 Ack=26600 Win=65535 Len=0"
"173","46.757383","157.240.196.60","10.0.2.15","TLSv1.2","181","Application Data"
"174","46.757416","10.0.2.15","157.240.196.60","TCP","54","59888  >  443 [ACK] Seq=3468 Ack=26727 Win=65535 Len=0"
"175","46.782923","10.0.2.15","157.240.196.60","TLSv1.2","147","Application Data"
"176","46.783460","157.240.196.60","10.0.2.15","TCP","54","443  >  59888 [ACK] Seq=26727 Ack=3561 Win=65535 Len=0"
"177","46.784622","10.0.2.15","157.240.196.60","TLSv1.2","143","Application Data"
"178","46.785261","157.240.196.60","10.0.2.15","TCP","54","443  >  59888 [ACK] Seq=26727 Ack=3650 Win=65535 Len=0"
"179","46.843910","157.240.196.60","10.0.2.15","TLSv1.2","310","Application Data"
"180","46.888280","10.0.2.15","157.240.196.60","TCP","54","59888  >  443 [ACK] Seq=3650 Ack=26983 Win=65535 Len=0"
"181","47.052197","157.240.196.60","10.0.2.15","TLSv1.2","181","Application Data"
"182","47.052397","10.0.2.15","157.240.196.60","TCP","54","59888  >  443 [ACK] Seq=3650 Ack=27110 Win=65535 Len=0"
"183","47.060936","10.0.2.15","157.240.196.60","TLSv1.2","147","Application Data"
"184","47.061597","157.240.196.60","10.0.2.15","TCP","54","443  >  59888 [ACK] Seq=27110 Ack=3743 Win=65535 Len=0"
"185","47.131017","10.0.2.15","157.240.196.60","TLSv1.2","143","Application Data"
"186","47.131593","157.240.196.60","10.0.2.15","TCP","54","443  >  59888 [ACK] Seq=27110 Ack=3832 Win=65535 Len=0"
"187","47.255246","10.0.2.15","157.240.196.60","TLSv1.2","143","Application Data"
"188","47.265720","157.240.196.60","10.0.2.15","TCP","54","443  >  59888 [ACK] Seq=27110 Ack=3921 Win=65535 Len=0"
"189","49.033851","157.240.196.60","10.0.2.15","TLSv1.2","326","Application Data"
"190","49.083585","10.0.2.15","157.240.196.60","TCP","54","59888  >  443 [ACK] Seq=3921 Ack=27382 Win=65535 Len=0"
"191","49.291602","157.240.196.60","10.0.2.15","TLSv1.2","181","Application Data"
"192","49.291625","10.0.2.15","157.240.196.60","TCP","54","59888  >  443 [ACK] Seq=3921 Ack=27509 Win=65535 Len=0"
"193","49.361605","10.0.2.15","157.240.196.60","TLSv1.2","147","Application Data"
"194","49.364603","157.240.196.60","10.0.2.15","TCP","54","443  >  59888 [ACK] Seq=27509 Ack=4014 Win=65535 Len=0"
"195","49.364860","10.0.2.15","157.240.196.60","TLSv1.2","143","Application Data"
"196","49.372263","157.240.196.60","10.0.2.15","TCP","54","443  >  59888 [ACK] Seq=27509 Ack=4103 Win=65535 Len=0"
"197","50.579000","10.0.2.15","157.240.196.60","TLSv1.2","123","Application Data"
"198","50.580230","157.240.196.60","10.0.2.15","TCP","54","443  >  59888 [ACK] Seq=27509 Ack=4172 Win=65535 Len=0"
"199","50.726219","157.240.196.60","10.0.2.15","TLSv1.2","125","Application Data"
"200","50.726277","10.0.2.15","157.240.196.60","TCP","54","59888  >  443 [ACK] Seq=4172 Ack=27580 Win=65535 Len=0"
"201","50.954718","157.240.196.60","10.0.2.15","TLSv1.2","326","Application Data"
"202","50.954848","10.0.2.15","157.240.196.60","TCP","54","59888  >  443 [ACK] Seq=4172 Ack=27852 Win=65535 Len=0"
"203","51.159235","10.0.2.15","157.240.196.60","TLSv1.2","143","Application Data"
"204","51.164926","157.240.196.60","10.0.2.15","TCP","54","443  >  59888 [ACK] Seq=27852 Ack=4261 Win=65535 Len=0"
"205","51.261906","157.240.196.60","10.0.2.15","TLSv1.2","181","Application Data"
"206","51.261932","10.0.2.15","157.240.196.60","TCP","54","59888  >  443 [ACK] Seq=4261 Ack=27979 Win=65535 Len=0"
"207","51.333241","10.0.2.15","157.240.196.60","TLSv1.2","147","Application Data"
"208","51.333678","157.240.196.60","10.0.2.15","TCP","54","443  >  59888 [ACK] Seq=27979 Ack=4354 Win=65535 Len=0"
"209","52.394549","157.240.196.60","10.0.2.15","TLSv1.2","326","Application Data"
"210","52.394850","10.0.2.15","157.240.196.60","TCP","54","59888  >  443 [ACK] Seq=4354 Ack=28251 Win=65535 Len=0"
"211","52.673102","157.240.196.60","10.0.2.15","TLSv1.2","181","Application Data"
"212","52.673125","10.0.2.15","157.240.196.60","TCP","54","59888  >  443 [ACK] Seq=4354 Ack=28378 Win=65535 Len=0"
"213","52.724671","10.0.2.15","157.240.196.60","TLSv1.2","147","Application Data"
"214","52.732317","157.240.196.60","10.0.2.15","TCP","54","443  >  59888 [ACK] Seq=28378 Ack=4447 Win=65535 Len=0"
"215","52.732341","10.0.2.15","157.240.196.60","TLSv1.2","143","Application Data"
"216","52.733068","157.240.196.60","10.0.2.15","TCP","54","443  >  59888 [ACK] Seq=28378 Ack=4536 Win=65535 Len=0"
"217","54.131905","157.240.196.60","10.0.2.15","TLSv1.2","326","Application Data"
"218","54.132286","10.0.2.15","157.240.196.60","TCP","54","59888  >  443 [ACK] Seq=4536 Ack=28650 Win=65535 Len=0"
"219","54.275765","10.0.2.15","157.240.196.60","TLSv1.2","143","Application Data"
"220","54.276354","157.240.196.60","10.0.2.15","TCP","54","443  >  59888 [ACK] Seq=28650 Ack=4625 Win=65535 Len=0"
"221","54.410823","157.240.196.60","10.0.2.15","TLSv1.2","181","Application Data"
"222","54.410863","10.0.2.15","157.240.196.60","TCP","54","59888  >  443 [ACK] Seq=4625 Ack=28777 Win=65535 Len=0"
"223","54.418106","10.0.2.15","157.240.196.60","TLSv1.2","147","Application Data"
"224","54.418655","157.240.196.60","10.0.2.15","TCP","54","443  >  59888 [ACK] Seq=28777 Ack=4718 Win=65535 Len=0"
"225","60.491158","157.240.196.60","10.0.2.15","TLSv1.2","374","Application Data"
"226","60.536212","10.0.2.15","157.240.196.60","TCP","54","59888  >  443 [ACK] Seq=4718 Ack=29097 Win=65535 Len=0"
"227","60.756204","157.240.196.60","10.0.2.15","TLSv1.2","181","Application Data"
"228","60.756228","10.0.2.15","157.240.196.60","TCP","54","59888  >  443 [ACK] Seq=4718 Ack=29224 Win=65535 Len=0"
"229","60.784828","10.0.2.15","157.240.196.60","TLSv1.2","147","Application Data"
"230","60.785601","157.240.196.60","10.0.2.15","TCP","54","443  >  59888 [ACK] Seq=29224 Ack=4811 Win=65535 Len=0"
"231","60.785674","10.0.2.15","157.240.196.60","TLSv1.2","143","Application Data"
"232","60.785945","157.240.196.60","10.0.2.15","TCP","54","443  >  59888 [ACK] Seq=29224 Ack=4900 Win=65535 Len=0"
"237","65.340950","157.240.196.60","10.0.2.15","TLSv1.2","342","Application Data"
"238","65.382996","10.0.2.15","157.240.196.60","TCP","54","59888  >  443 [ACK] Seq=4900 Ack=29512 Win=65535 Len=0"
"239","65.681479","157.240.196.60","10.0.2.15","TLSv1.2","181","Application Data"
"240","65.681503","10.0.2.15","157.240.196.60","TCP","54","59888  >  443 [ACK] Seq=4900 Ack=29639 Win=65535 Len=0"
"241","65.895729","10.0.2.15","157.240.196.60","TLSv1.2","147","Application Data"
"242","65.909598","157.240.196.60","10.0.2.15","TCP","54","443  >  59888 [ACK] Seq=29639 Ack=4993 Win=65535 Len=0"
"243","65.909640","10.0.2.15","157.240.196.60","TLSv1.2","143","Application Data"
"244","65.923652","157.240.196.60","10.0.2.15","TCP","54","443  >  59888 [ACK] Seq=29639 Ack=5082 Win=65535 Len=0"
"245","67.587166","10.0.2.15","157.240.196.60","TLSv1.2","123","Application Data"
"246","67.588460","157.240.196.60","10.0.2.15","TCP","54","443  >  59888 [ACK] Seq=29639 Ack=5151 Win=65535 Len=0"
"247","67.733307","157.240.196.60","10.0.2.15","TLSv1.2","125","Application Data"
"248","67.733331","10.0.2.15","157.240.196.60","TCP","54","59888  >  443 [ACK] Seq=5151 Ack=29710 Win=65535 Len=0"
"249","68.694642","157.240.196.60","10.0.2.15","TLSv1.2","541","Application Data"
"250","68.694977","10.0.2.15","157.240.196.60","TCP","54","59888  >  443 [ACK] Seq=5151 Ack=30197 Win=65535 Len=0"
"251","69.269823","10.0.2.15","157.240.196.60","TLSv1.2","147","Application Data"
"252","69.270524","157.240.196.60","10.0.2.15","TCP","54","443  >  59888 [ACK] Seq=30197 Ack=5244 Win=65535 Len=0"
"253","71.448961","157.240.196.60","10.0.2.15","TLSv1.2","310","Application Data"
"254","71.449249","10.0.2.15","157.240.196.60","TCP","54","59888  >  443 [ACK] Seq=5244 Ack=30453 Win=65535 Len=0"
"255","71.720585","157.240.196.60","10.0.2.15","TLSv1.2","181","Application Data"
"256","71.720610","10.0.2.15","157.240.196.60","TCP","54","59888  >  443 [ACK] Seq=5244 Ack=30580 Win=65535 Len=0"
"257","71.726042","10.0.2.15","157.240.196.60","TLSv1.2","143","Application Data"
"258","71.726747","157.240.196.60","10.0.2.15","TCP","54","443  >  59888 [ACK] Seq=30580 Ack=5333 Win=65535 Len=0"
"259","71.770426","10.0.2.15","157.240.196.60","TLSv1.2","147","Application Data"
"260","71.770836","157.240.196.60","10.0.2.15","TCP","54","443  >  59888 [ACK] Seq=30580 Ack=5426 Win=65535 Len=0"
"261","72.799973","157.240.196.60","10.0.2.15","TLSv1.2","326","Application Data"
"262","72.799973","157.240.196.60","10.0.2.15","TLSv1.2","270","Application Data"
"263","72.801817","10.0.2.15","157.240.196.60","TCP","54","59888  >  443 [ACK] Seq=5426 Ack=31068 Win=65535 Len=0"
"264","72.865922","10.0.2.15","157.240.196.60","TLSv1.2","148","Application Data"
"265","72.867268","157.240.196.60","10.0.2.15","TCP","54","443  >  59888 [ACK] Seq=31068 Ack=5520 Win=65535 Len=0"
"266","72.907329","10.0.2.15","157.240.196.60","TLSv1.2","129","Application Data"
"267","72.908527","157.240.196.60","10.0.2.15","TCP","54","443  >  59888 [ACK] Seq=31068 Ack=5595 Win=65535 Len=0"
"268","73.126180","10.0.2.15","157.240.196.60","TLSv1.2","143","Application Data"
"269","73.126650","157.240.196.60","10.0.2.15","TCP","54","443  >  59888 [ACK] Seq=31068 Ack=5684 Win=65535 Len=0"
"270","74.231816","157.240.196.60","10.0.2.15","TLSv1.2","326","Application Data"
"271","74.307287","10.0.2.15","157.240.196.60","TCP","54","59888  >  443 [ACK] Seq=5684 Ack=31340 Win=65535 Len=0"
"272","74.441535","10.0.2.15","157.240.196.60","TLSv1.2","143","Application Data"
"273","74.442023","157.240.196.60","10.0.2.15","TCP","54","443  >  59888 [ACK] Seq=31340 Ack=5773 Win=65535 Len=0"
"274","75.929095","10.0.2.15","157.240.196.60","TLSv1.2","84","Application Data"
"275","75.929225","10.0.2.15","157.240.196.60","TLSv1.2","6398","Application Data"
"276","75.929796","157.240.196.60","10.0.2.15","TCP","54","443  >  59888 [ACK] Seq=31340 Ack=5803 Win=65535 Len=0"
"277","75.929796","157.240.196.60","10.0.2.15","TCP","54","443  >  59888 [ACK] Seq=31340 Ack=7263 Win=65535 Len=0"
"278","75.929796","157.240.196.60","10.0.2.15","TCP","54","443  >  59888 [ACK] Seq=31340 Ack=8723 Win=65535 Len=0"
"279","75.929796","157.240.196.60","10.0.2.15","TCP","54","443  >  59888 [ACK] Seq=31340 Ack=10183 Win=65535 Len=0"
"280","75.929796","157.240.196.60","10.0.2.15","TCP","54","443  >  59888 [ACK] Seq=31340 Ack=11643 Win=65535 Len=0"
"281","75.929796","157.240.196.60","10.0.2.15","TCP","54","443  >  59888 [ACK] Seq=31340 Ack=12147 Win=65535 Len=0"
"282","75.936604","157.240.196.60","10.0.2.15","TLSv1.2","326","Application Data"
"283","75.936633","10.0.2.15","157.240.196.60","TCP","54","59888  >  443 [ACK] Seq=12147 Ack=31612 Win=65535 Len=0"
"284","76.014572","10.0.2.15","157.240.196.60","TLSv1.2","143","Application Data"
"285","76.015075","157.240.196.60","10.0.2.15","TCP","54","443  >  59888 [ACK] Seq=31612 Ack=12236 Win=65535 Len=0"
"286","76.082295","157.240.196.60","10.0.2.15","TLSv1.2","117","Application Data"
"287","76.082320","10.0.2.15","157.240.196.60","TCP","54","59888  >  443 [ACK] Seq=12236 Ack=31675 Win=65535 Len=0"
"288","76.253336","157.240.196.60","10.0.2.15","TLSv1.2","196","Application Data"
"289","76.253428","10.0.2.15","157.240.196.60","TCP","54","59888  >  443 [ACK] Seq=12236 Ack=31817 Win=65535 Len=0"
"290","76.259431","157.240.196.60","10.0.2.15","TLSv1.2","181","Application Data"
"291","76.259469","10.0.2.15","157.240.196.60","TCP","54","59888  >  443 [ACK] Seq=12236 Ack=31944 Win=65535 Len=0"
"292","76.273903","10.0.2.15","157.240.196.60","TLSv1.2","147","Application Data"
"293","76.276923","157.240.196.60","10.0.2.15","TCP","54","443  >  59888 [ACK] Seq=31944 Ack=12329 Win=65535 Len=0"
"294","76.300814","10.0.2.15","157.240.196.60","TLSv1.2","147","Application Data"
"295","76.302234","157.240.196.60","10.0.2.15","TCP","54","443  >  59888 [ACK] Seq=31944 Ack=12422 Win=65535 Len=0"
"296","77.461136","157.240.196.60","10.0.2.15","TLSv1.2","310","Application Data"
"297","77.501471","10.0.2.15","157.240.196.60","TCP","54","59888  >  443 [ACK] Seq=12422 Ack=32200 Win=65535 Len=0"
"298","77.621073","10.0.2.15","157.240.196.60","TLSv1.2","143","Application Data"
"299","77.621789","157.240.196.60","10.0.2.15","TCP","54","443  >  59888 [ACK] Seq=32200 Ack=12511 Win=65535 Len=0"
"300","77.772423","157.240.196.60","10.0.2.15","TLSv1.2","181","Application Data"
"301","77.772447","10.0.2.15","157.240.196.60","TCP","54","59888  >  443 [ACK] Seq=12511 Ack=32327 Win=65535 Len=0"
"302","77.786737","10.0.2.15","157.240.196.60","TLSv1.2","147","Application Data"
"303","77.788277","157.240.196.60","10.0.2.15","TCP","54","443  >  59888 [ACK] Seq=32327 Ack=12604 Win=65535 Len=0"
"304","83.307969","157.240.196.60","10.0.2.15","TLSv1.2","343","Application Data"
"305","83.361187","10.0.2.15","157.240.196.60","TCP","54","59888  >  443 [ACK] Seq=12604 Ack=32616 Win=65535 Len=0"
"306","83.602424","157.240.196.60","10.0.2.15","TLSv1.2","181","Application Data"
"307","83.602469","10.0.2.15","157.240.196.60","TCP","54","59888  >  443 [ACK] Seq=12604 Ack=32743 Win=65535 Len=0"
"308","84.090395","10.0.2.15","157.240.196.60","TLSv1.2","147","Application Data"
"309","84.091090","157.240.196.60","10.0.2.15","TCP","54","443  >  59888 [ACK] Seq=32743 Ack=12697 Win=65535 Len=0"
"310","84.091133","10.0.2.15","157.240.196.60","TLSv1.2","143","Application Data"
"311","84.098032","157.240.196.60","10.0.2.15","TCP","54","443  >  59888 [ACK] Seq=32743 Ack=12786 Win=65535 Len=0"
"312","85.055453","157.240.196.60","10.0.2.15","TLSv1.2","1664","Application Data, Application Data"
"313","85.056414","10.0.2.15","157.240.196.60","TCP","54","59888  >  443 [ACK] Seq=12786 Ack=34353 Win=65535 Len=0"
"314","85.167682","10.0.2.15","157.240.196.60","TLSv1.2","143","Application Data"
"315","85.171765","157.240.196.60","10.0.2.15","TCP","54","443  >  59888 [ACK] Seq=34353 Ack=12875 Win=65535 Len=0"
"316","85.375308","157.240.196.60","10.0.2.15","TLSv1.2","181","Application Data"
"317","85.375346","10.0.2.15","157.240.196.60","TCP","54","59888  >  443 [ACK] Seq=12875 Ack=34480 Win=65535 Len=0"
"318","85.379637","10.0.2.15","157.240.196.60","TLSv1.2","147","Application Data"
"319","85.380421","157.240.196.60","10.0.2.15","TCP","54","443  >  59888 [ACK] Seq=34480 Ack=12968 Win=65535 Len=0"
"320","86.735785","157.240.196.60","10.0.2.15","TLSv1.2","1648","Application Data, Application Data"
"321","86.735871","10.0.2.15","157.240.196.60","TCP","54","59888  >  443 [ACK] Seq=12968 Ack=36074 Win=65535 Len=0"
"322","86.937031","10.0.2.15","157.240.196.60","TLSv1.2","143","Application Data"
"323","86.940140","157.240.196.60","10.0.2.15","TCP","54","443  >  59888 [ACK] Seq=36074 Ack=13057 Win=65535 Len=0"
"324","87.115647","157.240.196.60","10.0.2.15","TLSv1.2","181","Application Data"
"325","87.123963","10.0.2.15","157.240.196.60","TLSv1.2","147","Application Data"
"326","87.124710","157.240.196.60","10.0.2.15","TCP","54","443  >  59888 [ACK] Seq=36201 Ack=13150 Win=65535 Len=0"
"327","88.593762","157.240.196.60","10.0.2.15","TLSv1.2","327","Application Data"
"328","88.633773","10.0.2.15","157.240.196.60","TCP","54","59888  >  443 [ACK] Seq=13150 Ack=36474 Win=65535 Len=0"
"329","88.764196","10.0.2.15","157.240.196.60","TLSv1.2","143","Application Data"
"330","88.770547","157.240.196.60","10.0.2.15","TCP","54","443  >  59888 [ACK] Seq=36474 Ack=13239 Win=65535 Len=0"
"331","88.944600","157.240.196.60","10.0.2.15","TLSv1.2","181","Application Data"
"332","88.944624","10.0.2.15","157.240.196.60","TCP","54","59888  >  443 [ACK] Seq=13239 Ack=36601 Win=65535 Len=0"
"333","89.036764","10.0.2.15","157.240.196.60","TLSv1.2","147","Application Data"
"334","89.043805","157.240.196.60","10.0.2.15","TCP","54","443  >  59888 [ACK] Seq=36601 Ack=13332 Win=65535 Len=0"
"335","89.974272","157.240.196.60","10.0.2.15","TLSv1.2","311","Application Data"
"336","89.974434","10.0.2.15","157.240.196.60","TCP","54","59888  >  443 [ACK] Seq=13332 Ack=36858 Win=65535 Len=0"
"337","90.233290","10.0.2.15","157.240.196.60","TLSv1.2","143","Application Data"
"338","90.233708","157.240.196.60","10.0.2.15","TCP","54","443  >  59888 [ACK] Seq=36858 Ack=13421 Win=65535 Len=0"
"339","90.252586","157.240.196.60","10.0.2.15","TLSv1.2","181","Application Data"
"340","90.252617","10.0.2.15","157.240.196.60","TCP","54","59888  >  443 [ACK] Seq=13421 Ack=36985 Win=65535 Len=0"
"341","90.287326","10.0.2.15","157.240.196.60","TLSv1.2","147","Application Data"
"342","90.287970","157.240.196.60","10.0.2.15","TCP","54","443  >  59888 [ACK] Seq=36985 Ack=13514 Win=65535 Len=0"
"343","91.999147","157.240.196.60","10.0.2.15","TLSv1.2","327","Application Data"
"344","92.041653","10.0.2.15","157.240.196.60","TCP","54","59888  >  443 [ACK] Seq=13514 Ack=37258 Win=65535 Len=0"
"345","92.174899","10.0.2.15","157.240.196.60","TLSv1.2","143","Application Data"
"346","92.175560","157.240.196.60","10.0.2.15","TCP","54","443  >  59888 [ACK] Seq=37258 Ack=13603 Win=65535 Len=0"
"347","92.297382","157.240.196.60","10.0.2.15","TLSv1.2","181","Application Data"
"348","92.297407","10.0.2.15","157.240.196.60","TCP","54","59888  >  443 [ACK] Seq=13603 Ack=37385 Win=65535 Len=0"
"349","92.301444","10.0.2.15","157.240.196.60","TLSv1.2","147","Application Data"
"350","92.302024","157.240.196.60","10.0.2.15","TCP","54","443  >  59888 [ACK] Seq=37385 Ack=13696 Win=65535 Len=0"
"363","98.030362","157.240.196.60","10.0.2.15","TLSv1.2","375","Application Data"
"364","98.077709","10.0.2.15","157.240.196.60","TCP","54","59888  >  443 [ACK] Seq=13696 Ack=37706 Win=65535 Len=0"
"365","98.341447","157.240.196.60","10.0.2.15","TLSv1.2","181","Application Data"
"366","98.341471","10.0.2.15","157.240.196.60","TCP","54","59888  >  443 [ACK] Seq=13696 Ack=37833 Win=65535 Len=0"
"367","98.717685","10.0.2.15","157.240.196.60","TLSv1.2","147","Application Data"
"368","98.718180","157.240.196.60","10.0.2.15","TCP","54","443  >  59888 [ACK] Seq=37833 Ack=13789 Win=65535 Len=0"
"369","98.720333","10.0.2.15","157.240.196.60","TLSv1.2","143","Application Data"
"370","98.720833","157.240.196.60","10.0.2.15","TCP","54","443  >  59888 [ACK] Seq=37833 Ack=13878 Win=65535 Len=0"
"371","101.276052","10.0.2.15","157.240.196.60","TLSv1.2","123","Application Data"
"372","101.279577","157.240.196.60","10.0.2.15","TCP","54","443  >  59888 [ACK] Seq=37833 Ack=13947 Win=65535 Len=0"
"373","101.423244","157.240.196.60","10.0.2.15","TLSv1.2","125","Application Data"
"374","101.423279","10.0.2.15","157.240.196.60","TCP","54","59888  >  443 [ACK] Seq=13947 Ack=37904 Win=65535 Len=0"
"375","102.237200","157.240.196.60","10.0.2.15","TLSv1.2","343","Application Data"
"376","102.237316","10.0.2.15","157.240.196.60","TCP","54","59888  >  443 [ACK] Seq=13947 Ack=38193 Win=65535 Len=0"
"377","102.515746","10.0.2.15","157.240.196.60","TLSv1.2","143","Application Data"
"378","102.524510","157.240.196.60","10.0.2.15","TCP","54","443  >  59888 [ACK] Seq=38193 Ack=14036 Win=65535 Len=0"
"379","102.543880","157.240.196.60","10.0.2.15","TLSv1.2","181","Application Data"
"380","102.543903","10.0.2.15","157.240.196.60","TCP","54","59888  >  443 [ACK] Seq=14036 Ack=38320 Win=65535 Len=0"
"381","102.697050","10.0.2.15","157.240.196.60","TLSv1.2","147","Application Data"
"382","102.710028","157.240.196.60","10.0.2.15","TCP","54","443  >  59888 [ACK] Seq=38320 Ack=14129 Win=65535 Len=0"
"383","104.110753","157.240.196.60","10.0.2.15","TLSv1.2","1567","Application Data"
"384","104.110786","10.0.2.15","157.240.196.60","TCP","54","59888  >  443 [ACK] Seq=14129 Ack=39833 Win=65535 Len=0"
"385","104.110753","157.240.196.60","10.0.2.15","TLSv1.2","1463","Application Data"
"386","104.111340","10.0.2.15","157.240.196.60","TCP","54","59888  >  443 [ACK] Seq=14129 Ack=41242 Win=65535 Len=0"
"387","104.207165","10.0.2.15","157.240.196.60","TLSv1.2","143","Application Data"
"388","104.207674","157.240.196.60","10.0.2.15","TCP","54","443  >  59888 [ACK] Seq=41242 Ack=14218 Win=65535 Len=0"
"389","104.383652","157.240.196.60","10.0.2.15","TLSv1.2","181","Application Data"
"390","104.383682","10.0.2.15","157.240.196.60","TCP","54","59888  >  443 [ACK] Seq=14218 Ack=41369 Win=65535 Len=0"
"391","104.388262","10.0.2.15","157.240.196.60","TLSv1.2","147","Application Data"
"392","104.389004","157.240.196.60","10.0.2.15","TCP","54","443  >  59888 [ACK] Seq=41369 Ack=14311 Win=65535 Len=0"
"393","105.138798","157.240.196.60","10.0.2.15","TLSv1.2","1648","Application Data, Application Data"
"394","105.138878","10.0.2.15","157.240.196.60","TCP","54","59888  >  443 [ACK] Seq=14311 Ack=42963 Win=65535 Len=0"
"395","105.405778","157.240.196.60","10.0.2.15","TLSv1.2","181","Application Data"
"396","105.405985","10.0.2.15","157.240.196.60","TLSv1.2","143","Application Data"
"397","105.406504","157.240.196.60","10.0.2.15","TCP","54","443  >  59888 [ACK] Seq=43090 Ack=14400 Win=65535 Len=0"
"398","105.515071","10.0.2.15","157.240.196.60","TLSv1.2","147","Application Data"
"399","105.515538","157.240.196.60","10.0.2.15","TCP","54","443  >  59888 [ACK] Seq=43090 Ack=14493 Win=65535 Len=0"
"400","106.324264","157.240.196.60","10.0.2.15","TLSv1.2","1664","Application Data, Application Data"
"401","106.324576","10.0.2.15","157.240.196.60","TCP","54","59888  >  443 [ACK] Seq=14493 Ack=44700 Win=65535 Len=0"
"402","106.511307","10.0.2.15","157.240.196.60","TLSv1.2","143","Application Data"
"403","106.511934","157.240.196.60","10.0.2.15","TCP","54","443  >  59888 [ACK] Seq=44700 Ack=14582 Win=65535 Len=0"
"404","106.665015","157.240.196.60","10.0.2.15","TLSv1.2","181","Application Data"
"405","106.696409","10.0.2.15","157.240.196.60","TLSv1.2","147","Application Data"
"406","106.714059","157.240.196.60","10.0.2.15","TCP","54","443  >  59888 [ACK] Seq=44827 Ack=14675 Win=65535 Len=0"
"407","108.648978","157.240.196.60","10.0.2.15","TLSv1.2","327","Application Data"
"408","108.690881","10.0.2.15","157.240.196.60","TCP","54","59888  >  443 [ACK] Seq=14675 Ack=45100 Win=65535 Len=0"
"409","108.872991","10.0.2.15","157.240.196.60","TLSv1.2","143","Application Data"
"410","108.873738","157.240.196.60","10.0.2.15","TCP","54","443  >  59888 [ACK] Seq=45100 Ack=14764 Win=65535 Len=0"
"411","108.995462","157.240.196.60","10.0.2.15","TLSv1.2","181","Application Data"
"412","108.995487","10.0.2.15","157.240.196.60","TCP","54","59888  >  443 [ACK] Seq=14764 Ack=45227 Win=65535 Len=0"
"413","109.004648","10.0.2.15","157.240.196.60","TLSv1.2","147","Application Data"
"414","109.005157","157.240.196.60","10.0.2.15","TCP","54","443  >  59888 [ACK] Seq=45227 Ack=14857 Win=65535 Len=0"
"415","110.571523","157.240.196.60","10.0.2.15","TLSv1.2","327","Application Data"
"416","110.612997","10.0.2.15","157.240.196.60","TCP","54","59888  >  443 [ACK] Seq=14857 Ack=45500 Win=65535 Len=0"
"417","110.676178","10.0.2.15","157.240.196.60","TLSv1.2","143","Application Data"
"418","110.676606","157.240.196.60","10.0.2.15","TCP","54","443  >  59888 [ACK] Seq=45500 Ack=14946 Win=65535 Len=0"
"419","110.813901","157.240.196.60","10.0.2.15","TLSv1.2","181","Application Data"
"420","110.813926","10.0.2.15","157.240.196.60","TCP","54","59888  >  443 [ACK] Seq=14946 Ack=45627 Win=65535 Len=0"
"421","110.842854","10.0.2.15","157.240.196.60","TLSv1.2","147","Application Data"
"422","110.847253","157.240.196.60","10.0.2.15","TCP","54","443  >  59888 [ACK] Seq=45627 Ack=15039 Win=65535 Len=0"
"423","112.372464","157.240.196.60","10.0.2.15","TLSv1.2","327","Application Data"
"424","112.412905","10.0.2.15","157.240.196.60","TCP","54","59888  >  443 [ACK] Seq=15039 Ack=45900 Win=65535 Len=0"
"425","112.443605","10.0.2.15","157.240.196.60","TLSv1.2","143","Application Data"
"426","112.444334","157.240.196.60","10.0.2.15","TCP","54","443  >  59888 [ACK] Seq=45900 Ack=15128 Win=65535 Len=0"
"427","112.687255","157.240.196.60","10.0.2.15","TLSv1.2","181","Application Data"
"428","112.698129","10.0.2.15","157.240.196.60","TCP","54","59888  >  443 [ACK] Seq=15128 Ack=46027 Win=65535 Len=0"
"429","112.775931","10.0.2.15","157.240.196.60","TLSv1.2","147","Application Data"
"430","112.781404","157.240.196.60","10.0.2.15","TCP","54","443  >  59888 [ACK] Seq=46027 Ack=15221 Win=65535 Len=0"
"431","112.949092","157.240.196.60","10.0.2.15","TLSv1.2","627","Application Data"
"432","112.949118","10.0.2.15","157.240.196.60","TCP","54","59888  >  443 [ACK] Seq=15221 Ack=46600 Win=65535 Len=0"
"433","113.099291","10.0.2.15","157.240.196.60","TLSv1.2","147","Application Data"
"434","113.099894","157.240.196.60","10.0.2.15","TCP","54","443  >  59888 [ACK] Seq=46600 Ack=15314 Win=65535 Len=0"
"435","114.839733","157.240.196.60","10.0.2.15","TLSv1.2","343","Application Data"
"436","114.840021","10.0.2.15","157.240.196.60","TCP","54","59888  >  443 [ACK] Seq=15314 Ack=46889 Win=65535 Len=0"
"437","114.982078","10.0.2.15","157.240.196.60","TLSv1.2","143","Application Data"
"438","114.982488","157.240.196.60","10.0.2.15","TCP","54","443  >  59888 [ACK] Seq=46889 Ack=15403 Win=65535 Len=0"
"439","115.134903","157.240.196.60","10.0.2.15","TLSv1.2","181","Application Data"
"440","115.134928","10.0.2.15","157.240.196.60","TCP","54","59888  >  443 [ACK] Seq=15403 Ack=47016 Win=65535 Len=0"
"441","115.148070","10.0.2.15","157.240.196.60","TLSv1.2","147","Application Data"
"442","115.149020","157.240.196.60","10.0.2.15","TCP","54","443  >  59888 [ACK] Seq=47016 Ack=15496 Win=65535 Len=0"
"443","116.383849","157.240.196.60","10.0.2.15","TLSv1.2","311","Application Data"
"444","116.425792","10.0.2.15","157.240.196.60","TCP","54","59888  >  443 [ACK] Seq=15496 Ack=47273 Win=65535 Len=0"
"445","116.579502","10.0.2.15","157.240.196.60","TLSv1.2","143","Application Data"
"446","116.579919","157.240.196.60","10.0.2.15","TCP","54","443  >  59888 [ACK] Seq=47273 Ack=15585 Win=65535 Len=0"
"447","116.673924","157.240.196.60","10.0.2.15","TLSv1.2","181","Application Data"
"448","116.673956","10.0.2.15","157.240.196.60","TCP","54","59888  >  443 [ACK] Seq=15585 Ack=47400 Win=65535 Len=0"
"449","116.680074","10.0.2.15","157.240.196.60","TLSv1.2","147","Application Data"
"450","116.681000","157.240.196.60","10.0.2.15","TCP","54","443  >  59888 [ACK] Seq=47400 Ack=15678 Win=65535 Len=0"
"451","116.932393","157.240.196.60","10.0.2.15","TLSv1.2","311","Application Data"
"452","116.973900","10.0.2.15","157.240.196.60","TCP","54","59888  >  443 [ACK] Seq=15678 Ack=47657 Win=65535 Len=0"
"453","116.990652","10.0.2.15","157.240.196.60","TLSv1.2","143","Application Data"
"454","116.991538","157.240.196.60","10.0.2.15","TCP","54","443  >  59888 [ACK] Seq=47657 Ack=15767 Win=65535 Len=0"
"455","117.174809","157.240.196.60","10.0.2.15","TLSv1.2","181","Application Data"
"456","117.174833","10.0.2.15","157.240.196.60","TCP","54","59888  >  443 [ACK] Seq=15767 Ack=47784 Win=65535 Len=0"
"457","117.264532","157.240.196.60","10.0.2.15","TLSv1.2","311","Application Data"
"458","117.264566","10.0.2.15","157.240.196.60","TCP","54","59888  >  443 [ACK] Seq=15767 Ack=48041 Win=65535 Len=0"
"459","117.316394","10.0.2.15","157.240.196.60","TLSv1.2","147","Application Data"
"460","117.329444","157.240.196.60","10.0.2.15","TCP","54","443  >  59888 [ACK] Seq=48041 Ack=15860 Win=65535 Len=0"
"461","117.509179","157.240.196.60","10.0.2.15","TLSv1.2","181","Application Data"
"462","117.509209","10.0.2.15","157.240.196.60","TCP","54","59888  >  443 [ACK] Seq=15860 Ack=48168 Win=65535 Len=0"
"463","117.515988","10.0.2.15","157.240.196.60","TLSv1.2","147","Application Data"
"464","117.516474","157.240.196.60","10.0.2.15","TCP","54","443  >  59888 [ACK] Seq=48168 Ack=15953 Win=65535 Len=0"
"465","117.535760","10.0.2.15","157.240.196.60","TLSv1.2","143","Application Data"
"466","117.541148","157.240.196.60","10.0.2.15","TCP","54","443  >  59888 [ACK] Seq=48168 Ack=16042 Win=65535 Len=0"
"467","117.638253","157.240.196.60","10.0.2.15","TLSv1.2","295","Application Data"
"468","117.684714","10.0.2.15","157.240.196.60","TCP","54","59888  >  443 [ACK] Seq=16042 Ack=48409 Win=65535 Len=0"
"469","117.784622","10.0.2.15","157.240.196.60","TLSv1.2","143","Application Data"
"470","117.785030","157.240.196.60","10.0.2.15","TCP","54","443  >  59888 [ACK] Seq=48409 Ack=16131 Win=65535 Len=0"
"471","117.859813","157.240.196.60","10.0.2.15","TLSv1.2","181","Application Data"
"472","117.859839","10.0.2.15","157.240.196.60","TCP","54","59888  >  443 [ACK] Seq=16131 Ack=48536 Win=65535 Len=0"
"473","117.867167","10.0.2.15","157.240.196.60","TLSv1.2","147","Application Data"
"474","117.867677","157.240.196.60","10.0.2.15","TCP","54","443  >  59888 [ACK] Seq=48536 Ack=16224 Win=65535 Len=0"
"475","117.960331","157.240.196.60","10.0.2.15","TLSv1.2","311","Application Data"
"476","118.001007","10.0.2.15","157.240.196.60","TCP","54","59888  >  443 [ACK] Seq=16224 Ack=48793 Win=65535 Len=0"
"477","118.108631","10.0.2.15","157.240.196.60","TLSv1.2","143","Application Data"
"478","118.109018","157.240.196.60","10.0.2.15","TCP","54","443  >  59888 [ACK] Seq=48793 Ack=16313 Win=65535 Len=0"
"479","118.195814","157.240.196.60","10.0.2.15","TLSv1.2","181","Application Data"
"480","118.195840","10.0.2.15","157.240.196.60","TCP","54","59888  >  443 [ACK] Seq=16313 Ack=48920 Win=65535 Len=0"
"481","118.233395","10.0.2.15","157.240.196.60","TLSv1.2","147","Application Data"
"482","118.233787","157.240.196.60","10.0.2.15","TCP","54","443  >  59888 [ACK] Seq=48920 Ack=16406 Win=65535 Len=0"
"483","118.257306","157.240.196.60","10.0.2.15","TLSv1.2","295","Application Data"
"484","118.257331","10.0.2.15","157.240.196.60","TCP","54","59888  >  443 [ACK] Seq=16406 Ack=49161 Win=65535 Len=0"
"485","118.437510","157.240.196.60","10.0.2.15","TLSv1.2","311","Application Data"
"486","118.437537","10.0.2.15","157.240.196.60","TCP","54","59888  >  443 [ACK] Seq=16406 Ack=49418 Win=65535 Len=0"
"487","118.468349","157.240.196.60","10.0.2.15","TLSv1.2","181","Application Data"
"488","118.468441","10.0.2.15","157.240.196.60","TCP","54","59888  >  443 [ACK] Seq=16406 Ack=49545 Win=65535 Len=0"
"489","118.489614","10.0.2.15","157.240.196.60","TLSv1.2","147","Application Data"
"490","118.490049","157.240.196.60","10.0.2.15","TCP","54","443  >  59888 [ACK] Seq=49545 Ack=16499 Win=65535 Len=0"
"491","118.524962","10.0.2.15","157.240.196.60","TLSv1.2","143","Application Data"
"492","118.525397","157.240.196.60","10.0.2.15","TCP","54","443  >  59888 [ACK] Seq=49545 Ack=16588 Win=65535 Len=0"
"493","118.641782","157.240.196.60","10.0.2.15","TLSv1.2","181","Application Data"
"494","118.687956","10.0.2.15","157.240.196.60","TCP","54","59888  >  443 [ACK] Seq=16588 Ack=49672 Win=65535 Len=0"
"495","118.696416","10.0.2.15","157.240.196.60","TLSv1.2","147","Application Data"
"496","118.708659","157.240.196.60","10.0.2.15","TCP","54","443  >  59888 [ACK] Seq=49672 Ack=16681 Win=65535 Len=0"
"497","118.721352","157.240.196.60","10.0.2.15","TLSv1.2","295","Application Data"
"498","118.721389","10.0.2.15","157.240.196.60","TCP","54","59888  >  443 [ACK] Seq=16681 Ack=49913 Win=65535 Len=0"
"499","118.867591","157.240.196.60","10.0.2.15","TLSv1.2","311","Application Data"
"500","118.867621","10.0.2.15","157.240.196.60","TCP","54","59888  >  443 [ACK] Seq=16681 Ack=50170 Win=65535 Len=0"
"501","118.939670","157.240.196.60","10.0.2.15","TLSv1.2","181","Application Data"
"502","118.939701","10.0.2.15","157.240.196.60","TCP","54","59888  >  443 [ACK] Seq=16681 Ack=50297 Win=65535 Len=0"
"503","119.003901","10.0.2.15","157.240.196.60","TLSv1.2","147","Application Data"
"504","119.013383","157.240.196.60","10.0.2.15","TCP","54","443  >  59888 [ACK] Seq=50297 Ack=16774 Win=65535 Len=0"
"505","119.057563","10.0.2.15","157.240.196.60","TLSv1.2","143","Application Data"
"506","119.058079","157.240.196.60","10.0.2.15","TCP","54","443  >  59888 [ACK] Seq=50297 Ack=16863 Win=65535 Len=0"
"507","119.058079","157.240.196.60","10.0.2.15","TLSv1.2","181","Application Data"
"508","119.058100","10.0.2.15","157.240.196.60","TCP","54","59888  >  443 [ACK] Seq=16863 Ack=50424 Win=65535 Len=0"
"509","119.074885","10.0.2.15","157.240.196.60","TLSv1.2","147","Application Data"
"510","119.075234","157.240.196.60","10.0.2.15","TCP","54","443  >  59888 [ACK] Seq=50424 Ack=16956 Win=65535 Len=0"
"511","119.171154","10.0.2.15","157.240.196.60","TLSv1.2","143","Application Data"
"512","119.171560","157.240.196.60","10.0.2.15","TCP","54","443  >  59888 [ACK] Seq=50424 Ack=17045 Win=65535 Len=0"
"513","119.317893","157.240.196.60","10.0.2.15","TLSv1.2","311","Application Data"
"514","119.366426","10.0.2.15","157.240.196.60","TCP","54","59888  >  443 [ACK] Seq=17045 Ack=50681 Win=65535 Len=0"
"515","119.480849","157.240.196.60","10.0.2.15","TLSv1.2","311","Application Data"
"516","119.485527","10.0.2.15","157.240.196.60","TCP","54","59888  >  443 [ACK] Seq=17045 Ack=50938 Win=65535 Len=0"
"517","119.557628","157.240.196.60","10.0.2.15","TLSv1.2","181","Application Data"
"518","119.557654","10.0.2.15","157.240.196.60","TCP","54","59888  >  443 [ACK] Seq=17045 Ack=51065 Win=65535 Len=0"
"519","119.605060","10.0.2.15","157.240.196.60","TLSv1.2","143","Application Data"
"520","119.611117","157.240.196.60","10.0.2.15","TCP","54","443  >  59888 [ACK] Seq=51065 Ack=17134 Win=65535 Len=0"
"521","119.621671","10.0.2.15","157.240.196.60","TLSv1.2","147","Application Data"
"522","119.622305","157.240.196.60","10.0.2.15","TCP","54","443  >  59888 [ACK] Seq=51065 Ack=17227 Win=65535 Len=0"
"523","119.634105","157.240.196.60","10.0.2.15","TLSv1.2","295","Application Data"
"524","119.634131","10.0.2.15","157.240.196.60","TCP","54","59888  >  443 [ACK] Seq=17227 Ack=51306 Win=65535 Len=0"
"525","119.659509","157.240.196.60","10.0.2.15","TLSv1.2","181","Application Data"
"526","119.659536","10.0.2.15","157.240.196.60","TCP","54","59888  >  443 [ACK] Seq=17227 Ack=51433 Win=65535 Len=0"
"527","119.733441","10.0.2.15","157.240.196.60","TLSv1.2","147","Application Data"
"528","119.745254","157.240.196.60","10.0.2.15","TCP","54","443  >  59888 [ACK] Seq=51433 Ack=17320 Win=65535 Len=0"
"529","119.827729","157.240.196.60","10.0.2.15","TLSv1.2","181","Application Data"
"530","119.827782","10.0.2.15","157.240.196.60","TCP","54","59888  >  443 [ACK] Seq=17320 Ack=51560 Win=65535 Len=0"
"531","119.863585","157.240.196.60","10.0.2.15","TLSv1.2","311","Application Data"
"532","119.863610","10.0.2.15","157.240.196.60","TCP","54","59888  >  443 [ACK] Seq=17320 Ack=51817 Win=65535 Len=0"
"533","120.029510","10.0.2.15","157.240.196.60","TLSv1.2","147","Application Data"
"534","120.031351","157.240.196.60","10.0.2.15","TCP","54","443  >  59888 [ACK] Seq=51817 Ack=17413 Win=65535 Len=0"
"535","120.059212","157.240.196.60","10.0.2.15","TLSv1.2","181","Application Data"
"536","120.059236","10.0.2.15","157.240.196.60","TCP","54","59888  >  443 [ACK] Seq=17413 Ack=51944 Win=65535 Len=0"
"537","120.117528","10.0.2.15","157.240.196.60","TLSv1.2","147","Application Data"
"538","120.118084","157.240.196.60","10.0.2.15","TCP","54","443  >  59888 [ACK] Seq=51944 Ack=17506 Win=65535 Len=0"
"539","120.166687","10.0.2.15","157.240.196.60","TLSv1.2","143","Application Data"
"540","120.167088","157.240.196.60","10.0.2.15","TCP","54","443  >  59888 [ACK] Seq=51944 Ack=17595 Win=65535 Len=0"
"541","120.325316","157.240.196.60","10.0.2.15","TLSv1.2","311","Application Data"
"542","120.325363","10.0.2.15","157.240.196.60","TCP","54","59888  >  443 [ACK] Seq=17595 Ack=52201 Win=65535 Len=0"
"543","120.342476","10.0.2.15","157.240.196.60","TLSv1.2","143","Application Data"
"544","120.343226","157.240.196.60","10.0.2.15","TCP","54","443  >  59888 [ACK] Seq=52201 Ack=17684 Win=65535 Len=0"
"545","120.533984","10.0.2.15","157.240.196.60","TLSv1.2","143","Application Data"
"546","120.534430","157.240.196.60","10.0.2.15","TCP","54","443  >  59888 [ACK] Seq=52201 Ack=17773 Win=65535 Len=0"
"547","120.572083","157.240.196.60","10.0.2.15","TLSv1.2","181","Application Data"
"548","120.576857","10.0.2.15","157.240.196.60","TLSv1.2","147","Application Data"
"549","120.577519","157.240.196.60","10.0.2.15","TCP","54","443  >  59888 [ACK] Seq=52328 Ack=17866 Win=65535 Len=0"
"550","120.630851","157.240.196.60","10.0.2.15","TLSv1.2","311","Application Data"
"551","120.645787","10.0.2.15","157.240.196.60","TLSv1.2","143","Application Data"
"552","120.648784","157.240.196.60","10.0.2.15","TCP","54","443  >  59888 [ACK] Seq=52585 Ack=17955 Win=65535 Len=0"
"553","120.711477","10.0.2.15","157.240.196.60","TLSv1.2","143","Application Data"
"554","120.711907","157.240.196.60","10.0.2.15","TCP","54","443  >  59888 [ACK] Seq=52585 Ack=18044 Win=65535 Len=0"
"555","120.744010","157.240.196.60","10.0.2.15","TLSv1.2","295","Application Data"
"556","120.791899","10.0.2.15","157.240.196.60","TCP","54","59888  >  443 [ACK] Seq=18044 Ack=52826 Win=65535 Len=0"
"557","120.842047","10.0.2.15","157.240.196.60","TLSv1.2","143","Application Data"
"558","120.850412","157.240.196.60","10.0.2.15","TLSv1.2","181","Application Data"
"559","120.850432","10.0.2.15","157.240.196.60","TCP","54","59888  >  443 [ACK] Seq=18133 Ack=52953 Win=65535 Len=0"
"560","120.850413","157.240.196.60","10.0.2.15","TCP","54","443  >  59888 [ACK] Seq=52953 Ack=18133 Win=65535 Len=0"
"561","120.881870","10.0.2.15","157.240.196.60","TLSv1.2","147","Application Data"
"562","120.882624","157.240.196.60","10.0.2.15","TCP","54","443  >  59888 [ACK] Seq=52953 Ack=18226 Win=65535 Len=0"
"563","120.937039","157.240.196.60","10.0.2.15","TLSv1.2","181","Application Data"
"564","120.937039","157.240.196.60","10.0.2.15","TLSv1.2","311","Application Data"
"565","120.941047","10.0.2.15","157.240.196.60","TCP","54","59888  >  443 [ACK] Seq=18226 Ack=53337 Win=65535 Len=0"
"566","120.952346","10.0.2.15","157.240.196.60","TLSv1.2","147","Application Data"
"567","120.957818","157.240.196.60","10.0.2.15","TCP","54","443  >  59888 [ACK] Seq=53337 Ack=18319 Win=65535 Len=0"
"570","121.131037","157.240.196.60","10.0.2.15","TLSv1.2","181","Application Data"
"571","121.148535","157.240.196.60","10.0.2.15","TLSv1.2","311","Application Data"
"574","121.148963","10.0.2.15","157.240.196.60","TCP","54","59888  >  443 [ACK] Seq=18319 Ack=53721 Win=65535 Len=0"
"575","121.169179","10.0.2.15","157.240.196.60","TLSv1.2","147","Application Data"
"576","121.169555","157.240.196.60","10.0.2.15","TCP","54","443  >  59888 [ACK] Seq=53721 Ack=18412 Win=65535 Len=0"
"577","121.171257","10.0.2.15","157.240.196.60","TLSv1.2","143","Application Data"
"578","121.171621","157.240.196.60","10.0.2.15","TCP","54","443  >  59888 [ACK] Seq=53721 Ack=18501 Win=65535 Len=0"
"579","121.260949","10.0.2.15","157.240.196.60","TLSv1.2","143","Application Data"
"580","121.266815","157.240.196.60","10.0.2.15","TCP","54","443  >  59888 [ACK] Seq=53721 Ack=18590 Win=65535 Len=0"
"581","121.281915","157.240.196.60","10.0.2.15","TLSv1.2","311","Application Data"
"582","121.333833","10.0.2.15","157.240.196.60","TCP","54","59888  >  443 [ACK] Seq=18590 Ack=53978 Win=65535 Len=0"
"583","121.360220","157.240.196.60","10.0.2.15","TLSv1.2","181","Application Data"
"584","121.360244","10.0.2.15","157.240.196.60","TCP","54","59888  >  443 [ACK] Seq=18590 Ack=54105 Win=65535 Len=0"
"585","121.447568","10.0.2.15","157.240.196.60","TLSv1.2","147","Application Data"
"586","121.454512","157.240.196.60","10.0.2.15","TCP","54","443  >  59888 [ACK] Seq=54105 Ack=18683 Win=65535 Len=0"
"587","121.488647","157.240.196.60","10.0.2.15","TLSv1.2","295","Application Data"
"588","121.488944","10.0.2.15","157.240.196.60","TCP","54","59888  >  443 [ACK] Seq=18683 Ack=54346 Win=65535 Len=0"
"589","121.512711","157.240.196.60","10.0.2.15","TLSv1.2","181","Application Data"
"590","121.516213","10.0.2.15","157.240.196.60","TCP","54","59888  >  443 [ACK] Seq=18683 Ack=54473 Win=65535 Len=0"
"591","121.565387","10.0.2.15","157.240.196.60","TLSv1.2","147","Application Data"
"592","121.565930","157.240.196.60","10.0.2.15","TCP","54","443  >  59888 [ACK] Seq=54473 Ack=18776 Win=65535 Len=0"
"593","121.663911","157.240.196.60","10.0.2.15","TLSv1.2","311","Application Data"
"594","121.663978","10.0.2.15","157.240.196.60","TCP","54","59888  >  443 [ACK] Seq=18776 Ack=54730 Win=65535 Len=0"
"595","121.681374","157.240.196.60","10.0.2.15","TLSv1.2","181","Application Data"
"596","121.681437","10.0.2.15","157.240.196.60","TCP","54","59888  >  443 [ACK] Seq=18776 Ack=54857 Win=65535 Len=0"
"597","121.704730","10.0.2.15","157.240.196.60","TLSv1.2","147","Application Data"
"598","121.705260","157.240.196.60","10.0.2.15","TCP","54","443  >  59888 [ACK] Seq=54857 Ack=18869 Win=65535 Len=0"
"599","121.783806","10.0.2.15","157.240.196.60","TLSv1.2","143","Application Data"
"600","121.784198","157.240.196.60","10.0.2.15","TCP","54","443  >  59888 [ACK] Seq=54857 Ack=18958 Win=65535 Len=0"
"601","121.831484","157.240.196.60","10.0.2.15","TLSv1.2","295","Application Data"
"602","121.856710","157.240.196.60","10.0.2.15","TLSv1.2","181","Application Data"
"603","121.857632","10.0.2.15","157.240.196.60","TCP","54","59888  >  443 [ACK] Seq=18958 Ack=55225 Win=65535 Len=0"
"604","121.931321","10.0.2.15","157.240.196.60","TLSv1.2","147","Application Data"
"605","121.933246","157.240.196.60","10.0.2.15","TCP","54","443  >  59888 [ACK] Seq=55225 Ack=19051 Win=65535 Len=0"
"606","121.974484","157.240.196.60","10.0.2.15","TLSv1.2","295","Application Data"
"607","122.017092","10.0.2.15","157.240.196.60","TCP","54","59888  >  443 [ACK] Seq=19051 Ack=55466 Win=65535 Len=0"
"608","122.037489","157.240.196.60","10.0.2.15","TLSv1.2","181","Application Data"
"609","122.037549","10.0.2.15","157.240.196.60","TCP","54","59888  >  443 [ACK] Seq=19051 Ack=55593 Win=65535 Len=0"
"610","122.126935","10.0.2.15","157.240.196.60","TLSv1.2","147","Application Data"
"611","122.127343","157.240.196.60","10.0.2.15","TCP","54","443  >  59888 [ACK] Seq=55593 Ack=19144 Win=65535 Len=0"
"612","122.132675","10.0.2.15","157.240.196.60","TLSv1.2","143","Application Data"
"613","122.133187","157.240.196.60","10.0.2.15","TCP","54","443  >  59888 [ACK] Seq=55593 Ack=19233 Win=65535 Len=0"
"614","122.146517","157.240.196.60","10.0.2.15","TLSv1.2","181","Application Data"
"615","122.146624","10.0.2.15","157.240.196.60","TCP","54","59888  >  443 [ACK] Seq=19233 Ack=55720 Win=65535 Len=0"
"616","122.164975","157.240.196.60","10.0.2.15","TLSv1.2","295","Application Data"
"617","122.165104","10.0.2.15","157.240.196.60","TLSv1.2","147","Application Data"
"618","122.165471","157.240.196.60","10.0.2.15","TCP","54","443  >  59888 [ACK] Seq=55961 Ack=19326 Win=65535 Len=0"
"619","122.206580","10.0.2.15","157.240.196.60","TLSv1.2","143","Application Data"
"620","122.210328","157.240.196.60","10.0.2.15","TCP","54","443  >  59888 [ACK] Seq=55961 Ack=19415 Win=65535 Len=0"
"621","122.341849","10.0.2.15","157.240.196.60","TLSv1.2","143","Application Data"
"622","122.349016","157.240.196.60","10.0.2.15","TCP","54","443  >  59888 [ACK] Seq=55961 Ack=19504 Win=65535 Len=0"
"623","122.361792","157.240.196.60","10.0.2.15","TLSv1.2","181","Application Data"
"624","122.416127","10.0.2.15","157.240.196.60","TCP","54","59888  >  443 [ACK] Seq=19504 Ack=56088 Win=65535 Len=0"
"625","122.454490","10.0.2.15","157.240.196.60","TLSv1.2","147","Application Data"
"626","122.457052","157.240.196.60","10.0.2.15","TCP","54","443  >  59888 [ACK] Seq=56088 Ack=19597 Win=65535 Len=0"
"627","122.474708","157.240.196.60","10.0.2.15","TLSv1.2","295","Application Data"
"628","122.474782","10.0.2.15","157.240.196.60","TCP","54","59888  >  443 [ACK] Seq=19597 Ack=56329 Win=65535 Len=0"
"629","122.708498","157.240.196.60","10.0.2.15","TLSv1.2","181","Application Data"
"630","122.708528","10.0.2.15","157.240.196.60","TCP","54","59888  >  443 [ACK] Seq=19597 Ack=56456 Win=65535 Len=0"
"631","122.744018","10.0.2.15","157.240.196.60","TLSv1.2","147","Application Data"
"632","122.752679","157.240.196.60","10.0.2.15","TCP","54","443  >  59888 [ACK] Seq=56456 Ack=19690 Win=65535 Len=0"
"633","122.757433","10.0.2.15","157.240.196.60","TLSv1.2","143","Application Data"
"634","122.757862","157.240.196.60","10.0.2.15","TCP","54","443  >  59888 [ACK] Seq=56456 Ack=19779 Win=65535 Len=0"
"635","123.134857","10.0.2.15","157.240.196.60","TLSv1.2","143","Application Data"
"636","123.135355","157.240.196.60","10.0.2.15","TCP","54","443  >  59888 [ACK] Seq=56456 Ack=19868 Win=65535 Len=0"
"637","123.242479","10.0.2.15","157.240.196.60","TLSv1.2","143","Application Data"
"638","123.243143","157.240.196.60","10.0.2.15","TCP","54","443  >  59888 [ACK] Seq=56456 Ack=19957 Win=65535 Len=0"
"639","123.359315","10.0.2.15","157.240.196.60","TLSv1.2","143","Application Data"
"640","123.360116","157.240.196.60","10.0.2.15","TCP","54","443  >  59888 [ACK] Seq=56456 Ack=20046 Win=65535 Len=0"
"641","123.755430","157.240.196.60","10.0.2.15","TLSv1.2","327","Application Data"
"642","123.796956","10.0.2.15","157.240.196.60","TCP","54","59888  >  443 [ACK] Seq=20046 Ack=56729 Win=65535 Len=0"
"643","123.849835","10.0.2.15","157.240.196.60","TLSv1.2","143","Application Data"
"644","123.850488","157.240.196.60","10.0.2.15","TCP","54","443  >  59888 [ACK] Seq=56729 Ack=20135 Win=65535 Len=0"
"645","123.996626","157.240.196.60","10.0.2.15","TLSv1.2","181","Application Data"
"646","123.996650","10.0.2.15","157.240.196.60","TCP","54","59888  >  443 [ACK] Seq=20135 Ack=56856 Win=65535 Len=0"
"647","124.007490","10.0.2.15","157.240.196.60","TLSv1.2","147","Application Data"
"648","124.007851","157.240.196.60","10.0.2.15","TCP","54","443  >  59888 [ACK] Seq=56856 Ack=20228 Win=65535 Len=0"
"649","125.415139","10.0.2.15","157.240.196.60","TLSv1.2","123","Application Data"
"650","125.419902","157.240.196.60","10.0.2.15","TCP","54","443  >  59888 [ACK] Seq=56856 Ack=20297 Win=65535 Len=0"
"651","125.559332","157.240.196.60","10.0.2.15","TLSv1.2","343","Application Data"
"652","125.561844","157.240.196.60","10.0.2.15","TLSv1.2","125","Application Data"
"653","125.562776","10.0.2.15","157.240.196.60","TCP","54","59888  >  443 [ACK] Seq=20297 Ack=57216 Win=65535 Len=0"
"654","125.819690","157.240.196.60","10.0.2.15","TLSv1.2","181","Application Data"
"655","125.877865","10.0.2.15","157.240.196.60","TCP","54","59888  >  443 [ACK] Seq=20297 Ack=57343 Win=65535 Len=0"
"656","125.915370","10.0.2.15","157.240.196.60","TLSv1.2","147","Application Data"
"657","125.921623","157.240.196.60","10.0.2.15","TCP","54","443  >  59888 [ACK] Seq=57343 Ack=20390 Win=65535 Len=0"
"658","125.921647","10.0.2.15","157.240.196.60","TLSv1.2","143","Application Data"
"659","125.930422","157.240.196.60","10.0.2.15","TCP","54","443  >  59888 [ACK] Seq=57343 Ack=20479 Win=65535 Len=0"
"660","128.071421","157.240.196.60","10.0.2.15","TCP","1514","443  >  59888 [ACK] Seq=57343 Ack=20479 Win=65535 Len=1460 [TCP segment of a reassembled PDU]"
"661","128.072042","10.0.2.15","157.240.196.60","TCP","54","59888  >  443 [ACK] Seq=20479 Ack=58803 Win=65535 Len=0"
"662","128.074233","157.240.196.60","10.0.2.15","TLSv1.2","220","Application Data, Application Data"
"663","128.074270","10.0.2.15","157.240.196.60","TCP","54","59888  >  443 [ACK] Seq=20479 Ack=58969 Win=65535 Len=0"
"664","128.290690","10.0.2.15","157.240.196.60","TLSv1.2","143","Application Data"
"665","128.293097","157.240.196.60","10.0.2.15","TCP","54","443  >  59888 [ACK] Seq=58969 Ack=20568 Win=65535 Len=0"
"666","128.359775","157.240.196.60","10.0.2.15","TLSv1.2","181","Application Data"
"667","128.359801","10.0.2.15","157.240.196.60","TCP","54","59888  >  443 [ACK] Seq=20568 Ack=59096 Win=65535 Len=0"
"668","128.363090","10.0.2.15","157.240.196.60","TLSv1.2","147","Application Data"
"669","128.363493","157.240.196.60","10.0.2.15","TCP","54","443  >  59888 [ACK] Seq=59096 Ack=20661 Win=65535 Len=0"
"670","129.933789","157.240.196.60","10.0.2.15","TCP","1514","443  >  59888 [ACK] Seq=59096 Ack=20661 Win=65535 Len=1460 [TCP segment of a reassembled PDU]"
"671","129.987645","10.0.2.15","157.240.196.60","TCP","54","59888  >  443 [ACK] Seq=20661 Ack=60556 Win=65535 Len=0"
"672","129.988936","157.240.196.60","10.0.2.15","TLSv1.2","188","Application Data, Application Data"
"673","129.988978","10.0.2.15","157.240.196.60","TCP","54","59888  >  443 [ACK] Seq=20661 Ack=60690 Win=65535 Len=0"
"674","130.183260","10.0.2.15","157.240.196.60","TLSv1.2","143","Application Data"
"675","130.183808","157.240.196.60","10.0.2.15","TCP","54","443  >  59888 [ACK] Seq=60690 Ack=20750 Win=65535 Len=0"
"676","130.200457","157.240.196.60","10.0.2.15","TLSv1.2","181","Application Data"
"677","130.200604","10.0.2.15","157.240.196.60","TCP","54","59888  >  443 [ACK] Seq=20750 Ack=60817 Win=65535 Len=0"
"678","130.261869","10.0.2.15","157.240.196.60","TLSv1.2","147","Application Data"
"679","130.265784","157.240.196.60","10.0.2.15","TCP","54","443  >  59888 [ACK] Seq=60817 Ack=20843 Win=65535 Len=0"
"680","134.936197","157.240.196.60","10.0.2.15","TLSv1.2","375","Application Data"
"681","134.936235","10.0.2.15","157.240.196.60","TCP","54","59888  >  443 [ACK] Seq=20843 Ack=61138 Win=65535 Len=0"
"682","135.206944","157.240.196.60","10.0.2.15","TLSv1.2","181","Application Data"
"683","135.206970","10.0.2.15","157.240.196.60","TCP","54","59888  >  443 [ACK] Seq=20843 Ack=61265 Win=65535 Len=0"
"684","135.290092","10.0.2.15","157.240.196.60","TLSv1.2","147","Application Data"
"685","135.290592","157.240.196.60","10.0.2.15","TCP","54","443  >  59888 [ACK] Seq=61265 Ack=20936 Win=65535 Len=0"
"686","135.291305","10.0.2.15","157.240.196.60","TLSv1.2","143","Application Data"
"687","135.291832","157.240.196.60","10.0.2.15","TCP","54","443  >  59888 [ACK] Seq=61265 Ack=21025 Win=65535 Len=0"
"688","136.333036","157.240.196.60","10.0.2.15","TLSv1.2","305","Application Data"
"689","136.333191","10.0.2.15","157.240.196.60","TCP","54","59888  >  443 [ACK] Seq=21025 Ack=61516 Win=65535 Len=0"
"690","136.505673","10.0.2.15","157.240.196.60","TLSv1.2","147","Application Data"
"691","136.506229","157.240.196.60","10.0.2.15","TCP","54","443  >  59888 [ACK] Seq=61516 Ack=21118 Win=65535 Len=0"
"692","137.906759","157.240.196.60","10.0.2.15","TLSv1.2","343","Application Data"
"693","137.906792","10.0.2.15","157.240.196.60","TCP","54","59888  >  443 [ACK] Seq=21118 Ack=61805 Win=65535 Len=0"
"694","138.100719","10.0.2.15","157.240.196.60","TLSv1.2","143","Application Data"
"695","138.101243","157.240.196.60","10.0.2.15","TCP","54","443  >  59888 [ACK] Seq=61805 Ack=21207 Win=65535 Len=0"
"696","138.145350","157.240.196.60","10.0.2.15","TLSv1.2","181","Application Data"
"697","138.145378","10.0.2.15","157.240.196.60","TCP","54","59888  >  443 [ACK] Seq=21207 Ack=61932 Win=65535 Len=0"
"698","138.182048","10.0.2.15","157.240.196.60","TLSv1.2","147","Application Data"
"699","138.182595","157.240.196.60","10.0.2.15","TCP","54","443  >  59888 [ACK] Seq=61932 Ack=21300 Win=65535 Len=0"
"700","140.329463","157.240.196.60","10.0.2.15","TLSv1.2","270","Application Data"
"701","140.386437","10.0.2.15","157.240.196.60","TCP","54","59888  >  443 [ACK] Seq=21300 Ack=62148 Win=65535 Len=0"
"702","140.418070","10.0.2.15","157.240.196.60","TLSv1.2","148","Application Data"
"703","140.431750","157.240.196.60","10.0.2.15","TCP","54","443  >  59888 [ACK] Seq=62148 Ack=21394 Win=65535 Len=0"
"704","140.440363","10.0.2.15","157.240.196.60","TLSv1.2","129","Application Data"
"705","140.440859","157.240.196.60","10.0.2.15","TCP","54","443  >  59888 [ACK] Seq=62148 Ack=21469 Win=65535 Len=0"
"706","141.670026","10.0.2.15","157.240.196.60","TLSv1.2","123","Application Data"
"707","141.671803","157.240.196.60","10.0.2.15","TCP","54","443  >  59888 [ACK] Seq=62148 Ack=21538 Win=65535 Len=0"
"708","141.817390","157.240.196.60","10.0.2.15","TLSv1.2","125","Application Data"
"709","141.817444","10.0.2.15","157.240.196.60","TCP","54","59888  >  443 [ACK] Seq=21538 Ack=62219 Win=65535 Len=0"
