"No.","Time","Source","Destination","Protocol","Length","Info"
"1","0.000000","157.240.196.60","10.0.2.15","TLSv1.2","270","Application Data"
"2","0.000289","10.0.2.15","157.240.196.60","TCP","54","43620  >  443 [ACK] Seq=1 Ack=217 Win=65535 Len=0"
"3","0.090135","10.0.2.15","157.240.196.60","TLSv1.2","148","Application Data"
"4","0.091591","157.240.196.60","10.0.2.15","TCP","54","443  >  43620 [ACK] Seq=217 Ack=95 Win=65535 Len=0"
"5","0.107784","10.0.2.15","157.240.196.60","TLSv1.2","129","Application Data"
"6","0.108155","157.240.196.60","10.0.2.15","TCP","54","443  >  43620 [ACK] Seq=217 Ack=170 Win=65535 Len=0"
"7","0.781802","10.0.2.15","157.240.195.56","TLSv1.2","93","Application Data"
"8","0.783108","157.240.195.56","10.0.2.15","TCP","54","443  >  33684 [ACK] Seq=1 Ack=40 Win=65535 Len=0"
"9","0.835910","157.240.195.56","10.0.2.15","TLSv1.2","93","Application Data"
"10","0.835971","10.0.2.15","157.240.195.56","TCP","54","33684  >  443 [ACK] Seq=40 Ack=40 Win=64032 Len=0"
"11","4.124204","10.0.2.15","157.240.196.60","TLSv1.2","124","Application Data"
"12","4.156507","157.240.196.60","10.0.2.15","TCP","54","443  >  43620 [ACK] Seq=217 Ack=240 Win=65535 Len=0"
"13","4.269772","157.240.196.60","10.0.2.15","TLSv1.2","126","Application Data"
"14","4.269801","10.0.2.15","157.240.196.60","TCP","54","43620  >  443 [ACK] Seq=240 Ack=289 Win=65535 Len=0"
"15","10.223295","157.240.196.60","10.0.2.15","TLSv1.2","295","Application Data"
"16","10.223669","10.0.2.15","157.240.196.60","TCP","54","43620  >  443 [ACK] Seq=240 Ack=530 Win=65535 Len=0"
"17","10.411301","10.0.2.15","157.240.196.60","TLSv1.2","143","Application Data"
"18","10.413773","157.240.196.60","10.0.2.15","TCP","54","443  >  43620 [ACK] Seq=530 Ack=329 Win=65535 Len=0"
"19","12.083225","157.240.196.60","10.0.2.15","TLSv1.2","311","Application Data"
"20","12.083255","10.0.2.15","157.240.196.60","TCP","54","43620  >  443 [ACK] Seq=329 Ack=787 Win=65535 Len=0"
"21","12.242649","10.0.2.15","157.240.196.60","TLSv1.2","143","Application Data"
"22","12.243223","157.240.196.60","10.0.2.15","TCP","54","443  >  43620 [ACK] Seq=787 Ack=418 Win=65535 Len=0"
"23","13.754894","157.240.196.60","10.0.2.15","TLSv1.2","311","Application Data"
"24","13.755214","10.0.2.15","157.240.196.60","TCP","54","43620  >  443 [ACK] Seq=418 Ack=1044 Win=65535 Len=0"
"25","13.953106","10.0.2.15","157.240.196.60","TLSv1.2","143","Application Data"
"26","13.953904","157.240.196.60","10.0.2.15","TCP","54","443  >  43620 [ACK] Seq=1044 Ack=507 Win=65535 Len=0"
"27","14.471817","157.240.196.60","10.0.2.15","TLSv1.2","311","Application Data"
"28","14.471850","10.0.2.15","157.240.196.60","TCP","54","43620  >  443 [ACK] Seq=507 Ack=1301 Win=65535 Len=0"
"29","14.544567","10.0.2.15","157.240.196.60","TLSv1.2","143","Application Data"
"30","14.545318","157.240.196.60","10.0.2.15","TCP","54","443  >  43620 [ACK] Seq=1301 Ack=596 Win=65535 Len=0"
"31","14.957524","157.240.196.60","10.0.2.15","TLSv1.2","311","Application Data"
"32","14.957602","10.0.2.15","157.240.196.60","TCP","54","43620  >  443 [ACK] Seq=596 Ack=1558 Win=65535 Len=0"
"33","15.350117","157.240.196.60","10.0.2.15","TLSv1.2","295","Application Data"
"34","15.350143","10.0.2.15","157.240.196.60","TCP","54","43620  >  443 [ACK] Seq=596 Ack=1799 Win=65535 Len=0"
"35","15.392469","10.0.2.15","157.240.196.60","TLSv1.2","143","Application Data"
"36","15.393317","157.240.196.60","10.0.2.15","TCP","54","443  >  43620 [ACK] Seq=1799 Ack=685 Win=65535 Len=0"
"37","15.547788","10.0.2.15","157.240.196.60","TLSv1.2","143","Application Data"
"38","15.551370","157.240.196.60","10.0.2.15","TCP","54","443  >  43620 [ACK] Seq=1799 Ack=774 Win=65535 Len=0"
"39","15.746883","157.240.196.60","10.0.2.15","TLSv1.2","311","Application Data"
"40","15.746912","10.0.2.15","157.240.196.60","TCP","54","43620  >  443 [ACK] Seq=774 Ack=2056 Win=65535 Len=0"
"41","15.937774","10.0.2.15","157.240.196.60","TLSv1.2","143","Application Data"
"42","15.938438","157.240.196.60","10.0.2.15","TCP","54","443  >  43620 [ACK] Seq=2056 Ack=863 Win=65535 Len=0"
"43","16.392075","157.240.196.60","10.0.2.15","TLSv1.2","311","Application Data"
"44","16.392278","10.0.2.15","157.240.196.60","TCP","54","43620  >  443 [ACK] Seq=863 Ack=2313 Win=65535 Len=0"
"45","16.567626","10.0.2.15","157.240.196.60","TLSv1.2","143","Application Data"
"46","16.568048","157.240.196.60","10.0.2.15","TCP","54","443  >  43620 [ACK] Seq=2313 Ack=952 Win=65535 Len=0"
"47","16.790557","10.0.2.15","157.240.196.60","TLSv1.2","93","Application Data"
"48","16.796033","157.240.196.60","10.0.2.15","TCP","54","443  >  36970 [ACK] Seq=1 Ack=40 Win=65535 Len=0"
"49","16.846906","157.240.196.60","10.0.2.15","TLSv1.2","93","Application Data"
"50","16.846933","10.0.2.15","157.240.196.60","TCP","54","36970  >  443 [ACK] Seq=40 Ack=40 Win=64028 Len=0"
"51","16.973066","157.240.196.60","10.0.2.15","TLSv1.2","295","Application Data"
"52","16.973097","10.0.2.15","157.240.196.60","TCP","54","43620  >  443 [ACK] Seq=952 Ack=2554 Win=65535 Len=0"
"53","17.034243","10.0.2.15","157.240.196.60","TLSv1.2","143","Application Data"
"54","17.034666","157.240.196.60","10.0.2.15","TCP","54","443  >  43620 [ACK] Seq=2554 Ack=1041 Win=65535 Len=0"
"55","17.287872","157.240.196.60","10.0.2.15","TLSv1.2","311","Application Data"
"56","17.287904","10.0.2.15","157.240.196.60","TCP","54","43620  >  443 [ACK] Seq=1041 Ack=2811 Win=65535 Len=0"
"57","17.582080","157.240.196.60","10.0.2.15","TLSv1.2","311","Application Data"
"58","17.582104","10.0.2.15","157.240.196.60","TCP","54","43620  >  443 [ACK] Seq=1041 Ack=3068 Win=65535 Len=0"
"59","17.997497","157.240.196.60","10.0.2.15","TLSv1.2","311","Application Data"
"60","17.997524","10.0.2.15","157.240.196.60","TCP","54","43620  >  443 [ACK] Seq=1041 Ack=3325 Win=65535 Len=0"
"61","18.056714","10.0.2.15","157.240.196.60","TLSv1.2","143","Application Data"
"62","18.057525","157.240.196.60","10.0.2.15","TCP","54","443  >  43620 [ACK] Seq=3325 Ack=1130 Win=65535 Len=0"
"63","18.211648","10.0.2.15","157.240.196.60","TLSv1.2","143","Application Data"
"64","18.218623","157.240.196.60","10.0.2.15","TCP","54","443  >  43620 [ACK] Seq=3325 Ack=1219 Win=65535 Len=0"
"65","18.451647","10.0.2.15","157.240.196.60","TLSv1.2","143","Application Data"
"66","18.454291","157.240.196.60","10.0.2.15","TCP","54","443  >  43620 [ACK] Seq=3325 Ack=1308 Win=65535 Len=0"
"67","19.473126","157.240.196.60","10.0.2.15","TLSv1.2","1664","Application Data, Application Data"
"68","19.473423","10.0.2.15","157.240.196.60","TCP","54","43620  >  443 [ACK] Seq=1308 Ack=4935 Win=65535 Len=0"
"69","19.604911","10.0.2.15","157.240.196.60","TLSv1.2","143","Application Data"
"70","19.605344","157.240.196.60","10.0.2.15","TCP","54","443  >  43620 [ACK] Seq=4935 Ack=1397 Win=65535 Len=0"
"71","20.952888","157.240.196.60","10.0.2.15","TLSv1.2","1648","Application Data, Application Data"
"72","20.953207","10.0.2.15","157.240.196.60","TCP","54","43620  >  443 [ACK] Seq=1397 Ack=6529 Win=65535 Len=0"
"73","21.196641","10.0.2.15","157.240.196.60","TLSv1.2","143","Application Data"
"74","21.200453","157.240.196.60","10.0.2.15","TCP","54","443  >  43620 [ACK] Seq=6529 Ack=1486 Win=65535 Len=0"
"75","22.077608","157.240.196.60","10.0.2.15","TLSv1.2","327","Application Data"
"76","22.077708","10.0.2.15","157.240.196.60","TCP","54","43620  >  443 [ACK] Seq=1486 Ack=6802 Win=65535 Len=0"
"77","22.141276","10.0.2.15","157.240.196.60","TLSv1.2","143","Application Data"
"78","22.141772","157.240.196.60","10.0.2.15","TCP","54","443  >  43620 [ACK] Seq=6802 Ack=1575 Win=65535 Len=0"
"79","23.343961","157.240.196.60","10.0.2.15","TLSv1.2","327","Application Data"
"80","23.344107","10.0.2.15","157.240.196.60","TCP","54","43620  >  443 [ACK] Seq=1575 Ack=7075 Win=65535 Len=0"
"81","23.394814","10.0.2.15","157.240.196.60","TLSv1.2","143","Application Data"
"82","23.395302","157.240.196.60","10.0.2.15","TCP","54","443  >  43620 [ACK] Seq=7075 Ack=1664 Win=65535 Len=0"
"83","24.711295","157.240.196.60","10.0.2.15","TLSv1.2","327","Application Data"
"84","24.714854","10.0.2.15","157.240.196.60","TCP","54","43620  >  443 [ACK] Seq=1664 Ack=7348 Win=65535 Len=0"
"85","24.779857","10.0.2.15","157.240.196.60","TLSv1.2","143","Application Data"
"86","24.785361","157.240.196.60","10.0.2.15","TCP","54","443  >  43620 [ACK] Seq=7348 Ack=1753 Win=65535 Len=0"
"87","26.123179","157.240.196.60","10.0.2.15","TLSv1.2","327","Application Data"
"88","26.123222","10.0.2.15","157.240.196.60","TCP","54","43620  >  443 [ACK] Seq=1753 Ack=7621 Win=65535 Len=0"
"89","26.247476","10.0.2.15","157.240.196.60","TLSv1.2","143","Application Data"
"90","26.248343","157.240.196.60","10.0.2.15","TCP","54","443  >  43620 [ACK] Seq=7621 Ack=1842 Win=65535 Len=0"
"91","26.814774","10.0.2.15","157.240.196.60","TLSv1.2","124","Application Data"
"92","26.815384","157.240.196.60","10.0.2.15","TCP","54","443  >  43620 [ACK] Seq=7621 Ack=1912 Win=65535 Len=0"
"93","26.960934","157.240.196.60","10.0.2.15","TLSv1.2","126","Application Data"
"94","26.960991","10.0.2.15","157.240.196.60","TCP","54","43620  >  443 [ACK] Seq=1912 Ack=7693 Win=65535 Len=0"
"95","27.627637","157.240.196.60","10.0.2.15","TLSv1.2","327","Application Data"
"96","27.627671","10.0.2.15","157.240.196.60","TCP","54","43620  >  443 [ACK] Seq=1912 Ack=7966 Win=65535 Len=0"
"97","27.976543","10.0.2.15","157.240.196.60","TLSv1.2","143","Application Data"
"98","27.977162","157.240.196.60","10.0.2.15","TCP","54","443  >  43620 [ACK] Seq=7966 Ack=2001 Win=65535 Len=0"
"99","29.360162","157.240.196.60","10.0.2.15","TLSv1.2","327","Application Data"
"100","29.360248","10.0.2.15","157.240.196.60","TCP","54","43620  >  443 [ACK] Seq=2001 Ack=8239 Win=65535 Len=0"
"101","29.562068","10.0.2.15","157.240.196.60","TLSv1.2","143","Application Data"
"102","29.562633","157.240.196.60","10.0.2.15","TCP","54","443  >  43620 [ACK] Seq=8239 Ack=2090 Win=65535 Len=0"
"103","31.088034","157.240.196.60","10.0.2.15","TLSv1.2","327","Application Data"
"104","31.088131","10.0.2.15","157.240.196.60","TCP","54","43620  >  443 [ACK] Seq=2090 Ack=8512 Win=65535 Len=0"
"105","31.408037","10.0.2.15","157.240.196.60","TLSv1.2","143","Application Data"
"106","31.408800","157.240.196.60","10.0.2.15","TCP","54","443  >  43620 [ACK] Seq=8512 Ack=2179 Win=65535 Len=0"
"107","32.533380","157.240.196.60","10.0.2.15","TLSv1.2","327","Application Data"
"108","32.533513","10.0.2.15","157.240.196.60","TCP","54","43620  >  443 [ACK] Seq=2179 Ack=8785 Win=65535 Len=0"
"109","32.639285","10.0.2.15","157.240.196.60","TLSv1.2","143","Application Data"
"110","32.640033","157.240.196.60","10.0.2.15","TCP","54","443  >  43620 [ACK] Seq=8785 Ack=2268 Win=65535 Len=0"
"111","33.806362","157.240.196.60","10.0.2.15","TLSv1.2","327","Application Data"
"112","33.806702","10.0.2.15","157.240.196.60","TCP","54","43620  >  443 [ACK] Seq=2268 Ack=9058 Win=65535 Len=0"
"113","34.045997","10.0.2.15","157.240.196.60","TLSv1.2","143","Application Data"
"114","34.046550","157.240.196.60","10.0.2.15","TCP","54","443  >  43620 [ACK] Seq=9058 Ack=2357 Win=65535 Len=0"
"115","35.167281","157.240.196.60","10.0.2.15","TLSv1.2","343","Application Data"
"116","35.167674","10.0.2.15","157.240.196.60","TCP","54","43620  >  443 [ACK] Seq=2357 Ack=9347 Win=65535 Len=0"
"117","35.402856","10.0.2.15","157.240.196.60","TLSv1.2","143","Application Data"
"118","35.404074","157.240.196.60","10.0.2.15","TCP","54","443  >  43620 [ACK] Seq=9347 Ack=2446 Win=65535 Len=0"
"119","36.380028","157.240.196.60","10.0.2.15","TLSv1.2","327","Application Data"
"120","36.380062","10.0.2.15","157.240.196.60","TCP","54","43620  >  443 [ACK] Seq=2446 Ack=9620 Win=65535 Len=0"
"121","36.570335","10.0.2.15","157.240.196.60","TLSv1.2","143","Application Data"
"122","36.570745","157.240.196.60","10.0.2.15","TCP","54","443  >  43620 [ACK] Seq=9620 Ack=2535 Win=65535 Len=0"
"123","47.807791","10.0.2.15","157.240.196.60","TLSv1.2","124","Application Data"
"124","47.809342","157.240.196.60","10.0.2.15","TCP","54","443  >  43620 [ACK] Seq=9620 Ack=2605 Win=65535 Len=0"
"125","47.954535","157.240.196.60","10.0.2.15","TLSv1.2","126","Application Data"
"126","47.954594","10.0.2.15","157.240.196.60","TCP","54","43620  >  443 [ACK] Seq=2605 Ack=9692 Win=65535 Len=0"
"127","53.832974","10.0.2.15","157.240.195.56","TLSv1.2","93","Application Data"
"128","53.834445","157.240.195.56","10.0.2.15","TCP","54","443  >  33684 [ACK] Seq=40 Ack=79 Win=65535 Len=0"
"129","53.865042","10.0.2.15","157.240.195.56","TLSv1.2","78","Application Data"
"130","53.865126","10.0.2.15","157.240.195.56","TCP","54","33684  >  443 [FIN, ACK] Seq=103 Ack=40 Win=64032 Len=0"
"131","53.865414","157.240.195.56","10.0.2.15","TCP","54","443  >  33684 [ACK] Seq=40 Ack=103 Win=65535 Len=0"
"132","53.865414","157.240.195.56","10.0.2.15","TCP","54","443  >  33684 [ACK] Seq=40 Ack=104 Win=65535 Len=0"
"133","53.885830","157.240.195.56","10.0.2.15","TLSv1.2","93","Application Data"
"134","53.885861","10.0.2.15","157.240.195.56","TCP","54","33684  >  443 [RST] Seq=104 Win=0 Len=0"
"135","53.885830","157.240.195.56","10.0.2.15","TCP","54","443  >  33684 [FIN, ACK] Seq=79 Ack=104 Win=65535 Len=0"
"136","53.885936","10.0.2.15","157.240.195.56","TCP","54","33684  >  443 [RST] Seq=104 Win=0 Len=0"
"137","53.886427","157.240.195.56","10.0.2.15","TCP","54","443  >  33684 [RST, ACK] Seq=4001075808 Ack=104 Win=0 Len=0"
"138","59.200489","157.240.196.60","10.0.2.15","TLSv1.2","769","Application Data"
"139","59.200811","10.0.2.15","157.240.196.60","TCP","54","43620  >  443 [ACK] Seq=2605 Ack=10407 Win=65535 Len=0"
"141","59.522625","10.0.2.15","157.240.196.60","TLSv1.2","129","Application Data"
"142","59.523108","157.240.196.60","10.0.2.15","TCP","54","443  >  43620 [ACK] Seq=10407 Ack=2680 Win=65535 Len=0"
"143","59.529967","10.0.2.15","157.240.196.60","TLSv1.2","150","Application Data"
"144","59.540189","157.240.196.60","10.0.2.15","TCP","54","443  >  43620 [ACK] Seq=10407 Ack=2776 Win=65535 Len=0"
"152","59.669799","157.240.196.60","10.0.2.15","TLSv1.2","1308","Application Data"
"153","59.669824","10.0.2.15","157.240.196.60","TCP","54","43620  >  443 [ACK] Seq=2776 Ack=11661 Win=65535 Len=0"
"173","59.988167","10.0.2.15","157.240.195.56","TCP","74","42668  >  443 [SYN] Seq=0 Win=64240 Len=0 MSS=1460 SACK_PERM TSval=3538611547 TSecr=0 WS=128"
"175","60.045843","157.240.195.56","10.0.2.15","TCP","58","443  >  42668 [SYN, ACK] Seq=0 Ack=1 Win=65535 Len=0 MSS=1460"
"176","60.045877","10.0.2.15","157.240.195.56","TCP","54","42668  >  443 [ACK] Seq=1 Ack=1 Win=64240 Len=0"
"177","60.069452","10.0.2.15","157.240.195.56","TLSv1.3","608","Client Hello"
"179","60.083420","157.240.195.56","10.0.2.15","TCP","54","443  >  42668 [ACK] Seq=1 Ack=555 Win=65535 Len=0"
"180","60.132586","157.240.195.56","10.0.2.15","TLSv1.3","266","Server Hello, Change Cipher Spec, Application Data"
"181","60.132614","10.0.2.15","157.240.195.56","TCP","54","42668  >  443 [ACK] Seq=555 Ack=213 Win=64028 Len=0"
"182","60.154792","10.0.2.15","157.240.195.56","TLSv1.3","118","Change Cipher Spec, Application Data"
"183","60.163709","157.240.195.56","10.0.2.15","TCP","54","443  >  42668 [ACK] Seq=213 Ack=619 Win=65535 Len=0"
"184","60.212752","157.240.195.56","10.0.2.15","TLSv1.3","299","Application Data, Application Data"
"185","60.216710","10.0.2.15","157.240.195.56","TLSv1.3","224","Application Data"
"186","60.226112","157.240.195.56","10.0.2.15","TCP","54","443  >  42668 [ACK] Seq=458 Ack=789 Win=65535 Len=0"
"187","60.226138","10.0.2.15","157.240.195.56","TLSv1.3","85","Application Data"
"188","60.239239","157.240.195.56","10.0.2.15","TCP","54","443  >  42668 [ACK] Seq=458 Ack=820 Win=65535 Len=0"
"189","60.279819","157.240.195.56","10.0.2.15","TLSv1.3","85","Application Data"
"190","60.323783","10.0.2.15","157.240.195.56","TCP","54","42668  >  443 [ACK] Seq=820 Ack=489 Win=64028 Len=0"
"191","65.809372","157.240.196.60","10.0.2.15","TLSv1.2","769","Application Data"
"192","65.809467","10.0.2.15","157.240.196.60","TCP","54","43620  >  443 [ACK] Seq=2776 Ack=12376 Win=65535 Len=0"
"195","65.987669","10.0.2.15","157.240.196.60","TLSv1.2","150","Application Data"
"196","65.988337","157.240.196.60","10.0.2.15","TCP","54","443  >  43620 [ACK] Seq=12376 Ack=2872 Win=65535 Len=0"
"218","69.228340","10.0.2.15","157.240.196.60","TLSv1.2","93","Application Data"
"219","69.229484","157.240.196.60","10.0.2.15","TCP","54","443  >  36970 [ACK] Seq=40 Ack=79 Win=65535 Len=0"
"220","69.229850","10.0.2.15","157.240.196.60","TLSv1.2","78","Application Data"
"221","69.230032","10.0.2.15","157.240.196.60","TCP","54","36970  >  443 [FIN, ACK] Seq=103 Ack=40 Win=64028 Len=0"
"222","69.230781","157.240.196.60","10.0.2.15","TCP","54","443  >  36970 [ACK] Seq=40 Ack=103 Win=65535 Len=0"
"223","69.230782","157.240.196.60","10.0.2.15","TCP","54","443  >  36970 [ACK] Seq=40 Ack=104 Win=65535 Len=0"
"224","69.277576","157.240.196.60","10.0.2.15","TLSv1.2","93","Application Data"
"225","69.277633","10.0.2.15","157.240.196.60","TCP","54","36970  >  443 [RST] Seq=104 Win=0 Len=0"
"226","69.278590","157.240.196.60","10.0.2.15","TCP","54","443  >  36970 [FIN, ACK] Seq=79 Ack=104 Win=65535 Len=0"
"227","69.278620","10.0.2.15","157.240.196.60","TCP","54","36970  >  443 [RST] Seq=104 Win=0 Len=0"
"228","69.279767","157.240.196.60","10.0.2.15","TCP","54","443  >  36970 [RST, ACK] Seq=3999158008 Ack=104 Win=0 Len=0"
"229","72.666752","157.240.196.60","10.0.2.15","TLSv1.2","769","Application Data"
"230","72.666844","10.0.2.15","157.240.196.60","TCP","54","43620  >  443 [ACK] Seq=2872 Ack=13091 Win=65535 Len=0"
"232","72.795891","10.0.2.15","157.240.196.60","TLSv1.2","150","Application Data"
"233","72.796371","157.240.196.60","10.0.2.15","TCP","54","443  >  43620 [ACK] Seq=13091 Ack=2968 Win=65535 Len=0"
"235","72.842150","157.240.196.60","10.0.2.15","TLSv1.2","330","Application Data"
"236","72.842174","10.0.2.15","157.240.196.60","TCP","54","43620  >  443 [ACK] Seq=2968 Ack=13367 Win=65535 Len=0"
"238","72.863355","10.0.2.15","157.240.196.60","TLSv1.2","126","Application Data"
"239","72.863911","157.240.196.60","10.0.2.15","TCP","54","443  >  43620 [ACK] Seq=13367 Ack=3040 Win=65535 Len=0"
"253","79.881806","157.240.196.60","10.0.2.15","TLSv1.2","241","Application Data"
"254","79.892912","10.0.2.15","157.240.196.60","TLSv1.2","154","Application Data"
"255","79.893497","157.240.196.60","10.0.2.15","TCP","54","443  >  43620 [ACK] Seq=13554 Ack=3140 Win=65535 Len=0"
"256","80.226549","157.240.196.60","10.0.2.15","TLSv1.2","195","Application Data"
"257","80.261348","10.0.2.15","157.240.196.60","TLSv1.2","154","Application Data"
"258","80.310945","157.240.196.60","10.0.2.15","TCP","54","443  >  43620 [ACK] Seq=13695 Ack=3240 Win=65535 Len=0"
"259","80.450541","157.240.196.60","10.0.2.15","TLSv1.2","753","Application Data"
"260","80.493109","10.0.2.15","157.240.196.60","TCP","54","43620  >  443 [ACK] Seq=3240 Ack=14394 Win=65535 Len=0"
"261","80.548424","157.240.196.60","10.0.2.15","TLSv1.2","195","Application Data"
"262","80.548513","10.0.2.15","157.240.196.60","TCP","54","43620  >  443 [ACK] Seq=3240 Ack=14535 Win=65535 Len=0"
"263","80.602495","10.0.2.15","157.240.196.60","TLSv1.2","154","Application Data"
"264","80.604252","157.240.196.60","10.0.2.15","TCP","54","443  >  43620 [ACK] Seq=14535 Ack=3340 Win=65535 Len=0"
"266","80.639073","10.0.2.15","157.240.196.60","TLSv1.2","150","Application Data"
"267","80.639676","157.240.196.60","10.0.2.15","TCP","54","443  >  43620 [ACK] Seq=14535 Ack=3436 Win=65535 Len=0"
"287","84.358969","10.0.2.15","157.240.196.60","TLSv1.2","124","Application Data"
"288","84.361447","157.240.196.60","10.0.2.15","TCP","54","443  >  43620 [ACK] Seq=14535 Ack=3506 Win=65535 Len=0"
"289","84.505175","157.240.196.60","10.0.2.15","TLSv1.2","126","Application Data"
"290","84.505236","10.0.2.15","157.240.196.60","TCP","54","43620  >  443 [ACK] Seq=3506 Ack=14607 Win=65535 Len=0"
"291","85.891651","157.240.196.60","10.0.2.15","TLSv1.2","769","Application Data"
"292","85.891683","10.0.2.15","157.240.196.60","TCP","54","43620  >  443 [ACK] Seq=3506 Ack=15322 Win=65535 Len=0"
"294","86.055193","10.0.2.15","157.240.196.60","TLSv1.2","150","Application Data"
"295","86.062222","157.240.196.60","10.0.2.15","TCP","54","443  >  43620 [ACK] Seq=15322 Ack=3602 Win=65535 Len=0"
"310","99.870998","157.240.196.60","10.0.2.15","TLSv1.2","1330","Application Data"
"311","99.871088","10.0.2.15","157.240.196.60","TCP","54","43620  >  443 [ACK] Seq=3602 Ack=16598 Win=65535 Len=0"
"327","100.294487","10.0.2.15","157.240.195.56","TLSv1.3","347","Application Data"
"329","100.302350","157.240.195.56","10.0.2.15","TCP","54","443  >  42668 [ACK] Seq=489 Ack=1113 Win=65535 Len=0"
"330","100.302375","10.0.2.15","157.240.195.56","TLSv1.3","89","Application Data"
"332","100.314978","157.240.195.56","10.0.2.15","TCP","54","443  >  42668 [ACK] Seq=489 Ack=1148 Win=65535 Len=0"
"335","100.344482","157.240.195.56","10.0.2.15","TLSv1.3","89","Application Data"
"336","100.344505","10.0.2.15","157.240.195.56","TCP","54","42668  >  443 [ACK] Seq=1148 Ack=524 Win=64028 Len=0"
"337","100.347879","157.240.195.56","10.0.2.15","TLSv1.3","2013","Application Data, Application Data"
"338","100.347892","10.0.2.15","157.240.195.56","TCP","54","42668  >  443 [ACK] Seq=1148 Ack=2483 Win=62780 Len=0"
"471","100.761468","10.0.2.15","157.240.196.60","TLSv1.2","150","Application Data"
"472","100.763337","157.240.196.60","10.0.2.15","TCP","54","443  >  43620 [ACK] Seq=16598 Ack=3698 Win=65535 Len=0"
"473","101.308681","10.0.2.15","157.240.196.60","TLSv1.2","124","Application Data"
"474","101.309269","157.240.196.60","10.0.2.15","TCP","54","443  >  43620 [ACK] Seq=16598 Ack=3768 Win=65535 Len=0"
"475","101.461597","157.240.196.60","10.0.2.15","TLSv1.2","126","Application Data"
"476","101.461623","10.0.2.15","157.240.196.60","TCP","54","43620  >  443 [ACK] Seq=3768 Ack=16670 Win=65535 Len=0"
"477","103.989881","157.240.196.60","10.0.2.15","TLSv1.2","1346","Application Data"
"478","103.989969","10.0.2.15","157.240.196.60","TCP","54","43620  >  443 [ACK] Seq=3768 Ack=17962 Win=65535 Len=0"
"480","104.178104","10.0.2.15","157.240.196.60","TLSv1.2","150","Application Data"
"481","104.178511","157.240.196.60","10.0.2.15","TCP","54","443  >  43620 [ACK] Seq=17962 Ack=3864 Win=65535 Len=0"
"630","108.779558","157.240.196.60","10.0.2.15","TLSv1.2","1346","Application Data"
"631","108.779671","10.0.2.15","157.240.196.60","TCP","54","43620  >  443 [ACK] Seq=3864 Ack=19254 Win=65535 Len=0"
"642","109.199069","10.0.2.15","157.240.196.60","TLSv1.2","150","Application Data"
"710","109.265850","157.240.196.60","10.0.2.15","TCP","54","443  >  43620 [ACK] Seq=19254 Ack=3960 Win=65535 Len=0"
"754","111.763978","157.240.196.60","10.0.2.15","TLSv1.2","329","Application Data"
"755","111.764065","10.0.2.15","157.240.196.60","TCP","54","43620  >  443 [ACK] Seq=3960 Ack=19529 Win=65535 Len=0"
"756","111.882120","10.0.2.15","157.240.196.60","TLSv1.2","126","Application Data"
"757","111.882671","157.240.196.60","10.0.2.15","TCP","54","443  >  43620 [ACK] Seq=19529 Ack=4032 Win=65535 Len=0"
"758","115.641693","157.240.196.60","10.0.2.15","TLSv1.2","1346","Application Data"
"759","115.641777","10.0.2.15","157.240.196.60","TCP","54","43620  >  443 [ACK] Seq=4032 Ack=20821 Win=65535 Len=0"
"855","116.320825","10.0.2.15","157.240.196.60","TLSv1.2","150","Application Data"
"856","116.321416","157.240.196.60","10.0.2.15","TCP","54","443  >  43620 [ACK] Seq=20821 Ack=4128 Win=65535 Len=0"
"857","120.035708","157.240.196.60","10.0.2.15","TLSv1.2","1330","Application Data"
"858","120.035742","10.0.2.15","157.240.196.60","TCP","54","43620  >  443 [ACK] Seq=4128 Ack=22097 Win=65535 Len=0"
"861","120.207944","10.0.2.15","157.240.196.60","TLSv1.2","150","Application Data"
"862","120.208632","157.240.196.60","10.0.2.15","TCP","54","443  >  43620 [ACK] Seq=22097 Ack=4224 Win=65535 Len=0"
"1045","125.483201","157.240.196.60","10.0.2.15","TLSv1.2","1314","Application Data"
"1046","125.485671","10.0.2.15","157.240.196.60","TCP","54","43620  >  443 [ACK] Seq=4224 Ack=23357 Win=65535 Len=0"
"1048","125.806909","10.0.2.15","157.240.196.60","TLSv1.2","150","Application Data"
"1049","125.807308","157.240.196.60","10.0.2.15","TCP","54","443  >  43620 [ACK] Seq=23357 Ack=4320 Win=65535 Len=0"
"1207","129.581781","157.240.196.60","10.0.2.15","TLSv1.2","1330","Application Data"
"1208","129.582230","10.0.2.15","157.240.196.60","TCP","54","43620  >  443 [ACK] Seq=4320 Ack=24633 Win=65535 Len=0"
"1212","129.852180","10.0.2.15","157.240.196.60","TLSv1.2","150","Application Data"
"1213","129.853112","157.240.196.60","10.0.2.15","TCP","54","443  >  43620 [ACK] Seq=24633 Ack=4416 Win=65535 Len=0"
"1214","130.004090","10.0.2.15","157.240.196.60","TLSv1.2","124","Application Data"
"1215","130.005577","157.240.196.60","10.0.2.15","TCP","54","443  >  43620 [ACK] Seq=24633 Ack=4486 Win=65535 Len=0"
"1297","130.170968","157.240.196.60","10.0.2.15","TLSv1.2","126","Application Data"
"1298","130.170985","10.0.2.15","157.240.196.60","TCP","54","43620  >  443 [ACK] Seq=4486 Ack=24705 Win=65535 Len=0"
"1380","132.959673","157.240.196.60","10.0.2.15","TLSv1.2","1330","Application Data"
"1381","132.959753","10.0.2.15","157.240.196.60","TCP","54","43620  >  443 [ACK] Seq=4486 Ack=25981 Win=65535 Len=0"
"1407","133.387963","10.0.2.15","157.240.196.60","TLSv1.2","150","Application Data"
"1409","133.391515","157.240.196.60","10.0.2.15","TCP","54","443  >  43620 [ACK] Seq=25981 Ack=4582 Win=65535 Len=0"
"1543","159.216154","10.0.2.15","157.240.195.56","TLSv1.3","93","Application Data"
"1544","159.218640","157.240.195.56","10.0.2.15","TCP","54","443  >  42668 [ACK] Seq=2483 Ack=1187 Win=65535 Len=0"
"1545","159.265936","157.240.195.56","10.0.2.15","TLSv1.3","93","Application Data"
"1546","159.266004","10.0.2.15","157.240.195.56","TCP","54","42668  >  443 [ACK] Seq=1187 Ack=2522 Win=62780 Len=0"
"1547","159.328313","10.0.2.15","157.240.196.60","TLSv1.2","124","Application Data"
"1548","159.329966","157.240.196.60","10.0.2.15","TCP","54","443  >  43620 [ACK] Seq=25981 Ack=4652 Win=65535 Len=0"
"1549","159.474983","157.240.196.60","10.0.2.15","TLSv1.2","126","Application Data"
"1550","159.475041","10.0.2.15","157.240.196.60","TCP","54","43620  >  443 [ACK] Seq=4652 Ack=26053 Win=65535 Len=0"
"1551","160.276832","157.240.196.60","10.0.2.15","TLSv1.2","2959","Application Data"
"1552","160.276940","10.0.2.15","157.240.196.60","TCP","54","43620  >  443 [ACK] Seq=4652 Ack=28958 Win=65535 Len=0"
"1553","160.276832","157.240.196.60","10.0.2.15","TLSv1.2","798","Application Data, Application Data"
"1554","160.277011","10.0.2.15","157.240.196.60","TCP","54","43620  >  443 [ACK] Seq=4652 Ack=29702 Win=65535 Len=0"
"1555","161.322679","10.0.2.15","157.240.196.60","TLSv1.2","143","Application Data"
"1556","161.323090","157.240.196.60","10.0.2.15","TCP","54","443  >  43620 [ACK] Seq=29702 Ack=4741 Win=65535 Len=0"
"1557","161.863423","157.240.196.60","10.0.2.15","TLSv1.2","1567","Application Data"
"1558","161.870920","10.0.2.15","157.240.196.60","TCP","54","43620  >  443 [ACK] Seq=4741 Ack=31215 Win=65535 Len=0"
"1559","161.863423","157.240.196.60","10.0.2.15","TCP","1446","443  >  43620 [PSH, ACK] Seq=31215 Ack=4741 Win=65535 Len=1392 [TCP segment of a reassembled PDU]"
"1560","161.871327","10.0.2.15","157.240.196.60","TCP","54","43620  >  443 [ACK] Seq=4741 Ack=32607 Win=65535 Len=0"
"1561","161.863423","157.240.196.60","10.0.2.15","TLSv1.2","830","Application Data, Application Data"
"1562","161.871333","10.0.2.15","157.240.196.60","TCP","54","43620  >  443 [ACK] Seq=4741 Ack=33383 Win=65535 Len=0"
"1563","162.265541","157.240.196.60","10.0.2.15","TLSv1.2","1567","Application Data"
"1564","162.265568","10.0.2.15","157.240.196.60","TCP","54","43620  >  443 [ACK] Seq=4741 Ack=34896 Win=65535 Len=0"
"1565","162.265541","157.240.196.60","10.0.2.15","TLSv1.2","2078","Application Data, Application Data"
"1566","162.266146","10.0.2.15","157.240.196.60","TCP","54","43620  >  443 [ACK] Seq=4741 Ack=36920 Win=65535 Len=0"
"1567","163.421609","10.0.2.15","157.240.196.60","TLSv1.2","143","Application Data"
"1568","163.439454","157.240.196.60","10.0.2.15","TCP","54","443  >  43620 [ACK] Seq=36920 Ack=4830 Win=65535 Len=0"
"1569","163.646576","10.0.2.15","157.240.196.60","TLSv1.2","143","Application Data"
"1570","163.647016","157.240.196.60","10.0.2.15","TCP","54","443  >  43620 [ACK] Seq=36920 Ack=4919 Win=65535 Len=0"
"1571","166.087035","157.240.196.60","10.0.2.15","TCP","1514","443  >  43620 [ACK] Seq=36920 Ack=4919 Win=65535 Len=1460 [TCP segment of a reassembled PDU]"
"1572","166.088380","10.0.2.15","157.240.196.60","TCP","54","43620  >  443 [ACK] Seq=4919 Ack=38380 Win=65535 Len=0"
"1573","166.091685","157.240.196.60","10.0.2.15","TLSv1.2","1987","Application Data, Application Data, Application Data"
"1574","166.091695","10.0.2.15","157.240.196.60","TCP","54","43620  >  443 [ACK] Seq=4919 Ack=40313 Win=65535 Len=0"
"1575","166.414734","10.0.2.15","157.240.196.60","TLSv1.2","143","Application Data"
"1576","166.415197","157.240.196.60","10.0.2.15","TCP","54","443  >  43620 [ACK] Seq=40313 Ack=5008 Win=65535 Len=0"
"1577","166.772625","157.240.196.60","10.0.2.15","TLSv1.2","1567","Application Data"
"1578","166.775132","10.0.2.15","157.240.196.60","TCP","54","43620  >  443 [ACK] Seq=5008 Ack=41826 Win=65535 Len=0"
"1579","166.772625","157.240.196.60","10.0.2.15","TLSv1.2","2206","Application Data, Application Data"
"1580","166.775685","10.0.2.15","157.240.196.60","TCP","54","43620  >  443 [ACK] Seq=5008 Ack=43978 Win=65535 Len=0"
"1581","167.442462","10.0.2.15","157.240.196.60","TLSv1.2","143","Application Data"
"1582","167.454488","157.240.196.60","10.0.2.15","TCP","54","443  >  43620 [ACK] Seq=43978 Ack=5097 Win=65535 Len=0"
"1583","167.783253","157.240.196.60","10.0.2.15","TLSv1.2","1567","Application Data"
"1584","167.785175","10.0.2.15","157.240.196.60","TCP","54","43620  >  443 [ACK] Seq=5097 Ack=45491 Win=65535 Len=0"
"1585","167.783254","157.240.196.60","10.0.2.15","TCP","1446","443  >  43620 [PSH, ACK] Seq=45491 Ack=5097 Win=65535 Len=1392 [TCP segment of a reassembled PDU]"
"1586","167.785687","10.0.2.15","157.240.196.60","TCP","54","43620  >  443 [ACK] Seq=5097 Ack=46883 Win=65535 Len=0"
"1587","167.783254","157.240.196.60","10.0.2.15","TLSv1.2","830","Application Data, Application Data"
"1588","167.786273","10.0.2.15","157.240.196.60","TCP","54","43620  >  443 [ACK] Seq=5097 Ack=47659 Win=65535 Len=0"
"1589","168.272434","10.0.2.15","157.240.196.60","TLSv1.2","143","Application Data"
"1590","168.276131","157.240.196.60","10.0.2.15","TCP","54","443  >  43620 [ACK] Seq=47659 Ack=5186 Win=65535 Len=0"
"1591","170.061897","157.240.196.60","10.0.2.15","TLSv1.2","3559","Application Data, Application Data, Application Data"
"1592","170.061933","10.0.2.15","157.240.196.60","TCP","54","43620  >  443 [ACK] Seq=5186 Ack=51164 Win=65535 Len=0"
"1593","170.608905","10.0.2.15","157.240.196.60","TLSv1.2","143","Application Data"
"1594","170.656209","157.240.196.60","10.0.2.15","TCP","54","443  >  43620 [ACK] Seq=51164 Ack=5275 Win=65535 Len=0"
"1595","186.705629","10.0.2.15","157.240.196.60","TLSv1.2","124","Application Data"
"1596","186.706613","157.240.196.60","10.0.2.15","TCP","54","443  >  43620 [ACK] Seq=51164 Ack=5345 Win=65535 Len=0"
"1597","186.851170","157.240.196.60","10.0.2.15","TLSv1.2","126","Application Data"
"1598","186.851231","10.0.2.15","157.240.196.60","TCP","54","43620  >  443 [ACK] Seq=5345 Ack=51236 Win=65535 Len=0"
"1601","191.285941","157.240.196.60","10.0.2.15","TCP","1514","443  >  43620 [ACK] Seq=51236 Ack=5345 Win=65535 Len=1460 [TCP segment of a reassembled PDU]"
"1602","191.286023","10.0.2.15","157.240.196.60","TCP","54","43620  >  443 [ACK] Seq=5345 Ack=52696 Win=65535 Len=0"
"1603","191.287307","157.240.196.60","10.0.2.15","TLSv1.2","1699","Application Data, Application Data, Application Data"
"1604","191.287352","10.0.2.15","157.240.196.60","TCP","54","43620  >  443 [ACK] Seq=5345 Ack=54341 Win=65535 Len=0"
"1615","191.615094","10.0.2.15","157.240.196.60","TLSv1.2","143","Application Data"
"1616","191.615854","157.240.196.60","10.0.2.15","TCP","54","443  >  43620 [ACK] Seq=54341 Ack=5434 Win=65535 Len=0"
"1617","201.602122","10.0.2.15","157.240.196.60","TLSv1.2","84","Application Data"
"1618","201.602356","10.0.2.15","157.240.196.60","TLSv1.2","6370","Application Data"
"1619","201.602800","157.240.196.60","10.0.2.15","TCP","54","443  >  43620 [ACK] Seq=54341 Ack=5464 Win=65535 Len=0"
"1620","201.602800","157.240.196.60","10.0.2.15","TCP","54","443  >  43620 [ACK] Seq=54341 Ack=6924 Win=65535 Len=0"
"1621","201.602800","157.240.196.60","10.0.2.15","TCP","54","443  >  43620 [ACK] Seq=54341 Ack=8384 Win=65535 Len=0"
"1622","201.602800","157.240.196.60","10.0.2.15","TCP","54","443  >  43620 [ACK] Seq=54341 Ack=9844 Win=65535 Len=0"
"1623","201.602800","157.240.196.60","10.0.2.15","TCP","54","443  >  43620 [ACK] Seq=54341 Ack=11304 Win=65535 Len=0"
"1624","201.602800","157.240.196.60","10.0.2.15","TCP","54","443  >  43620 [ACK] Seq=54341 Ack=11780 Win=65535 Len=0"
"1625","201.755703","157.240.196.60","10.0.2.15","TLSv1.2","118","Application Data"
"1626","201.755759","10.0.2.15","157.240.196.60","TCP","54","43620  >  443 [ACK] Seq=11780 Ack=54405 Win=65535 Len=0"
"1627","214.634841","157.240.196.60","10.0.2.15","TCP","1514","443  >  43620 [ACK] Seq=54405 Ack=11780 Win=65535 Len=1460 [TCP segment of a reassembled PDU]"
"1628","214.635164","10.0.2.15","157.240.196.60","TCP","54","43620  >  443 [ACK] Seq=11780 Ack=55865 Win=65535 Len=0"
"1629","214.636494","157.240.196.60","10.0.2.15","TLSv1.2","1469","Application Data, Application Data"
"1630","214.636529","10.0.2.15","157.240.196.60","TCP","54","43620  >  443 [ACK] Seq=11780 Ack=57280 Win=65535 Len=0"
"1631","215.054737","10.0.2.15","157.240.196.60","TLSv1.2","143","Application Data"
"1632","215.057402","157.240.196.60","10.0.2.15","TCP","54","443  >  43620 [ACK] Seq=57280 Ack=11869 Win=65535 Len=0"
"1633","218.220624","10.0.2.15","157.240.195.56","TLSv1.3","93","Application Data"
"1634","218.222082","157.240.195.56","10.0.2.15","TCP","54","443  >  42668 [ACK] Seq=2522 Ack=1226 Win=65535 Len=0"
"1635","218.268532","157.240.195.56","10.0.2.15","TLSv1.3","93","Application Data"
"1636","218.268558","10.0.2.15","157.240.195.56","TCP","54","42668  >  443 [ACK] Seq=1226 Ack=2561 Win=62780 Len=0"
"1637","218.906041","10.0.2.15","157.240.196.60","TLSv1.2","124","Application Data"
"1638","218.906489","157.240.196.60","10.0.2.15","TCP","54","443  >  43620 [ACK] Seq=57280 Ack=11939 Win=65535 Len=0"
"1639","219.059767","157.240.196.60","10.0.2.15","TLSv1.2","126","Application Data"
"1640","219.059792","10.0.2.15","157.240.196.60","TCP","54","43620  >  443 [ACK] Seq=11939 Ack=57352 Win=65535 Len=0"
"1641","237.085387","10.0.2.15","157.240.196.60","TLSv1.2","124","Application Data"
"1642","237.085833","157.240.196.60","10.0.2.15","TCP","54","443  >  43620 [ACK] Seq=57352 Ack=12009 Win=65535 Len=0"
"1643","237.234049","157.240.196.60","10.0.2.15","TLSv1.2","126","Application Data"
"1644","237.234107","10.0.2.15","157.240.196.60","TCP","54","43620  >  443 [ACK] Seq=12009 Ack=57424 Win=65535 Len=0"
"1645","237.658789","157.240.196.60","10.0.2.15","TLSv1.2","2945","Application Data, Application Data"
"1646","237.658874","10.0.2.15","157.240.196.60","TCP","54","43620  >  443 [ACK] Seq=12009 Ack=60315 Win=65535 Len=0"
"1647","238.113030","10.0.2.15","157.240.196.60","TLSv1.2","143","Application Data"
"1648","238.119243","157.240.196.60","10.0.2.15","TCP","54","443  >  43620 [ACK] Seq=60315 Ack=12098 Win=65535 Len=0"
"1649","242.687420","157.240.196.60","10.0.2.15","TCP","1514","443  >  43620 [ACK] Seq=60315 Ack=12098 Win=65535 Len=1460 [TCP segment of a reassembled PDU]"
"1650","242.687747","10.0.2.15","157.240.196.60","TCP","54","43620  >  443 [ACK] Seq=12098 Ack=61775 Win=65535 Len=0"
"1651","242.689956","157.240.196.60","10.0.2.15","TLSv1.2","1437","Application Data, Application Data"
"1652","242.689994","10.0.2.15","157.240.196.60","TCP","54","43620  >  443 [ACK] Seq=12098 Ack=63158 Win=65535 Len=0"
"1653","242.896440","10.0.2.15","157.240.196.60","TLSv1.2","143","Application Data"
"1654","242.897248","157.240.196.60","10.0.2.15","TCP","54","443  >  43620 [ACK] Seq=63158 Ack=12187 Win=65535 Len=0"
"1655","246.099397","157.240.196.60","10.0.2.15","TLSv1.2","273","Application Data"
"1656","246.100629","10.0.2.15","157.240.196.60","TCP","54","43620  >  443 [ACK] Seq=12187 Ack=63377 Win=65535 Len=0"
"1657","246.099398","157.240.196.60","10.0.2.15","TLSv1.2","348","Application Data"
"1658","246.108925","10.0.2.15","157.240.196.60","TCP","54","43620  >  443 [ACK] Seq=12187 Ack=63671 Win=65535 Len=0"
"1659","246.143231","10.0.2.15","157.240.196.60","TLSv1.2","147","Application Data"
"1660","246.143788","157.240.196.60","10.0.2.15","TCP","54","443  >  43620 [ACK] Seq=63671 Ack=12280 Win=65535 Len=0"
"1661","246.145130","10.0.2.15","157.240.196.60","TLSv1.2","147","Application Data"
"1662","246.147394","157.240.196.60","10.0.2.15","TCP","54","443  >  43620 [ACK] Seq=63671 Ack=12373 Win=65535 Len=0"
"1667","251.163097","157.240.196.60","10.0.2.15","TLSv1.2","320","Application Data"
"1668","251.163411","10.0.2.15","157.240.196.60","TCP","54","43620  >  443 [ACK] Seq=12373 Ack=63937 Win=65535 Len=0"
"1669","251.493329","10.0.2.15","157.240.196.60","TLSv1.2","147","Application Data"
"1670","251.496808","157.240.196.60","10.0.2.15","TCP","54","443  >  43620 [ACK] Seq=63937 Ack=12466 Win=65535 Len=0"
"1671","254.875250","157.240.196.60","10.0.2.15","TLSv1.2","196","Application Data"
"1672","254.875376","10.0.2.15","157.240.196.60","TCP","54","43620  >  443 [ACK] Seq=12466 Ack=64079 Win=65535 Len=0"
"1673","254.914835","10.0.2.15","157.240.196.60","TLSv1.2","129","Application Data"
"1674","254.917385","157.240.196.60","10.0.2.15","TCP","54","443  >  43620 [ACK] Seq=64079 Ack=12541 Win=65535 Len=0"
"1675","256.145474","10.0.2.15","157.240.196.60","TLSv1.2","124","Application Data"
"1676","256.146925","157.240.196.60","10.0.2.15","TCP","54","443  >  43620 [ACK] Seq=64079 Ack=12611 Win=65535 Len=0"
"1677","256.293353","157.240.196.60","10.0.2.15","TLSv1.2","126","Application Data"
"1678","256.293379","10.0.2.15","157.240.196.60","TCP","54","43620  >  443 [ACK] Seq=12611 Ack=64151 Win=65535 Len=0"
"1679","260.594714","157.240.196.60","10.0.2.15","TLSv1.2","1425","Application Data"
"1680","260.594824","10.0.2.15","157.240.196.60","TCP","54","43620  >  443 [ACK] Seq=12611 Ack=65522 Win=65535 Len=0"
"1685","260.964575","10.0.2.15","157.240.196.60","TLSv1.2","150","Application Data"
"1686","260.972525","157.240.196.60","10.0.2.15","TCP","54","443  >  43620 [ACK] Seq=65522 Ack=12707 Win=65535 Len=0"
"1939","271.279959","10.0.2.15","157.240.195.56","TLSv1.3","93","Application Data"
"1940","271.312028","157.240.195.56","10.0.2.15","TCP","54","443  >  42668 [ACK] Seq=2561 Ack=1265 Win=65535 Len=0"
"1941","271.312150","10.0.2.15","157.240.195.56","TLSv1.3","78","Application Data"
"1942","271.312229","10.0.2.15","157.240.195.56","TCP","54","42668  >  443 [FIN, ACK] Seq=1289 Ack=2561 Win=62780 Len=0"
"1943","271.312641","157.240.195.56","10.0.2.15","TCP","54","443  >  42668 [ACK] Seq=2561 Ack=1289 Win=65535 Len=0"
"1944","271.312641","157.240.195.56","10.0.2.15","TCP","54","443  >  42668 [ACK] Seq=2561 Ack=1290 Win=65535 Len=0"
"1945","271.329227","157.240.195.56","10.0.2.15","TLSv1.3","93","Application Data"
"1946","271.329255","10.0.2.15","157.240.195.56","TCP","54","42668  >  443 [RST] Seq=1290 Win=0 Len=0"
"1947","275.492631","10.0.2.15","157.240.196.60","TLSv1.2","124","Application Data"
"1948","275.498188","157.240.196.60","10.0.2.15","TCP","54","443  >  43620 [ACK] Seq=65522 Ack=12777 Win=65535 Len=0"
"1949","275.642209","157.240.196.60","10.0.2.15","TLSv1.2","126","Application Data"
"1950","275.642272","10.0.2.15","157.240.196.60","TCP","54","43620  >  443 [ACK] Seq=12777 Ack=65594 Win=65535 Len=0"
"1951","277.140799","157.240.196.60","10.0.2.15","TLSv1.2","1441","Application Data"
"1952","277.141155","10.0.2.15","157.240.196.60","TCP","54","43620  >  443 [ACK] Seq=12777 Ack=66981 Win=65535 Len=0"
"1954","277.578544","10.0.2.15","157.240.196.60","TLSv1.2","150","Application Data"
"1955","277.578922","157.240.196.60","10.0.2.15","TCP","54","443  >  43620 [ACK] Seq=66981 Ack=12873 Win=65535 Len=0"
"2174","286.991912","34.117.65.55","10.0.2.15","TLSv1.2","78","Application Data"
"2175","286.993319","10.0.2.15","34.117.65.55","TLSv1.2","82","Application Data"
"2176","286.994603","34.117.65.55","10.0.2.15","TCP","54","443  >  39972 [ACK] Seq=25 Ack=29 Win=65535 Len=0"
"2177","290.150418","157.240.196.60","10.0.2.15","TLSv1.2","1489","Application Data"
"2178","290.150719","10.0.2.15","157.240.196.60","TCP","54","43620  >  443 [ACK] Seq=12873 Ack=68416 Win=65535 Len=0"
"2189","291.166328","10.0.2.15","157.240.196.60","TLSv1.2","150","Application Data"
"2192","291.174051","157.240.196.60","10.0.2.15","TCP","54","443  >  43620 [ACK] Seq=68416 Ack=12969 Win=65535 Len=0"
"2402","292.114841","10.0.2.15","157.240.196.60","TLSv1.2","124","Application Data"
"2403","292.117946","157.240.196.60","10.0.2.15","TCP","54","443  >  43620 [ACK] Seq=68416 Ack=13039 Win=65535 Len=0"
"2404","292.286306","157.240.196.60","10.0.2.15","TLSv1.2","126","Application Data"
"2405","292.286331","10.0.2.15","157.240.196.60","TCP","54","43620  >  443 [ACK] Seq=13039 Ack=68488 Win=65535 Len=0"
"2406","301.865685","157.240.196.60","10.0.2.15","TCP","1514","443  >  43620 [ACK] Seq=68488 Ack=13039 Win=65535 Len=1460 [TCP segment of a reassembled PDU]"
"2407","301.868141","10.0.2.15","157.240.196.60","TCP","54","43620  >  443 [ACK] Seq=13039 Ack=69948 Win=65535 Len=0"
"2408","301.872307","157.240.196.60","10.0.2.15","TLSv1.2","93","Application Data"
"2409","301.872323","10.0.2.15","157.240.196.60","TCP","54","43620  >  443 [ACK] Seq=13039 Ack=69987 Win=65535 Len=0"
"2413","302.251317","10.0.2.15","157.240.196.60","TLSv1.2","150","Application Data"
"2414","302.251687","157.240.196.60","10.0.2.15","TCP","54","443  >  43620 [ACK] Seq=69987 Ack=13135 Win=65535 Len=0"
"2626","305.690456","157.240.196.60","10.0.2.15","TLSv1.2","316","Application Data"
"2627","305.690751","10.0.2.15","157.240.196.60","TCP","54","43620  >  443 [ACK] Seq=13135 Ack=70249 Win=65535 Len=0"
"2628","306.085653","10.0.2.15","157.240.196.60","TLSv1.2","150","Application Data"
"2629","306.086129","157.240.196.60","10.0.2.15","TCP","54","443  >  43620 [ACK] Seq=70249 Ack=13231 Win=65535 Len=0"
"2630","311.515401","10.0.2.15","157.240.196.60","TLSv1.2","124","Application Data"
"2631","311.516145","157.240.196.60","10.0.2.15","TCP","54","443  >  43620 [ACK] Seq=70249 Ack=13301 Win=65535 Len=0"
"2632","311.664036","157.240.196.60","10.0.2.15","TLSv1.2","126","Application Data"
"2633","311.664094","10.0.2.15","157.240.196.60","TCP","54","43620  >  443 [ACK] Seq=13301 Ack=70321 Win=65535 Len=0"
"2634","315.758534","157.240.196.60","10.0.2.15","TLSv1.2","150","Application Data"
"2635","315.758655","10.0.2.15","157.240.196.60","TCP","54","43620  >  443 [ACK] Seq=13301 Ack=70417 Win=65535 Len=0"
"2636","315.815755","10.0.2.15","157.240.196.60","TLSv1.2","148","Application Data"
"2637","315.821326","157.240.196.60","10.0.2.15","TCP","54","443  >  43620 [ACK] Seq=70417 Ack=13395 Win=65535 Len=0"
"2638","332.489222","10.0.2.15","157.240.196.60","TLSv1.2","124","Application Data"
"2639","332.489795","157.240.196.60","10.0.2.15","TCP","54","443  >  43620 [ACK] Seq=70417 Ack=13465 Win=65535 Len=0"
"2640","332.638370","157.240.196.60","10.0.2.15","TLSv1.2","126","Application Data"
"2641","332.638431","10.0.2.15","157.240.196.60","TCP","54","43620  >  443 [ACK] Seq=13465 Ack=70489 Win=65535 Len=0"
"2642","334.564602","157.240.196.60","10.0.2.15","TLSv1.2","285","Application Data"
"2643","334.564918","10.0.2.15","157.240.196.60","TCP","54","43620  >  443 [ACK] Seq=13465 Ack=70720 Win=65535 Len=0"
"2644","334.625111","10.0.2.15","157.240.196.60","TLSv1.2","154","Application Data"
"2645","334.625649","157.240.196.60","10.0.2.15","TCP","54","443  >  43620 [ACK] Seq=70720 Ack=13565 Win=65535 Len=0"
"2650","337.991780","157.240.196.60","10.0.2.15","TLSv1.2","289","Application Data"
"2651","337.992194","10.0.2.15","157.240.196.60","TCP","54","43620  >  443 [ACK] Seq=13565 Ack=70955 Win=65535 Len=0"
"2652","338.523753","10.0.2.15","157.240.196.60","TLSv1.2","147","Application Data"
"2653","338.524562","157.240.196.60","10.0.2.15","TCP","54","443  >  43620 [ACK] Seq=70955 Ack=13658 Win=65535 Len=0"
