"No.","Time","Source","Destination","Protocol","Length","Info"
"78","7.063382","157.240.251.61","192.168.0.10","TCP","566","5222  >  64144 [ACK] Seq=1 Ack=1 Win=3725 Len=512 [TCP segment of a reassembled PDU]"
"79","7.066130","157.240.251.61","192.168.0.10","TCP","566","5222  >  64144 [PSH, ACK] Seq=513 Ack=1 Win=3725 Len=512 [TCP segment of a reassembled PDU]"
"80","7.066130","157.240.251.61","192.168.0.10","TCP","298","5222  >  64144 [PSH, ACK] Seq=1025 Ack=1 Win=3725 Len=244 [TCP segment of a reassembled PDU]"
"81","7.066507","192.168.0.10","157.240.251.61","TCP","54","64144  >  5222 [ACK] Seq=1 Ack=1025 Win=516 Len=0"
"86","7.107015","192.168.0.10","157.240.251.61","TCP","54","64144  >  5222 [ACK] Seq=1 Ack=1269 Win=515 Len=0"
"87","7.108475","192.168.0.10","157.240.251.61","TCP","124","64144  >  5222 [PSH, ACK] Seq=1 Ack=1269 Win=515 Len=70 [TCP segment of a reassembled PDU]"
"89","7.181226","157.240.251.61","192.168.0.10","TCP","56","5222  >  64144 [ACK] Seq=1269 Ack=71 Win=3725 Len=0"
"281","9.648829","192.168.0.10","157.240.251.61","TCP","94","64144  >  5222 [PSH, ACK] Seq=71 Ack=1269 Win=515 Len=40 [TCP segment of a reassembled PDU]"
"283","9.721220","157.240.251.61","192.168.0.10","TCP","56","5222  >  64144 [ACK] Seq=1269 Ack=111 Win=3725 Len=0"
"287","9.891891","157.240.251.61","192.168.0.10","TCP","566","5222  >  64144 [ACK] Seq=1269 Ack=111 Win=3725 Len=512 [TCP segment of a reassembled PDU]"
"288","9.891891","157.240.251.61","192.168.0.10","TCP","527","5222  >  64144 [PSH, ACK] Seq=1781 Ack=111 Win=3725 Len=473 [TCP segment of a reassembled PDU]"
"289","9.892306","192.168.0.10","157.240.251.61","TCP","54","64144  >  5222 [ACK] Seq=111 Ack=2254 Win=511 Len=0"
"694","11.942633","157.240.251.61","192.168.0.10","TCP","129","5222  >  64144 [PSH, ACK] Seq=2254 Ack=111 Win=3725 Len=75 [TCP segment of a reassembled PDU]"
"715","11.956111","192.168.0.10","157.240.251.61","TCP","125","64144  >  5222 [PSH, ACK] Seq=111 Ack=2329 Win=511 Len=71 [TCP segment of a reassembled PDU]"
"750","12.050202","157.240.251.61","192.168.0.10","TCP","56","5222  >  64144 [ACK] Seq=2329 Ack=182 Win=3725 Len=0"
"1018","18.289930","157.240.251.61","192.168.0.10","TCP","566","5222  >  64144 [ACK] Seq=2329 Ack=182 Win=3725 Len=512 [TCP segment of a reassembled PDU]"
"1019","18.293040","157.240.251.61","192.168.0.10","TCP","566","5222  >  64144 [PSH, ACK] Seq=2841 Ack=182 Win=3725 Len=512 [TCP segment of a reassembled PDU]"
"1020","18.293040","157.240.251.61","192.168.0.10","TCP","298","5222  >  64144 [PSH, ACK] Seq=3353 Ack=182 Win=3725 Len=244 [TCP segment of a reassembled PDU]"
"1025","18.293455","192.168.0.10","157.240.251.61","TCP","54","64144  >  5222 [ACK] Seq=182 Ack=3353 Win=516 Len=0"
"1027","18.298066","157.240.251.61","192.168.0.10","TCP","298","[TCP Retransmission] 5222  >  64144 [PSH, ACK] Seq=3353 Ack=182 Win=3725 Len=244"
"1028","18.298296","192.168.0.10","157.240.251.61","TCP","66","64144  >  5222 [ACK] Seq=182 Ack=3597 Win=515 Len=0 SLE=3353 SRE=3597"
"1031","18.321636","192.168.0.10","157.240.251.61","TCP","124","64144  >  5222 [PSH, ACK] Seq=182 Ack=3597 Win=515 Len=70 [TCP segment of a reassembled PDU]"
"1035","18.408029","157.240.251.61","192.168.0.10","TCP","56","5222  >  64144 [ACK] Seq=3597 Ack=252 Win=3725 Len=0"
"1084","21.551963","157.240.251.61","192.168.0.10","TCP","566","5222  >  64144 [ACK] Seq=3597 Ack=252 Win=3725 Len=512 [TCP segment of a reassembled PDU]"
"1085","21.551963","157.240.251.61","192.168.0.10","TCP","566","5222  >  64144 [PSH, ACK] Seq=4109 Ack=252 Win=3725 Len=512 [TCP segment of a reassembled PDU]"
"1086","21.552417","192.168.0.10","157.240.251.61","TCP","54","64144  >  5222 [ACK] Seq=252 Ack=4621 Win=511 Len=0"
"1087","21.552704","157.240.251.61","192.168.0.10","TCP","282","5222  >  64144 [PSH, ACK] Seq=4621 Ack=252 Win=3725 Len=228 [TCP segment of a reassembled PDU]"
"1092","21.575397","192.168.0.10","157.240.251.61","TCP","124","64144  >  5222 [PSH, ACK] Seq=252 Ack=4849 Win=516 Len=70 [TCP segment of a reassembled PDU]"
"1096","21.651052","157.240.251.61","192.168.0.10","TCP","56","5222  >  64144 [ACK] Seq=4849 Ack=322 Win=3725 Len=0"
"1112","22.380153","157.240.251.61","192.168.0.10","TCP","204","5222  >  64144 [PSH, ACK] Seq=4849 Ack=322 Win=3725 Len=150 [TCP segment of a reassembled PDU]"
"1113","22.384578","192.168.0.10","157.240.251.61","TCP","125","64144  >  5222 [PSH, ACK] Seq=322 Ack=4999 Win=515 Len=71 [TCP segment of a reassembled PDU]"
"1114","22.387027","192.168.0.10","157.240.251.61","TCP","125","64144  >  5222 [PSH, ACK] Seq=393 Ack=4999 Win=515 Len=71 [TCP segment of a reassembled PDU]"
"1117","22.461746","157.240.251.61","192.168.0.10","TCP","56","5222  >  64144 [ACK] Seq=4999 Ack=393 Win=3725 Len=0"
"1118","22.461746","157.240.251.61","192.168.0.10","TCP","56","5222  >  64144 [ACK] Seq=4999 Ack=464 Win=3725 Len=0"
"1144","25.638670","157.240.251.61","192.168.0.10","TCP","566","5222  >  64144 [ACK] Seq=4999 Ack=464 Win=3725 Len=512 [TCP segment of a reassembled PDU]"
"1145","25.639600","157.240.251.61","192.168.0.10","TCP","566","5222  >  64144 [PSH, ACK] Seq=5511 Ack=464 Win=3725 Len=512 [TCP segment of a reassembled PDU]"
"1147","25.639600","157.240.251.61","192.168.0.10","TCP","282","5222  >  64144 [PSH, ACK] Seq=6023 Ack=464 Win=3725 Len=228 [TCP segment of a reassembled PDU]"
"1148","25.640041","192.168.0.10","157.240.251.61","TCP","54","64144  >  5222 [ACK] Seq=464 Ack=6023 Win=511 Len=0"
"1153","25.667962","192.168.0.10","157.240.251.61","TCP","124","64144  >  5222 [PSH, ACK] Seq=464 Ack=6251 Win=516 Len=70 [TCP segment of a reassembled PDU]"
"1155","25.738598","157.240.251.61","192.168.0.10","TCP","56","5222  >  64144 [ACK] Seq=6251 Ack=534 Win=3725 Len=0"
"1191","29.740471","157.240.251.61","192.168.0.10","TCP","129","5222  >  64144 [PSH, ACK] Seq=6251 Ack=534 Win=3725 Len=75 [TCP segment of a reassembled PDU]"
"1192","29.746507","192.168.0.10","157.240.251.61","TCP","125","64144  >  5222 [PSH, ACK] Seq=534 Ack=6326 Win=516 Len=71 [TCP segment of a reassembled PDU]"
"1194","29.869166","157.240.251.61","192.168.0.10","TCP","56","5222  >  64144 [ACK] Seq=6326 Ack=605 Win=3725 Len=0"
"1294","33.239457","157.240.251.61","192.168.0.10","TCP","566","5222  >  64144 [ACK] Seq=6326 Ack=605 Win=3725 Len=512 [TCP segment of a reassembled PDU]"
"1295","33.241506","157.240.251.61","192.168.0.10","TCP","566","5222  >  64144 [PSH, ACK] Seq=6838 Ack=605 Win=3725 Len=512 [TCP segment of a reassembled PDU]"
"1296","33.241843","192.168.0.10","157.240.251.61","TCP","54","64144  >  5222 [ACK] Seq=605 Ack=7350 Win=512 Len=0"
"1297","33.242727","157.240.251.61","192.168.0.10","TCP","298","5222  >  64144 [PSH, ACK] Seq=7350 Ack=605 Win=3725 Len=244 [TCP segment of a reassembled PDU]"
"1302","33.281225","192.168.0.10","157.240.251.61","TCP","124","64144  >  5222 [PSH, ACK] Seq=605 Ack=7594 Win=511 Len=70 [TCP segment of a reassembled PDU]"
"1304","33.357160","157.240.251.61","192.168.0.10","TCP","56","5222  >  64144 [ACK] Seq=7594 Ack=675 Win=3725 Len=0"
"1614","37.312739","157.240.251.61","192.168.0.10","TCP","129","5222  >  64144 [PSH, ACK] Seq=7594 Ack=675 Win=3725 Len=75 [TCP segment of a reassembled PDU]"
"1615","37.324595","192.168.0.10","157.240.251.61","TCP","125","64144  >  5222 [PSH, ACK] Seq=675 Ack=7669 Win=516 Len=71 [TCP segment of a reassembled PDU]"
"1618","37.401162","157.240.251.61","192.168.0.10","TCP","56","5222  >  64144 [ACK] Seq=7669 Ack=746 Win=3725 Len=0"
"1625","38.973848","157.240.251.61","192.168.0.10","TCP","566","5222  >  64144 [ACK] Seq=7669 Ack=746 Win=3725 Len=512 [TCP segment of a reassembled PDU]"
"1626","38.975286","157.240.251.61","192.168.0.10","TCP","566","5222  >  64144 [PSH, ACK] Seq=8181 Ack=746 Win=3725 Len=512 [TCP segment of a reassembled PDU]"
"1627","38.975604","192.168.0.10","157.240.251.61","TCP","54","64144  >  5222 [ACK] Seq=746 Ack=8693 Win=512 Len=0"
"1628","38.976957","157.240.251.61","192.168.0.10","TCP","298","5222  >  64144 [PSH, ACK] Seq=8693 Ack=746 Win=3725 Len=244 [TCP segment of a reassembled PDU]"
"1633","39.010490","192.168.0.10","157.240.251.61","TCP","124","64144  >  5222 [PSH, ACK] Seq=746 Ack=8937 Win=511 Len=70 [TCP segment of a reassembled PDU]"
"1636","39.122152","157.240.251.61","192.168.0.10","TCP","56","5222  >  64144 [ACK] Seq=8937 Ack=816 Win=3725 Len=0"
"1798","41.193029","157.240.251.61","192.168.0.10","TCP","129","5222  >  64144 [PSH, ACK] Seq=8937 Ack=816 Win=3725 Len=75 [TCP segment of a reassembled PDU]"
"1801","41.247734","192.168.0.10","157.240.251.61","TCP","54","64144  >  5222 [ACK] Seq=816 Ack=9012 Win=511 Len=0"
"1806","41.583086","192.168.0.10","157.240.251.61","TCP","125","64144  >  5222 [PSH, ACK] Seq=816 Ack=9012 Win=511 Len=71 [TCP segment of a reassembled PDU]"
"1808","41.656082","157.240.251.61","192.168.0.10","TCP","56","5222  >  64144 [ACK] Seq=9012 Ack=887 Win=3725 Len=0"
"1978","44.647135","157.240.251.61","192.168.0.10","TCP","566","5222  >  64144 [ACK] Seq=9012 Ack=887 Win=3725 Len=512 [TCP segment of a reassembled PDU]"
"1979","44.648410","157.240.251.61","192.168.0.10","TCP","566","5222  >  64144 [PSH, ACK] Seq=9524 Ack=887 Win=3725 Len=512 [TCP segment of a reassembled PDU]"
"1980","44.648410","157.240.251.61","192.168.0.10","TCP","314","5222  >  64144 [PSH, ACK] Seq=10036 Ack=887 Win=3725 Len=260 [TCP segment of a reassembled PDU]"
"1981","44.648762","192.168.0.10","157.240.251.61","TCP","54","64144  >  5222 [ACK] Seq=887 Ack=10036 Win=516 Len=0"
"1986","44.681687","192.168.0.10","157.240.251.61","TCP","124","64144  >  5222 [PSH, ACK] Seq=887 Ack=10296 Win=515 Len=70 [TCP segment of a reassembled PDU]"
"1988","44.753930","157.240.251.61","192.168.0.10","TCP","56","5222  >  64144 [ACK] Seq=10296 Ack=957 Win=3725 Len=0"
"2290","48.650531","157.240.251.61","192.168.0.10","TCP","129","5222  >  64144 [PSH, ACK] Seq=10296 Ack=957 Win=3725 Len=75 [TCP segment of a reassembled PDU]"
"2292","48.665841","192.168.0.10","157.240.251.61","TCP","125","64144  >  5222 [PSH, ACK] Seq=957 Ack=10371 Win=515 Len=71 [TCP segment of a reassembled PDU]"
"2295","48.771229","157.240.251.61","192.168.0.10","TCP","56","5222  >  64144 [ACK] Seq=10371 Ack=1028 Win=3725 Len=0"
"2299","49.600868","157.240.251.61","192.168.0.10","TCP","566","5222  >  64144 [ACK] Seq=10371 Ack=1028 Win=3725 Len=512 [TCP segment of a reassembled PDU]"
"2300","49.600868","157.240.251.61","192.168.0.10","TCP","566","5222  >  64144 [PSH, ACK] Seq=10883 Ack=1028 Win=3725 Len=512 [TCP segment of a reassembled PDU]"
"2301","49.600868","157.240.251.61","192.168.0.10","TCP","298","5222  >  64144 [PSH, ACK] Seq=11395 Ack=1028 Win=3725 Len=244 [TCP segment of a reassembled PDU]"
"2302","49.601292","192.168.0.10","157.240.251.61","TCP","54","64144  >  5222 [ACK] Seq=1028 Ack=11395 Win=511 Len=0"
"2307","49.637617","192.168.0.10","157.240.251.61","TCP","124","64144  >  5222 [PSH, ACK] Seq=1028 Ack=11639 Win=516 Len=70 [TCP segment of a reassembled PDU]"
"2310","49.737320","157.240.251.61","192.168.0.10","TCP","56","5222  >  64144 [ACK] Seq=11639 Ack=1098 Win=3725 Len=0"
"2446","51.660420","157.240.251.61","192.168.0.10","TCP","129","5222  >  64144 [PSH, ACK] Seq=11639 Ack=1098 Win=3725 Len=75 [TCP segment of a reassembled PDU]"
"2449","51.702884","192.168.0.10","157.240.251.61","TCP","54","64144  >  5222 [ACK] Seq=1098 Ack=11714 Win=516 Len=0"
"2453","51.987069","192.168.0.10","157.240.251.61","TCP","125","64144  >  5222 [PSH, ACK] Seq=1098 Ack=11714 Win=516 Len=71 [TCP segment of a reassembled PDU]"
"2459","52.067345","157.240.251.61","192.168.0.10","TCP","56","5222  >  64144 [ACK] Seq=11714 Ack=1169 Win=3725 Len=0"
"2607","54.118630","157.240.251.61","192.168.0.10","TCP","566","5222  >  64144 [ACK] Seq=11714 Ack=1169 Win=3725 Len=512 [TCP segment of a reassembled PDU]"
"2608","54.118833","157.240.251.61","192.168.0.10","TCP","566","5222  >  64144 [PSH, ACK] Seq=12226 Ack=1169 Win=3725 Len=512 [TCP segment of a reassembled PDU]"
"2609","54.118833","157.240.251.61","192.168.0.10","TCP","298","5222  >  64144 [PSH, ACK] Seq=12738 Ack=1169 Win=3725 Len=244 [TCP segment of a reassembled PDU]"
"2613","54.119016","192.168.0.10","157.240.251.61","TCP","54","64144  >  5222 [ACK] Seq=1169 Ack=12738 Win=512 Len=0"
"2616","54.159865","192.168.0.10","157.240.251.61","TCP","54","64144  >  5222 [ACK] Seq=1169 Ack=12982 Win=511 Len=0"
"2617","54.166865","192.168.0.10","157.240.251.61","TCP","124","64144  >  5222 [PSH, ACK] Seq=1169 Ack=12982 Win=511 Len=70 [TCP segment of a reassembled PDU]"
"2619","54.244084","157.240.251.61","192.168.0.10","TCP","56","5222  >  64144 [ACK] Seq=12982 Ack=1239 Win=3725 Len=0"
"2633","54.940256","157.240.251.61","192.168.0.10","TCP","129","5222  >  64144 [PSH, ACK] Seq=12982 Ack=1239 Win=3725 Len=75 [TCP segment of a reassembled PDU]"
"2635","54.949284","192.168.0.10","157.240.251.61","TCP","125","64144  >  5222 [PSH, ACK] Seq=1239 Ack=13057 Win=516 Len=71 [TCP segment of a reassembled PDU]"
"2638","55.024286","157.240.251.61","192.168.0.10","TCP","56","5222  >  64144 [ACK] Seq=13057 Ack=1310 Win=3725 Len=0"
"2914","57.532009","157.240.251.61","192.168.0.10","TCP","566","5222  >  64144 [ACK] Seq=13057 Ack=1310 Win=3725 Len=512 [TCP segment of a reassembled PDU]"
"2915","57.532009","157.240.251.61","192.168.0.10","TCP","566","5222  >  64144 [PSH, ACK] Seq=13569 Ack=1310 Win=3725 Len=512 [TCP segment of a reassembled PDU]"
"2916","57.532500","192.168.0.10","157.240.251.61","TCP","54","64144  >  5222 [ACK] Seq=1310 Ack=14081 Win=512 Len=0"
"2917","57.533381","157.240.251.61","192.168.0.10","TCP","282","5222  >  64144 [PSH, ACK] Seq=14081 Ack=1310 Win=3725 Len=228 [TCP segment of a reassembled PDU]"
"2922","57.570413","192.168.0.10","157.240.251.61","TCP","124","64144  >  5222 [PSH, ACK] Seq=1310 Ack=14309 Win=511 Len=70 [TCP segment of a reassembled PDU]"
"2926","57.706471","157.240.251.61","192.168.0.10","TCP","56","5222  >  64144 [ACK] Seq=14309 Ack=1380 Win=3725 Len=0"
"3053","58.743558","157.240.251.61","192.168.0.10","TCP","129","5222  >  64144 [PSH, ACK] Seq=14309 Ack=1380 Win=3725 Len=75 [TCP segment of a reassembled PDU]"
"3054","58.749926","192.168.0.10","157.240.251.61","TCP","125","64144  >  5222 [PSH, ACK] Seq=1380 Ack=14384 Win=511 Len=71 [TCP segment of a reassembled PDU]"
"3055","58.827702","157.240.251.61","192.168.0.10","TCP","56","5222  >  64144 [ACK] Seq=14384 Ack=1451 Win=3725 Len=0"
"3262","62.987233","157.240.251.61","192.168.0.10","TCP","566","5222  >  64144 [ACK] Seq=14384 Ack=1451 Win=3725 Len=512 [TCP segment of a reassembled PDU]"
"3263","62.987802","157.240.251.61","192.168.0.10","TCP","566","5222  >  64144 [PSH, ACK] Seq=14896 Ack=1451 Win=3725 Len=512 [TCP segment of a reassembled PDU]"
"3264","62.988013","192.168.0.10","157.240.251.61","TCP","54","64144  >  5222 [ACK] Seq=1451 Ack=15408 Win=516 Len=0"
"3265","62.989038","157.240.251.61","192.168.0.10","TCP","314","5222  >  64144 [PSH, ACK] Seq=15408 Ack=1451 Win=3725 Len=260 [TCP segment of a reassembled PDU]"
"3271","63.028684","192.168.0.10","157.240.251.61","TCP","124","64144  >  5222 [PSH, ACK] Seq=1451 Ack=15668 Win=515 Len=70 [TCP segment of a reassembled PDU]"
"3273","63.100408","157.240.251.61","192.168.0.10","TCP","56","5222  >  64144 [ACK] Seq=15668 Ack=1521 Win=3725 Len=0"
"3637","67.067605","157.240.251.61","192.168.0.10","TCP","129","5222  >  64144 [PSH, ACK] Seq=15668 Ack=1521 Win=3725 Len=75 [TCP segment of a reassembled PDU]"
"3638","67.073291","192.168.0.10","157.240.251.61","TCP","125","64144  >  5222 [PSH, ACK] Seq=1521 Ack=15743 Win=515 Len=71 [TCP segment of a reassembled PDU]"
"3639","67.169238","157.240.251.61","192.168.0.10","TCP","56","5222  >  64144 [ACK] Seq=15743 Ack=1592 Win=3725 Len=0"
"3652","67.576129","157.240.251.61","192.168.0.10","TCP","566","5222  >  64144 [ACK] Seq=15743 Ack=1592 Win=3725 Len=512 [TCP segment of a reassembled PDU]"
"3653","67.576129","157.240.251.61","192.168.0.10","TCP","566","5222  >  64144 [PSH, ACK] Seq=16255 Ack=1592 Win=3725 Len=512 [TCP segment of a reassembled PDU]"
"3654","67.576129","157.240.251.61","192.168.0.10","TCP","298","5222  >  64144 [PSH, ACK] Seq=16767 Ack=1592 Win=3725 Len=244 [TCP segment of a reassembled PDU]"
"3658","67.576508","192.168.0.10","157.240.251.61","TCP","54","64144  >  5222 [ACK] Seq=1592 Ack=16767 Win=511 Len=0"
"3660","67.612347","192.168.0.10","157.240.251.61","TCP","124","64144  >  5222 [PSH, ACK] Seq=1592 Ack=17011 Win=516 Len=70 [TCP segment of a reassembled PDU]"
"3662","67.687036","157.240.251.61","192.168.0.10","TCP","56","5222  >  64144 [ACK] Seq=17011 Ack=1662 Win=3725 Len=0"
"3927","70.594424","157.240.251.61","192.168.0.10","TCP","129","5222  >  64144 [PSH, ACK] Seq=17011 Ack=1662 Win=3725 Len=75 [TCP segment of a reassembled PDU]"
"3930","70.601003","192.168.0.10","157.240.251.61","TCP","125","64144  >  5222 [PSH, ACK] Seq=1662 Ack=17086 Win=516 Len=71 [TCP segment of a reassembled PDU]"
"3931","70.671903","157.240.251.61","192.168.0.10","TCP","56","5222  >  64144 [ACK] Seq=17086 Ack=1733 Win=3725 Len=0"
"3958","71.782033","157.240.251.61","192.168.0.10","TCP","566","5222  >  64144 [ACK] Seq=17086 Ack=1733 Win=3725 Len=512 [TCP segment of a reassembled PDU]"
"3959","71.783687","157.240.251.61","192.168.0.10","TCP","566","5222  >  64144 [PSH, ACK] Seq=17598 Ack=1733 Win=3725 Len=512 [TCP segment of a reassembled PDU]"
"3960","71.783687","157.240.251.61","192.168.0.10","TCP","298","5222  >  64144 [PSH, ACK] Seq=18110 Ack=1733 Win=3725 Len=244 [TCP segment of a reassembled PDU]"
"3961","71.784054","192.168.0.10","157.240.251.61","TCP","54","64144  >  5222 [ACK] Seq=1733 Ack=18110 Win=512 Len=0"
"3966","71.816982","192.168.0.10","157.240.251.61","TCP","124","64144  >  5222 [PSH, ACK] Seq=1733 Ack=18354 Win=511 Len=70 [TCP segment of a reassembled PDU]"
"3968","71.892333","157.240.251.61","192.168.0.10","TCP","56","5222  >  64144 [ACK] Seq=18354 Ack=1803 Win=3725 Len=0"
"4121","73.854886","157.240.251.61","192.168.0.10","TCP","129","5222  >  64144 [PSH, ACK] Seq=18354 Ack=1803 Win=3725 Len=75 [TCP segment of a reassembled PDU]"
"4122","73.898741","192.168.0.10","157.240.251.61","TCP","54","64144  >  5222 [ACK] Seq=1803 Ack=18429 Win=516 Len=0"
"4123","74.075150","192.168.0.10","157.240.251.61","TCP","125","64144  >  5222 [PSH, ACK] Seq=1803 Ack=18429 Win=516 Len=71 [TCP segment of a reassembled PDU]"
"4125","74.153136","157.240.251.61","192.168.0.10","TCP","56","5222  >  64144 [ACK] Seq=18429 Ack=1874 Win=3725 Len=0"
"4291","76.644039","157.240.251.61","192.168.0.10","TCP","566","5222  >  64144 [ACK] Seq=18429 Ack=1874 Win=3725 Len=512 [TCP segment of a reassembled PDU]"
"4292","76.646303","157.240.251.61","192.168.0.10","TCP","566","5222  >  64144 [PSH, ACK] Seq=18941 Ack=1874 Win=3725 Len=512 [TCP segment of a reassembled PDU]"
"4293","76.646452","157.240.251.61","192.168.0.10","TCP","282","5222  >  64144 [PSH, ACK] Seq=19453 Ack=1874 Win=3725 Len=228 [TCP segment of a reassembled PDU]"
"4294","76.646647","192.168.0.10","157.240.251.61","TCP","54","64144  >  5222 [ACK] Seq=1874 Ack=19453 Win=512 Len=0"
"4299","76.686654","192.168.0.10","157.240.251.61","TCP","124","64144  >  5222 [PSH, ACK] Seq=1874 Ack=19681 Win=511 Len=70 [TCP segment of a reassembled PDU]"
"4301","76.759490","157.240.251.61","192.168.0.10","TCP","56","5222  >  64144 [ACK] Seq=19681 Ack=1944 Win=3725 Len=0"
"4618","80.710921","157.240.251.61","192.168.0.10","TCP","129","5222  >  64144 [PSH, ACK] Seq=19681 Ack=1944 Win=3725 Len=75 [TCP segment of a reassembled PDU]"
"4620","80.720471","192.168.0.10","157.240.251.61","TCP","125","64144  >  5222 [PSH, ACK] Seq=1944 Ack=19756 Win=511 Len=71 [TCP segment of a reassembled PDU]"
"4622","80.802450","157.240.251.61","192.168.0.10","TCP","56","5222  >  64144 [ACK] Seq=19756 Ack=2015 Win=3725 Len=0"
"4633","81.574940","157.240.251.61","192.168.0.10","TCP","566","5222  >  64144 [ACK] Seq=19756 Ack=2015 Win=3725 Len=512 [TCP segment of a reassembled PDU]"
"4634","81.575140","157.240.251.61","192.168.0.10","TCP","566","5222  >  64144 [PSH, ACK] Seq=20268 Ack=2015 Win=3725 Len=512 [TCP segment of a reassembled PDU]"
"4635","81.575415","192.168.0.10","157.240.251.61","TCP","54","64144  >  5222 [ACK] Seq=2015 Ack=20780 Win=516 Len=0"
"4636","81.576223","157.240.251.61","192.168.0.10","TCP","298","5222  >  64144 [PSH, ACK] Seq=20780 Ack=2015 Win=3725 Len=244 [TCP segment of a reassembled PDU]"
"4641","81.602780","192.168.0.10","157.240.251.61","TCP","124","64144  >  5222 [PSH, ACK] Seq=2015 Ack=21024 Win=515 Len=70 [TCP segment of a reassembled PDU]"
"4643","81.675097","157.240.251.61","192.168.0.10","TCP","56","5222  >  64144 [ACK] Seq=21024 Ack=2085 Win=3725 Len=0"
"4769","83.861298","157.240.251.61","192.168.0.10","TCP","159","5222  >  64144 [PSH, ACK] Seq=21024 Ack=2085 Win=3725 Len=105 [TCP segment of a reassembled PDU]"
"4770","83.864998","157.240.251.61","192.168.0.10","TCP","129","5222  >  64144 [PSH, ACK] Seq=21129 Ack=2085 Win=3725 Len=75 [TCP segment of a reassembled PDU]"
"4774","83.865473","192.168.0.10","157.240.251.61","TCP","54","64144  >  5222 [ACK] Seq=2085 Ack=21204 Win=514 Len=0"
"4777","83.972970","192.168.0.10","157.240.251.61","TCP","100","64144  >  5222 [PSH, ACK] Seq=2085 Ack=21204 Win=514 Len=46 [TCP segment of a reassembled PDU]"
"4778","83.976780","192.168.0.10","157.240.251.61","TCP","125","64144  >  5222 [PSH, ACK] Seq=2131 Ack=21204 Win=514 Len=71 [TCP segment of a reassembled PDU]"
"4823","84.081226","157.240.251.61","192.168.0.10","TCP","56","5222  >  64144 [ACK] Seq=21204 Ack=2131 Win=3725 Len=0"
"4829","84.081481","157.240.251.61","192.168.0.10","TCP","56","5222  >  64144 [ACK] Seq=21204 Ack=2202 Win=3725 Len=0"
"4943","85.890043","157.240.251.61","192.168.0.10","TCP","566","5222  >  64144 [ACK] Seq=21204 Ack=2202 Win=3725 Len=512 [TCP segment of a reassembled PDU]"
"4944","85.890043","157.240.251.61","192.168.0.10","TCP","566","5222  >  64144 [PSH, ACK] Seq=21716 Ack=2202 Win=3725 Len=512 [TCP segment of a reassembled PDU]"
"4945","85.890043","157.240.251.61","192.168.0.10","TCP","298","5222  >  64144 [PSH, ACK] Seq=22228 Ack=2202 Win=3725 Len=244 [TCP segment of a reassembled PDU]"
"4946","85.890258","192.168.0.10","157.240.251.61","TCP","54","64144  >  5222 [ACK] Seq=2202 Ack=22228 Win=516 Len=0"
"4948","85.938476","192.168.0.10","157.240.251.61","TCP","54","64144  >  5222 [ACK] Seq=2202 Ack=22472 Win=515 Len=0"
"4949","85.948464","192.168.0.10","157.240.251.61","TCP","124","64144  >  5222 [PSH, ACK] Seq=2202 Ack=22472 Win=515 Len=70 [TCP segment of a reassembled PDU]"
"4952","86.019818","157.240.251.61","192.168.0.10","TCP","56","5222  >  64144 [ACK] Seq=22472 Ack=2272 Win=3725 Len=0"
"5085","87.010441","157.240.251.61","192.168.0.10","TCP","129","5222  >  64144 [PSH, ACK] Seq=22472 Ack=2272 Win=3725 Len=75 [TCP segment of a reassembled PDU]"
"5086","87.018702","192.168.0.10","157.240.251.61","TCP","125","64144  >  5222 [PSH, ACK] Seq=2272 Ack=22547 Win=515 Len=71 [TCP segment of a reassembled PDU]"
"5087","87.114825","157.240.251.61","192.168.0.10","TCP","56","5222  >  64144 [ACK] Seq=22547 Ack=2343 Win=3725 Len=0"
"5308","93.069417","157.240.251.61","192.168.0.10","TCP","566","5222  >  64144 [ACK] Seq=22547 Ack=2343 Win=3725 Len=512 [TCP segment of a reassembled PDU]"
"5309","93.070959","157.240.251.61","192.168.0.10","TCP","566","5222  >  64144 [PSH, ACK] Seq=23059 Ack=2343 Win=3725 Len=512 [TCP segment of a reassembled PDU]"
"5310","93.071300","192.168.0.10","157.240.251.61","TCP","54","64144  >  5222 [ACK] Seq=2343 Ack=23571 Win=511 Len=0"
"5311","93.071823","157.240.251.61","192.168.0.10","TCP","282","5222  >  64144 [PSH, ACK] Seq=23571 Ack=2343 Win=3725 Len=228 [TCP segment of a reassembled PDU]"
"5316","93.104688","192.168.0.10","157.240.251.61","TCP","124","64144  >  5222 [PSH, ACK] Seq=2343 Ack=23799 Win=516 Len=70 [TCP segment of a reassembled PDU]"
"5318","93.174852","157.240.251.61","192.168.0.10","TCP","56","5222  >  64144 [ACK] Seq=23799 Ack=2413 Win=3725 Len=0"
