"No.","Time","Source","Destination","Protocol","Length","Info"
"38","3.799009","157.240.251.61","192.168.0.10","TCP","125","5222  >  64144 [PSH, ACK] Seq=1 Ack=1 Win=3725 Len=71 [TCP segment of a reassembled PDU]"
"39","3.800796","192.168.0.10","157.240.251.61","TCP","100","64144  >  5222 [PSH, ACK] Seq=1 Ack=72 Win=513 Len=46 [TCP segment of a reassembled PDU]"
"42","3.881528","157.240.251.61","192.168.0.10","TCP","56","5222  >  64144 [ACK] Seq=72 Ack=47 Win=3725 Len=0"
"107","9.102343","157.240.251.61","192.168.0.10","TCP","566","5222  >  64144 [ACK] Seq=72 Ack=47 Win=3725 Len=512 [TCP segment of a reassembled PDU]"
"108","9.103759","157.240.251.61","192.168.0.10","TCP","566","5222  >  64144 [PSH, ACK] Seq=584 Ack=47 Win=3725 Len=512 [TCP segment of a reassembled PDU]"
"109","9.103759","157.240.251.61","192.168.0.10","TCP","424","5222  >  64144 [PSH, ACK] Seq=1096 Ack=47 Win=3725 Len=370 [TCP segment of a reassembled PDU]"
"110","9.104010","192.168.0.10","157.240.251.61","TCP","54","64144  >  5222 [ACK] Seq=47 Ack=1096 Win=516 Len=0"
"112","9.123208","192.168.0.10","157.240.251.61","TCP","121","64144  >  5222 [PSH, ACK] Seq=47 Ack=1466 Win=515 Len=67 [TCP segment of a reassembled PDU]"
"120","9.194138","157.240.251.61","192.168.0.10","TCP","56","5222  >  64144 [ACK] Seq=1466 Ack=114 Win=3725 Len=0"
"128","9.352182","157.240.251.61","192.168.0.10","TCP","566","5222  >  64144 [ACK] Seq=1466 Ack=114 Win=3725 Len=512 [TCP segment of a reassembled PDU]"
"129","9.352182","157.240.251.61","192.168.0.10","TCP","566","5222  >  64144 [PSH, ACK] Seq=1978 Ack=114 Win=3725 Len=512 [TCP segment of a reassembled PDU]"
"130","9.352553","192.168.0.10","157.240.251.61","TCP","54","64144  >  5222 [ACK] Seq=114 Ack=2490 Win=516 Len=0"
"131","9.356306","157.240.251.61","192.168.0.10","TCP","504","5222  >  64144 [PSH, ACK] Seq=2490 Ack=114 Win=3725 Len=450 [TCP segment of a reassembled PDU]"
"137","9.377349","192.168.0.10","157.240.251.61","TCP","121","64144  >  5222 [PSH, ACK] Seq=114 Ack=2940 Win=514 Len=67 [TCP segment of a reassembled PDU]"
"140","9.464061","157.240.251.61","192.168.0.10","TCP","56","5222  >  64144 [ACK] Seq=2940 Ack=181 Win=3725 Len=0"
"142","9.611790","157.240.251.61","192.168.0.10","TCP","566","5222  >  64144 [ACK] Seq=2940 Ack=181 Win=3725 Len=512 [TCP segment of a reassembled PDU]"
"143","9.611790","157.240.251.61","192.168.0.10","TCP","566","5222  >  64144 [PSH, ACK] Seq=3452 Ack=181 Win=3725 Len=512 [TCP segment of a reassembled PDU]"
"144","9.612442","192.168.0.10","157.240.251.61","TCP","54","64144  >  5222 [ACK] Seq=181 Ack=3964 Win=516 Len=0"
"145","9.613473","157.240.251.61","192.168.0.10","TCP","440","5222  >  64144 [PSH, ACK] Seq=3964 Ack=181 Win=3725 Len=386 [TCP segment of a reassembled PDU]"
"150","9.643917","192.168.0.10","157.240.251.61","TCP","121","64144  >  5222 [PSH, ACK] Seq=181 Ack=4350 Win=515 Len=67 [TCP segment of a reassembled PDU]"
"152","9.721576","157.240.251.61","192.168.0.10","TCP","56","5222  >  64144 [ACK] Seq=4350 Ack=248 Win=3725 Len=0"
"155","9.975710","157.240.251.61","192.168.0.10","TCP","566","5222  >  64144 [ACK] Seq=4350 Ack=248 Win=3725 Len=512 [TCP segment of a reassembled PDU]"
"156","9.975710","157.240.251.61","192.168.0.10","TCP","566","5222  >  64144 [PSH, ACK] Seq=4862 Ack=248 Win=3725 Len=512 [TCP segment of a reassembled PDU]"
"157","9.976019","157.240.251.61","192.168.0.10","TCP","521","5222  >  64144 [PSH, ACK] Seq=5374 Ack=248 Win=3725 Len=467 [TCP segment of a reassembled PDU]"
"158","9.976161","157.240.251.61","192.168.0.10","TCP","85","5222  >  64144 [PSH, ACK] Seq=5841 Ack=248 Win=3725 Len=31 [TCP segment of a reassembled PDU]"
"160","9.976303","192.168.0.10","157.240.251.61","TCP","54","64144  >  5222 [ACK] Seq=248 Ack=5374 Win=516 Len=0"
"161","9.976743","192.168.0.10","157.240.251.61","TCP","54","64144  >  5222 [ACK] Seq=248 Ack=5872 Win=514 Len=0"
"168","10.032753","192.168.0.10","157.240.251.61","TCP","121","64144  >  5222 [PSH, ACK] Seq=248 Ack=5872 Win=514 Len=67 [TCP segment of a reassembled PDU]"
"172","10.112565","157.240.251.61","192.168.0.10","TCP","56","5222  >  64144 [ACK] Seq=5872 Ack=315 Win=3725 Len=0"
"179","10.667914","157.240.251.61","192.168.0.10","TCP","115","5222  >  64144 [PSH, ACK] Seq=5872 Ack=315 Win=3725 Len=61 [TCP segment of a reassembled PDU]"
"181","10.668856","157.240.251.61","192.168.0.10","TCP","115","5222  >  64144 [PSH, ACK] Seq=5933 Ack=315 Win=3725 Len=61 [TCP segment of a reassembled PDU]"
"182","10.669168","192.168.0.10","157.240.251.61","TCP","54","64144  >  5222 [ACK] Seq=315 Ack=5994 Win=514 Len=0"
"187","10.772355","157.240.251.61","192.168.0.10","TCP","115","5222  >  64144 [PSH, ACK] Seq=5994 Ack=315 Win=3725 Len=61 [TCP segment of a reassembled PDU]"
"189","10.826009","192.168.0.10","157.240.251.61","TCP","54","64144  >  5222 [ACK] Seq=315 Ack=6055 Win=513 Len=0"
"193","10.883349","157.240.251.61","192.168.0.10","TCP","115","5222  >  64144 [PSH, ACK] Seq=6055 Ack=315 Win=3725 Len=61 [TCP segment of a reassembled PDU]"
"198","10.931286","192.168.0.10","157.240.251.61","TCP","111","64144  >  5222 [PSH, ACK] Seq=315 Ack=6116 Win=513 Len=57 [TCP segment of a reassembled PDU]"
"199","10.935228","192.168.0.10","157.240.251.61","TCP","111","64144  >  5222 [PSH, ACK] Seq=372 Ack=6116 Win=513 Len=57 [TCP segment of a reassembled PDU]"
"201","10.939644","192.168.0.10","157.240.251.61","TCP","111","64144  >  5222 [PSH, ACK] Seq=429 Ack=6116 Win=513 Len=57 [TCP segment of a reassembled PDU]"
"202","10.944608","192.168.0.10","157.240.251.61","TCP","111","64144  >  5222 [PSH, ACK] Seq=486 Ack=6116 Win=513 Len=57 [TCP segment of a reassembled PDU]"
"206","11.012856","157.240.251.61","192.168.0.10","TCP","56","5222  >  64144 [ACK] Seq=6116 Ack=372 Win=3725 Len=0"
"207","11.012856","157.240.251.61","192.168.0.10","TCP","56","5222  >  64144 [ACK] Seq=6116 Ack=429 Win=3725 Len=0"
"212","11.021441","157.240.251.61","192.168.0.10","TCP","56","5222  >  64144 [ACK] Seq=6116 Ack=486 Win=3725 Len=0"
"215","11.076174","157.240.251.61","192.168.0.10","TCP","56","5222  >  64144 [ACK] Seq=6116 Ack=543 Win=3725 Len=0"
"232","12.493074","157.240.251.61","192.168.0.10","TCP","125","5222  >  64144 [PSH, ACK] Seq=6116 Ack=543 Win=3725 Len=71 [TCP segment of a reassembled PDU]"
"238","12.534462","192.168.0.10","157.240.251.61","TCP","54","64144  >  5222 [ACK] Seq=543 Ack=6187 Win=513 Len=0"
"239","12.587934","192.168.0.10","157.240.251.61","TCP","100","64144  >  5222 [PSH, ACK] Seq=543 Ack=6187 Win=513 Len=46 [TCP segment of a reassembled PDU]"
"241","12.660495","157.240.251.61","192.168.0.10","TCP","56","5222  >  64144 [ACK] Seq=6187 Ack=589 Win=3725 Len=0"
"335","20.160131","192.168.0.10","157.240.251.61","TCP","1054","64144  >  5222 [PSH, ACK] Seq=589 Ack=6187 Win=513 Len=1000 [TCP segment of a reassembled PDU]"
"336","20.250024","157.240.251.61","192.168.0.10","TCP","56","5222  >  64144 [ACK] Seq=6187 Ack=1589 Win=3735 Len=0"
"337","20.363583","157.240.251.61","192.168.0.10","TCP","93","5222  >  64144 [PSH, ACK] Seq=6187 Ack=1589 Win=3735 Len=39 [TCP segment of a reassembled PDU]"
"338","20.408483","192.168.0.10","157.240.251.61","TCP","54","64144  >  5222 [ACK] Seq=1589 Ack=6226 Win=513 Len=0"
"379","25.482823","157.240.251.61","192.168.0.10","TCP","125","5222  >  64144 [PSH, ACK] Seq=6226 Ack=1589 Win=3735 Len=71 [TCP segment of a reassembled PDU]"
"380","25.484486","192.168.0.10","157.240.251.61","TCP","100","64144  >  5222 [PSH, ACK] Seq=1589 Ack=6297 Win=512 Len=46 [TCP segment of a reassembled PDU]"
"383","25.555738","157.240.251.61","192.168.0.10","TCP","56","5222  >  64144 [ACK] Seq=6297 Ack=1635 Win=3735 Len=0"
"478","29.625924","157.240.251.61","192.168.0.10","TCP","566","5222  >  64144 [ACK] Seq=6297 Ack=1635 Win=3735 Len=512 [TCP segment of a reassembled PDU]"
"479","29.625924","157.240.251.61","192.168.0.10","TCP","566","5222  >  64144 [PSH, ACK] Seq=6809 Ack=1635 Win=3735 Len=512 [TCP segment of a reassembled PDU]"
"480","29.625924","157.240.251.61","192.168.0.10","TCP","393","5222  >  64144 [PSH, ACK] Seq=7321 Ack=1635 Win=3735 Len=339 [TCP segment of a reassembled PDU]"
"481","29.626333","192.168.0.10","157.240.251.61","TCP","54","64144  >  5222 [ACK] Seq=1635 Ack=7321 Win=516 Len=0"
"488","29.652295","192.168.0.10","157.240.251.61","TCP","124","64144  >  5222 [PSH, ACK] Seq=1635 Ack=7660 Win=515 Len=70 [TCP segment of a reassembled PDU]"
"490","29.730055","157.240.251.61","192.168.0.10","TCP","56","5222  >  64144 [ACK] Seq=7660 Ack=1705 Win=3735 Len=0"
"491","29.858433","157.240.251.61","192.168.0.10","TCP","566","5222  >  64144 [ACK] Seq=7660 Ack=1705 Win=3735 Len=512 [TCP segment of a reassembled PDU]"
"492","29.858433","157.240.251.61","192.168.0.10","TCP","566","5222  >  64144 [PSH, ACK] Seq=8172 Ack=1705 Win=3735 Len=512 [TCP segment of a reassembled PDU]"
"493","29.858678","157.240.251.61","192.168.0.10","TCP","457","5222  >  64144 [PSH, ACK] Seq=8684 Ack=1705 Win=3735 Len=403 [TCP segment of a reassembled PDU]"
"494","29.858968","192.168.0.10","157.240.251.61","TCP","54","64144  >  5222 [ACK] Seq=1705 Ack=8684 Win=511 Len=0"
"499","29.884332","192.168.0.10","157.240.251.61","TCP","124","64144  >  5222 [PSH, ACK] Seq=1705 Ack=9087 Win=516 Len=70 [TCP segment of a reassembled PDU]"
"502","29.956252","157.240.251.61","192.168.0.10","TCP","56","5222  >  64144 [ACK] Seq=9087 Ack=1775 Win=3735 Len=0"
"504","30.088329","157.240.251.61","192.168.0.10","TCP","566","5222  >  64144 [ACK] Seq=9087 Ack=1775 Win=3735 Len=512 [TCP segment of a reassembled PDU]"
"505","30.097331","157.240.251.61","192.168.0.10","TCP","566","5222  >  64144 [PSH, ACK] Seq=9599 Ack=1775 Win=3735 Len=512 [TCP segment of a reassembled PDU]"
"506","30.097331","157.240.251.61","192.168.0.10","TCP","409","5222  >  64144 [PSH, ACK] Seq=10111 Ack=1775 Win=3735 Len=355 [TCP segment of a reassembled PDU]"
"510","30.097967","192.168.0.10","157.240.251.61","TCP","54","64144  >  5222 [ACK] Seq=1775 Ack=10111 Win=512 Len=0"
"512","30.134936","192.168.0.10","157.240.251.61","TCP","124","64144  >  5222 [PSH, ACK] Seq=1775 Ack=10466 Win=511 Len=70 [TCP segment of a reassembled PDU]"
"517","30.205195","157.240.251.61","192.168.0.10","TCP","56","5222  >  64144 [ACK] Seq=10466 Ack=1845 Win=3735 Len=0"
"523","30.417326","157.240.251.61","192.168.0.10","TCP","566","5222  >  64144 [ACK] Seq=10466 Ack=1845 Win=3735 Len=512 [TCP segment of a reassembled PDU]"
"524","30.417326","157.240.251.61","192.168.0.10","TCP","566","5222  >  64144 [PSH, ACK] Seq=10978 Ack=1845 Win=3735 Len=512 [TCP segment of a reassembled PDU]"
"525","30.418006","192.168.0.10","157.240.251.61","TCP","54","64144  >  5222 [ACK] Seq=1845 Ack=11490 Win=516 Len=0"
"526","30.419901","157.240.251.61","192.168.0.10","TCP","505","5222  >  64144 [PSH, ACK] Seq=11490 Ack=1845 Win=3735 Len=451 [TCP segment of a reassembled PDU]"
"531","30.443473","192.168.0.10","157.240.251.61","TCP","124","64144  >  5222 [PSH, ACK] Seq=1845 Ack=11941 Win=514 Len=70 [TCP segment of a reassembled PDU]"
"535","30.609079","157.240.251.61","192.168.0.10","TCP","56","5222  >  64144 [ACK] Seq=11941 Ack=1915 Win=3735 Len=0"
"547","31.592504","157.240.251.61","192.168.0.10","TCP","129","5222  >  64144 [PSH, ACK] Seq=11941 Ack=1915 Win=3735 Len=75 [TCP segment of a reassembled PDU]"
"548","31.610321","157.240.251.61","192.168.0.10","TCP","129","5222  >  64144 [PSH, ACK] Seq=12016 Ack=1915 Win=3735 Len=75 [TCP segment of a reassembled PDU]"
"549","31.610862","192.168.0.10","157.240.251.61","TCP","54","64144  >  5222 [ACK] Seq=1915 Ack=12091 Win=514 Len=0"
"552","31.749515","157.240.251.61","192.168.0.10","TCP","129","5222  >  64144 [PSH, ACK] Seq=12091 Ack=1915 Win=3735 Len=75 [TCP segment of a reassembled PDU]"
"555","31.799104","192.168.0.10","157.240.251.61","TCP","54","64144  >  5222 [ACK] Seq=1915 Ack=12166 Win=513 Len=0"
"557","31.839726","157.240.251.61","192.168.0.10","TCP","129","5222  >  64144 [PSH, ACK] Seq=12166 Ack=1915 Win=3735 Len=75 [TCP segment of a reassembled PDU]"
"558","31.893758","192.168.0.10","157.240.251.61","TCP","54","64144  >  5222 [ACK] Seq=1915 Ack=12241 Win=513 Len=0"
"560","32.033917","192.168.0.10","157.240.251.61","TCP","125","64144  >  5222 [PSH, ACK] Seq=1915 Ack=12241 Win=513 Len=71 [TCP segment of a reassembled PDU]"
"565","32.071146","192.168.0.10","157.240.251.61","TCP","125","64144  >  5222 [PSH, ACK] Seq=1986 Ack=12241 Win=513 Len=71 [TCP segment of a reassembled PDU]"
"568","32.101743","192.168.0.10","157.240.251.61","TCP","125","64144  >  5222 [PSH, ACK] Seq=2057 Ack=12241 Win=513 Len=71 [TCP segment of a reassembled PDU]"
"569","32.104446","157.240.251.61","192.168.0.10","TCP","56","5222  >  64144 [ACK] Seq=12241 Ack=1986 Win=3735 Len=0"
"570","32.112235","192.168.0.10","157.240.251.61","TCP","125","64144  >  5222 [PSH, ACK] Seq=2128 Ack=12241 Win=513 Len=71 [TCP segment of a reassembled PDU]"
"573","32.147327","157.240.251.61","192.168.0.10","TCP","56","5222  >  64144 [ACK] Seq=12241 Ack=2057 Win=3735 Len=0"
"574","32.178781","157.240.251.61","192.168.0.10","TCP","56","5222  >  64144 [ACK] Seq=12241 Ack=2128 Win=3735 Len=0"
"575","32.186474","157.240.251.61","192.168.0.10","TCP","56","5222  >  64144 [ACK] Seq=12241 Ack=2199 Win=3735 Len=0"
"677","42.770513","157.240.251.61","192.168.0.10","TCP","566","5222  >  64144 [ACK] Seq=12241 Ack=2199 Win=3735 Len=512 [TCP segment of a reassembled PDU]"
"678","42.772415","157.240.251.61","192.168.0.10","TCP","566","5222  >  64144 [PSH, ACK] Seq=12753 Ack=2199 Win=3735 Len=512 [TCP segment of a reassembled PDU]"
"679","42.772415","157.240.251.61","192.168.0.10","TCP","393","5222  >  64144 [PSH, ACK] Seq=13265 Ack=2199 Win=3735 Len=339 [TCP segment of a reassembled PDU]"
"680","42.772769","192.168.0.10","157.240.251.61","TCP","54","64144  >  5222 [ACK] Seq=2199 Ack=13265 Win=516 Len=0"
"685","42.793202","192.168.0.10","157.240.251.61","TCP","124","64144  >  5222 [PSH, ACK] Seq=2199 Ack=13604 Win=515 Len=70 [TCP segment of a reassembled PDU]"
"688","42.890161","157.240.251.61","192.168.0.10","TCP","56","5222  >  64144 [ACK] Seq=13604 Ack=2269 Win=3735 Len=0"
"693","43.064407","157.240.251.61","192.168.0.10","TCP","566","5222  >  64144 [ACK] Seq=13604 Ack=2269 Win=3735 Len=512 [TCP segment of a reassembled PDU]"
"694","43.064407","157.240.251.61","192.168.0.10","TCP","566","5222  >  64144 [PSH, ACK] Seq=14116 Ack=2269 Win=3735 Len=512 [TCP segment of a reassembled PDU]"
"695","43.064407","157.240.251.61","192.168.0.10","TCP","457","5222  >  64144 [PSH, ACK] Seq=14628 Ack=2269 Win=3735 Len=403 [TCP segment of a reassembled PDU]"
"700","43.066830","192.168.0.10","157.240.251.61","TCP","54","64144  >  5222 [ACK] Seq=2269 Ack=14628 Win=511 Len=0"
"704","43.097710","192.168.0.10","157.240.251.61","TCP","124","64144  >  5222 [PSH, ACK] Seq=2269 Ack=15031 Win=516 Len=70 [TCP segment of a reassembled PDU]"
"712","43.168244","157.240.251.61","192.168.0.10","TCP","56","5222  >  64144 [ACK] Seq=15031 Ack=2339 Win=3735 Len=0"
"726","43.249591","157.240.251.61","192.168.0.10","TCP","566","5222  >  64144 [ACK] Seq=15031 Ack=2339 Win=3735 Len=512 [TCP segment of a reassembled PDU]"
"727","43.249591","157.240.251.61","192.168.0.10","TCP","566","5222  >  64144 [PSH, ACK] Seq=15543 Ack=2339 Win=3735 Len=512 [TCP segment of a reassembled PDU]"
"728","43.250136","157.240.251.61","192.168.0.10","TCP","409","5222  >  64144 [PSH, ACK] Seq=16055 Ack=2339 Win=3735 Len=355 [TCP segment of a reassembled PDU]"
"729","43.250611","192.168.0.10","157.240.251.61","TCP","54","64144  >  5222 [ACK] Seq=2339 Ack=16055 Win=512 Len=0"
"736","43.278543","192.168.0.10","157.240.251.61","TCP","124","64144  >  5222 [PSH, ACK] Seq=2339 Ack=16410 Win=511 Len=70 [TCP segment of a reassembled PDU]"
"739","43.354843","157.240.251.61","192.168.0.10","TCP","56","5222  >  64144 [ACK] Seq=16410 Ack=2409 Win=3735 Len=0"
"744","43.487130","157.240.251.61","192.168.0.10","TCP","566","5222  >  64144 [ACK] Seq=16410 Ack=2409 Win=3735 Len=512 [TCP segment of a reassembled PDU]"
"745","43.487755","157.240.251.61","192.168.0.10","TCP","566","5222  >  64144 [PSH, ACK] Seq=16922 Ack=2409 Win=3735 Len=512 [TCP segment of a reassembled PDU]"
"746","43.487755","157.240.251.61","192.168.0.10","TCP","521","5222  >  64144 [PSH, ACK] Seq=17434 Ack=2409 Win=3735 Len=467 [TCP segment of a reassembled PDU]"
"750","43.488285","192.168.0.10","157.240.251.61","TCP","54","64144  >  5222 [ACK] Seq=2409 Ack=17434 Win=516 Len=0"
"753","43.515936","192.168.0.10","157.240.251.61","TCP","124","64144  >  5222 [PSH, ACK] Seq=2409 Ack=17901 Win=514 Len=70 [TCP segment of a reassembled PDU]"
"756","43.594145","157.240.251.61","192.168.0.10","TCP","56","5222  >  64144 [ACK] Seq=17901 Ack=2479 Win=3735 Len=0"
"758","43.666427","157.240.251.61","192.168.0.10","TCP","129","5222  >  64144 [PSH, ACK] Seq=17901 Ack=2479 Win=3735 Len=75 [TCP segment of a reassembled PDU]"
"759","43.674357","192.168.0.10","157.240.251.61","TCP","125","64144  >  5222 [PSH, ACK] Seq=2479 Ack=17976 Win=514 Len=71 [TCP segment of a reassembled PDU]"
"760","43.688940","157.240.251.61","192.168.0.10","TCP","129","5222  >  64144 [PSH, ACK] Seq=17976 Ack=2479 Win=3735 Len=75 [TCP segment of a reassembled PDU]"
"761","43.700095","192.168.0.10","157.240.251.61","TCP","125","64144  >  5222 [PSH, ACK] Seq=2550 Ack=18051 Win=514 Len=71 [TCP segment of a reassembled PDU]"
"763","43.755718","157.240.251.61","192.168.0.10","TCP","56","5222  >  64144 [ACK] Seq=18051 Ack=2550 Win=3735 Len=0"
"765","43.844280","157.240.251.61","192.168.0.10","TCP","56","5222  >  64144 [ACK] Seq=18051 Ack=2621 Win=3735 Len=0"
"767","43.845041","157.240.251.61","192.168.0.10","TCP","129","5222  >  64144 [PSH, ACK] Seq=18051 Ack=2621 Win=3735 Len=75 [TCP segment of a reassembled PDU]"
"768","43.851741","192.168.0.10","157.240.251.61","TCP","125","64144  >  5222 [PSH, ACK] Seq=2621 Ack=18126 Win=513 Len=71 [TCP segment of a reassembled PDU]"
"770","43.945597","157.240.251.61","192.168.0.10","TCP","56","5222  >  64144 [ACK] Seq=18126 Ack=2692 Win=3735 Len=0"
"786","44.840566","157.240.251.61","192.168.0.10","TCP","129","5222  >  64144 [PSH, ACK] Seq=18126 Ack=2692 Win=3735 Len=75 [TCP segment of a reassembled PDU]"
"789","44.857625","192.168.0.10","157.240.251.61","TCP","125","64144  >  5222 [PSH, ACK] Seq=2692 Ack=18201 Win=513 Len=71 [TCP segment of a reassembled PDU]"
"790","44.939324","157.240.251.61","192.168.0.10","TCP","56","5222  >  64144 [ACK] Seq=18201 Ack=2763 Win=3735 Len=0"
"972","58.373276","157.240.251.61","192.168.0.10","TCP","566","5222  >  64144 [ACK] Seq=18201 Ack=2763 Win=3735 Len=512 [TCP segment of a reassembled PDU]"
"973","58.373525","157.240.251.61","192.168.0.10","TCP","566","5222  >  64144 [PSH, ACK] Seq=18713 Ack=2763 Win=3735 Len=512 [TCP segment of a reassembled PDU]"
"974","58.373525","157.240.251.61","192.168.0.10","TCP","393","5222  >  64144 [PSH, ACK] Seq=19225 Ack=2763 Win=3735 Len=339 [TCP segment of a reassembled PDU]"
"975","58.373755","192.168.0.10","157.240.251.61","TCP","54","64144  >  5222 [ACK] Seq=2763 Ack=19225 Win=516 Len=0"
"980","58.418861","157.240.251.61","192.168.0.10","TCP","393","[TCP Retransmission] 5222  >  64144 [PSH, ACK] Seq=19225 Ack=2763 Win=3735 Len=339"
"981","58.419443","192.168.0.10","157.240.251.61","TCP","66","64144  >  5222 [ACK] Seq=2763 Ack=19564 Win=515 Len=0 SLE=19225 SRE=19564"
"985","58.473414","192.168.0.10","157.240.251.61","TCP","124","64144  >  5222 [PSH, ACK] Seq=2763 Ack=19564 Win=515 Len=70 [TCP segment of a reassembled PDU]"
"986","58.529393","157.240.251.61","192.168.0.10","TCP","566","5222  >  64144 [ACK] Seq=19564 Ack=2763 Win=3735 Len=512 [TCP segment of a reassembled PDU]"
"987","58.529393","157.240.251.61","192.168.0.10","TCP","566","5222  >  64144 [PSH, ACK] Seq=20076 Ack=2763 Win=3735 Len=512 [TCP segment of a reassembled PDU]"
"988","58.529656","157.240.251.61","192.168.0.10","TCP","457","5222  >  64144 [PSH, ACK] Seq=20588 Ack=2763 Win=3735 Len=403 [TCP segment of a reassembled PDU]"
"991","58.529897","192.168.0.10","157.240.251.61","TCP","54","64144  >  5222 [ACK] Seq=2833 Ack=20588 Win=511 Len=0"
"993","58.530158","192.168.0.10","157.240.251.61","TCP","54","64144  >  5222 [ACK] Seq=2833 Ack=20991 Win=516 Len=0"
"995","58.544214","157.240.251.61","192.168.0.10","TCP","56","5222  >  64144 [ACK] Seq=20991 Ack=2833 Win=3735 Len=0"
"996","58.552459","192.168.0.10","157.240.251.61","TCP","124","64144  >  5222 [PSH, ACK] Seq=2833 Ack=20991 Win=516 Len=70 [TCP segment of a reassembled PDU]"
"1001","58.623561","157.240.251.61","192.168.0.10","TCP","56","5222  >  64144 [ACK] Seq=20991 Ack=2903 Win=3735 Len=0"
"1003","58.777364","157.240.251.61","192.168.0.10","TCP","566","5222  >  64144 [ACK] Seq=20991 Ack=2903 Win=3735 Len=512 [TCP segment of a reassembled PDU]"
"1004","58.777364","157.240.251.61","192.168.0.10","TCP","566","5222  >  64144 [PSH, ACK] Seq=21503 Ack=2903 Win=3735 Len=512 [TCP segment of a reassembled PDU]"
"1005","58.778248","157.240.251.61","192.168.0.10","TCP","409","5222  >  64144 [PSH, ACK] Seq=22015 Ack=2903 Win=3735 Len=355 [TCP segment of a reassembled PDU]"
"1009","58.779126","192.168.0.10","157.240.251.61","TCP","54","64144  >  5222 [ACK] Seq=2903 Ack=22015 Win=512 Len=0"
"1012","58.812796","192.168.0.10","157.240.251.61","TCP","124","64144  >  5222 [PSH, ACK] Seq=2903 Ack=22370 Win=511 Len=70 [TCP segment of a reassembled PDU]"
"1015","58.886817","157.240.251.61","192.168.0.10","TCP","56","5222  >  64144 [ACK] Seq=22370 Ack=2973 Win=3735 Len=0"
"1021","59.094864","157.240.251.61","192.168.0.10","TCP","566","5222  >  64144 [ACK] Seq=22370 Ack=2973 Win=3735 Len=512 [TCP segment of a reassembled PDU]"
"1022","59.094864","157.240.251.61","192.168.0.10","TCP","566","5222  >  64144 [PSH, ACK] Seq=22882 Ack=2973 Win=3735 Len=512 [TCP segment of a reassembled PDU]"
"1023","59.095725","192.168.0.10","157.240.251.61","TCP","54","64144  >  5222 [ACK] Seq=2973 Ack=23394 Win=516 Len=0"
"1024","59.097112","157.240.251.61","192.168.0.10","TCP","521","5222  >  64144 [PSH, ACK] Seq=23394 Ack=2973 Win=3735 Len=467 [TCP segment of a reassembled PDU]"
"1031","59.124794","192.168.0.10","157.240.251.61","TCP","124","64144  >  5222 [PSH, ACK] Seq=2973 Ack=23861 Win=514 Len=70 [TCP segment of a reassembled PDU]"
"1033","59.140616","157.240.251.61","192.168.0.10","TCP","129","5222  >  64144 [PSH, ACK] Seq=23861 Ack=2973 Win=3735 Len=75 [TCP segment of a reassembled PDU]"
"1034","59.152737","192.168.0.10","157.240.251.61","TCP","125","64144  >  5222 [PSH, ACK] Seq=3043 Ack=23936 Win=514 Len=71 [TCP segment of a reassembled PDU]"
"1035","59.156421","157.240.251.61","192.168.0.10","TCP","129","5222  >  64144 [PSH, ACK] Seq=23936 Ack=2973 Win=3735 Len=75 [TCP segment of a reassembled PDU]"
"1036","59.163833","192.168.0.10","157.240.251.61","TCP","125","64144  >  5222 [PSH, ACK] Seq=3114 Ack=24011 Win=514 Len=71 [TCP segment of a reassembled PDU]"
"1037","59.194964","157.240.251.61","192.168.0.10","TCP","56","5222  >  64144 [ACK] Seq=24011 Ack=3043 Win=3735 Len=0"
"1038","59.237130","157.240.251.61","192.168.0.10","TCP","56","5222  >  64144 [ACK] Seq=24011 Ack=3114 Win=3735 Len=0"
"1040","59.293740","157.240.251.61","192.168.0.10","TCP","56","5222  >  64144 [ACK] Seq=24011 Ack=3185 Win=3735 Len=0"
"1042","59.298267","157.240.251.61","192.168.0.10","TCP","129","5222  >  64144 [PSH, ACK] Seq=24011 Ack=3185 Win=3735 Len=75 [TCP segment of a reassembled PDU]"
"1043","59.304597","192.168.0.10","157.240.251.61","TCP","125","64144  >  5222 [PSH, ACK] Seq=3185 Ack=24086 Win=513 Len=71 [TCP segment of a reassembled PDU]"
"1045","59.504789","157.240.251.61","192.168.0.10","TCP","56","5222  >  64144 [ACK] Seq=24086 Ack=3256 Win=3735 Len=0"
"1056","60.317399","157.240.251.61","192.168.0.10","TCP","129","5222  >  64144 [PSH, ACK] Seq=24086 Ack=3256 Win=3735 Len=75 [TCP segment of a reassembled PDU]"
"1058","60.371113","192.168.0.10","157.240.251.61","TCP","54","64144  >  5222 [ACK] Seq=3256 Ack=24161 Win=513 Len=0"
"1059","60.435306","192.168.0.10","157.240.251.61","TCP","125","64144  >  5222 [PSH, ACK] Seq=3256 Ack=24161 Win=513 Len=71 [TCP segment of a reassembled PDU]"
"1060","60.509072","157.240.251.61","192.168.0.10","TCP","56","5222  >  64144 [ACK] Seq=24161 Ack=3327 Win=3735 Len=0"
"1224","75.581680","157.240.251.61","192.168.0.10","TCP","566","5222  >  64144 [ACK] Seq=24161 Ack=3327 Win=3735 Len=512 [TCP segment of a reassembled PDU]"
"1225","75.586338","157.240.251.61","192.168.0.10","TCP","566","5222  >  64144 [PSH, ACK] Seq=24673 Ack=3327 Win=3735 Len=512 [TCP segment of a reassembled PDU]"
"1226","75.586338","157.240.251.61","192.168.0.10","TCP","393","5222  >  64144 [PSH, ACK] Seq=25185 Ack=3327 Win=3735 Len=339 [TCP segment of a reassembled PDU]"
"1229","75.586880","192.168.0.10","157.240.251.61","TCP","54","64144  >  5222 [ACK] Seq=3327 Ack=25185 Win=516 Len=0"
"1232","75.617397","192.168.0.10","157.240.251.61","TCP","124","64144  >  5222 [PSH, ACK] Seq=3327 Ack=25524 Win=515 Len=70 [TCP segment of a reassembled PDU]"
"1234","75.698458","157.240.251.61","192.168.0.10","TCP","56","5222  >  64144 [ACK] Seq=25524 Ack=3397 Win=3735 Len=0"
"1236","75.844940","157.240.251.61","192.168.0.10","TCP","566","5222  >  64144 [ACK] Seq=25524 Ack=3397 Win=3735 Len=512 [TCP segment of a reassembled PDU]"
"1237","75.844940","157.240.251.61","192.168.0.10","TCP","566","5222  >  64144 [PSH, ACK] Seq=26036 Ack=3397 Win=3735 Len=512 [TCP segment of a reassembled PDU]"
"1238","75.844940","157.240.251.61","192.168.0.10","TCP","457","5222  >  64144 [PSH, ACK] Seq=26548 Ack=3397 Win=3735 Len=403 [TCP segment of a reassembled PDU]"
"1239","75.845759","192.168.0.10","157.240.251.61","TCP","54","64144  >  5222 [ACK] Seq=3397 Ack=26548 Win=511 Len=0"
"1245","75.884459","192.168.0.10","157.240.251.61","TCP","124","64144  >  5222 [PSH, ACK] Seq=3397 Ack=26951 Win=516 Len=70 [TCP segment of a reassembled PDU]"
"1247","75.913026","157.240.251.61","192.168.0.10","TCP","190","5222  >  64144 [PSH, ACK] Seq=26951 Ack=3397 Win=3735 Len=136 [TCP segment of a reassembled PDU]"
"1249","75.936615","192.168.0.10","157.240.251.61","TCP","111","64144  >  5222 [PSH, ACK] Seq=3467 Ack=27087 Win=516 Len=57 [TCP segment of a reassembled PDU]"
"1251","75.954320","157.240.251.61","192.168.0.10","TCP","56","5222  >  64144 [ACK] Seq=27087 Ack=3467 Win=3735 Len=0"
"1253","76.024066","157.240.251.61","192.168.0.10","TCP","56","5222  >  64144 [ACK] Seq=27087 Ack=3524 Win=3735 Len=0"
"1257","76.086983","157.240.251.61","192.168.0.10","TCP","566","5222  >  64144 [ACK] Seq=27087 Ack=3524 Win=3735 Len=512 [TCP segment of a reassembled PDU]"
"1258","76.086983","157.240.251.61","192.168.0.10","TCP","566","5222  >  64144 [PSH, ACK] Seq=27599 Ack=3524 Win=3735 Len=512 [TCP segment of a reassembled PDU]"
"1259","76.086983","157.240.251.61","192.168.0.10","XMPP/XML","425","UNKNOWN PACKET "
"1263","76.087622","192.168.0.10","157.240.251.61","TCP","54","64144  >  5222 [ACK] Seq=3524 Ack=28111 Win=512 Len=0"
"1266","76.121890","192.168.0.10","157.240.251.61","TCP","124","64144  >  5222 [PSH, ACK] Seq=3524 Ack=28482 Win=516 Len=70 [TCP segment of a reassembled PDU]"
"1268","76.190676","157.240.251.61","192.168.0.10","TCP","56","5222  >  64144 [ACK] Seq=28482 Ack=3594 Win=3735 Len=0"
"1271","76.345310","157.240.251.61","192.168.0.10","TCP","566","5222  >  64144 [ACK] Seq=28482 Ack=3594 Win=3735 Len=512 [TCP segment of a reassembled PDU]"
"1272","76.345310","157.240.251.61","192.168.0.10","TCP","566","5222  >  64144 [PSH, ACK] Seq=28994 Ack=3594 Win=3735 Len=512 [TCP segment of a reassembled PDU]"
"1273","76.346360","192.168.0.10","157.240.251.61","TCP","54","64144  >  5222 [ACK] Seq=3594 Ack=29506 Win=512 Len=0"
"1274","76.348051","157.240.251.61","192.168.0.10","TCP","521","5222  >  64144 [PSH, ACK] Seq=29506 Ack=3594 Win=3735 Len=467 [TCP segment of a reassembled PDU]"
"1283","76.376040","192.168.0.10","157.240.251.61","TCP","124","64144  >  5222 [PSH, ACK] Seq=3594 Ack=29973 Win=516 Len=70 [TCP segment of a reassembled PDU]"
"1286","76.448969","157.240.251.61","192.168.0.10","TCP","56","5222  >  64144 [ACK] Seq=29973 Ack=3664 Win=3735 Len=0"
"1297","77.423218","157.240.251.61","192.168.0.10","TCP","129","5222  >  64144 [PSH, ACK] Seq=29973 Ack=3664 Win=3735 Len=75 [TCP segment of a reassembled PDU]"
"1298","77.423218","157.240.251.61","192.168.0.10","TCP","129","5222  >  64144 [PSH, ACK] Seq=30048 Ack=3664 Win=3735 Len=75 [TCP segment of a reassembled PDU]"
"1299","77.424317","192.168.0.10","157.240.251.61","TCP","54","64144  >  5222 [ACK] Seq=3664 Ack=30123 Win=515 Len=0"
"1300","77.434998","192.168.0.10","157.240.251.61","TCP","125","64144  >  5222 [PSH, ACK] Seq=3664 Ack=30123 Win=515 Len=71 [TCP segment of a reassembled PDU]"
"1301","77.441382","192.168.0.10","157.240.251.61","TCP","125","64144  >  5222 [PSH, ACK] Seq=3735 Ack=30123 Win=515 Len=71 [TCP segment of a reassembled PDU]"
"1302","77.509063","157.240.251.61","192.168.0.10","TCP","56","5222  >  64144 [ACK] Seq=30123 Ack=3735 Win=3735 Len=0"
"1303","77.511000","157.240.251.61","192.168.0.10","TCP","56","5222  >  64144 [ACK] Seq=30123 Ack=3806 Win=3735 Len=0"
"1304","77.525057","157.240.251.61","192.168.0.10","TCP","129","5222  >  64144 [PSH, ACK] Seq=30123 Ack=3806 Win=3735 Len=75 [TCP segment of a reassembled PDU]"
"1305","77.574038","192.168.0.10","157.240.251.61","TCP","54","64144  >  5222 [ACK] Seq=3806 Ack=30198 Win=515 Len=0"
"1306","77.615135","157.240.251.61","192.168.0.10","TCP","129","5222  >  64144 [PSH, ACK] Seq=30198 Ack=3806 Win=3735 Len=75 [TCP segment of a reassembled PDU]"
"1307","77.643012","192.168.0.10","157.240.251.61","TCP","125","64144  >  5222 [PSH, ACK] Seq=3806 Ack=30273 Win=515 Len=71 [TCP segment of a reassembled PDU]"
"1308","77.648647","192.168.0.10","157.240.251.61","TCP","125","64144  >  5222 [PSH, ACK] Seq=3877 Ack=30273 Win=515 Len=71 [TCP segment of a reassembled PDU]"
"1312","77.727280","157.240.251.61","192.168.0.10","TCP","56","5222  >  64144 [ACK] Seq=30273 Ack=3948 Win=3735 Len=0"
