"No.","Time","Source","Destination","Protocol","Length","Info"
"102","5.946282","157.240.251.61","192.168.0.10","TCP","566","5222  >  64144 [ACK] Seq=1 Ack=1 Win=3725 Len=512 [TCP segment of a reassembled PDU]"
"103","5.946282","157.240.251.61","192.168.0.10","TCP","233","5222  >  64144 [PSH, ACK] Seq=513 Ack=1 Win=3725 Len=179 [TCP segment of a reassembled PDU]"
"106","5.947070","192.168.0.10","157.240.251.61","TCP","54","64144  >  5222 [ACK] Seq=1 Ack=692 Win=516 Len=0"
"108","5.999946","192.168.0.10","157.240.251.61","TCP","124","64144  >  5222 [PSH, ACK] Seq=1 Ack=692 Win=516 Len=70 [TCP segment of a reassembled PDU]"
"110","6.074788","157.240.251.61","192.168.0.10","TCP","56","5222  >  64144 [ACK] Seq=692 Ack=71 Win=3725 Len=0"
"114","6.216687","192.168.0.10","157.240.251.61","TCP","94","64144  >  5222 [PSH, ACK] Seq=71 Ack=692 Win=516 Len=40 [TCP segment of a reassembled PDU]"
"116","6.296232","157.240.251.61","192.168.0.10","TCP","56","5222  >  64144 [ACK] Seq=692 Ack=111 Win=3725 Len=0"
"117","6.424809","157.240.251.61","192.168.0.10","TCP","566","5222  >  64144 [ACK] Seq=692 Ack=111 Win=3725 Len=512 [TCP segment of a reassembled PDU]"
"118","6.424809","157.240.251.61","192.168.0.10","TCP","527","5222  >  64144 [PSH, ACK] Seq=1204 Ack=111 Win=3725 Len=473 [TCP segment of a reassembled PDU]"
"119","6.425199","192.168.0.10","157.240.251.61","TCP","54","64144  >  5222 [ACK] Seq=111 Ack=1677 Win=512 Len=0"
"310","9.477852","157.240.251.61","192.168.0.10","TCP","129","5222  >  64144 [PSH, ACK] Seq=1677 Ack=111 Win=3725 Len=75 [TCP segment of a reassembled PDU]"
"311","9.484246","192.168.0.10","157.240.251.61","TCP","125","64144  >  5222 [PSH, ACK] Seq=111 Ack=1752 Win=512 Len=71 [TCP segment of a reassembled PDU]"
"312","9.570919","157.240.251.61","192.168.0.10","TCP","56","5222  >  64144 [ACK] Seq=1752 Ack=182 Win=3725 Len=0"
"361","12.888563","157.240.251.61","192.168.0.10","TCP","566","5222  >  64144 [ACK] Seq=1752 Ack=182 Win=3725 Len=512 [TCP segment of a reassembled PDU]"
"362","12.890990","157.240.251.61","192.168.0.10","TCP","233","5222  >  64144 [PSH, ACK] Seq=2264 Ack=182 Win=3725 Len=179 [TCP segment of a reassembled PDU]"
"365","12.891195","192.168.0.10","157.240.251.61","TCP","54","64144  >  5222 [ACK] Seq=182 Ack=2443 Win=516 Len=0"
"368","12.918734","192.168.0.10","157.240.251.61","TCP","124","64144  >  5222 [PSH, ACK] Seq=182 Ack=2443 Win=516 Len=70 [TCP segment of a reassembled PDU]"
"369","12.992923","157.240.251.61","192.168.0.10","TCP","56","5222  >  64144 [ACK] Seq=2443 Ack=252 Win=3725 Len=0"
"449","16.170647","157.240.251.61","192.168.0.10","TCP","129","5222  >  64144 [PSH, ACK] Seq=2443 Ack=252 Win=3725 Len=75 [TCP segment of a reassembled PDU]"
"450","16.180207","192.168.0.10","157.240.251.61","TCP","125","64144  >  5222 [PSH, ACK] Seq=252 Ack=2518 Win=516 Len=71 [TCP segment of a reassembled PDU]"
"454","16.254499","157.240.251.61","192.168.0.10","TCP","56","5222  >  64144 [ACK] Seq=2518 Ack=323 Win=3725 Len=0"
"513","20.854247","157.240.251.61","192.168.0.10","TCP","566","5222  >  64144 [ACK] Seq=2518 Ack=323 Win=3725 Len=512 [TCP segment of a reassembled PDU]"
"514","20.855707","157.240.251.61","192.168.0.10","TCP","233","5222  >  64144 [PSH, ACK] Seq=3030 Ack=323 Win=3725 Len=179 [TCP segment of a reassembled PDU]"
"516","20.855927","192.168.0.10","157.240.251.61","TCP","54","64144  >  5222 [ACK] Seq=323 Ack=3209 Win=513 Len=0"
"519","20.886165","192.168.0.10","157.240.251.61","TCP","124","64144  >  5222 [PSH, ACK] Seq=323 Ack=3209 Win=513 Len=70 [TCP segment of a reassembled PDU]"
"520","20.958714","157.240.251.61","192.168.0.10","TCP","56","5222  >  64144 [ACK] Seq=3209 Ack=393 Win=3725 Len=0"
"611","24.155669","157.240.251.61","192.168.0.10","TCP","129","5222  >  64144 [PSH, ACK] Seq=3209 Ack=393 Win=3725 Len=75 [TCP segment of a reassembled PDU]"
"612","24.161996","192.168.0.10","157.240.251.61","TCP","125","64144  >  5222 [PSH, ACK] Seq=393 Ack=3284 Win=513 Len=71 [TCP segment of a reassembled PDU]"
"615","24.232739","157.240.251.61","192.168.0.10","TCP","56","5222  >  64144 [ACK] Seq=3284 Ack=464 Win=3725 Len=0"
"668","28.605497","157.240.251.61","192.168.0.10","TCP","566","5222  >  64144 [ACK] Seq=3284 Ack=464 Win=3725 Len=512 [TCP segment of a reassembled PDU]"
"669","28.607262","157.240.251.61","192.168.0.10","TCP","233","5222  >  64144 [PSH, ACK] Seq=3796 Ack=464 Win=3725 Len=179 [TCP segment of a reassembled PDU]"
"672","28.607587","192.168.0.10","157.240.251.61","TCP","54","64144  >  5222 [ACK] Seq=464 Ack=3975 Win=516 Len=0"
"674","28.639955","192.168.0.10","157.240.251.61","TCP","124","64144  >  5222 [PSH, ACK] Seq=464 Ack=3975 Win=516 Len=70 [TCP segment of a reassembled PDU]"
"675","28.711156","157.240.251.61","192.168.0.10","TCP","56","5222  >  64144 [ACK] Seq=3975 Ack=534 Win=3725 Len=0"
"792","31.974088","157.240.251.61","192.168.0.10","TCP","129","5222  >  64144 [PSH, ACK] Seq=3975 Ack=534 Win=3725 Len=75 [TCP segment of a reassembled PDU]"
"793","31.979332","192.168.0.10","157.240.251.61","TCP","125","64144  >  5222 [PSH, ACK] Seq=534 Ack=4050 Win=516 Len=71 [TCP segment of a reassembled PDU]"
"794","32.050890","157.240.251.61","192.168.0.10","TCP","56","5222  >  64144 [ACK] Seq=4050 Ack=605 Win=3725 Len=0"
"888","37.560950","157.240.251.61","192.168.0.10","TCP","566","5222  >  64144 [ACK] Seq=4050 Ack=605 Win=3725 Len=512 [TCP segment of a reassembled PDU]"
"889","37.562239","157.240.251.61","192.168.0.10","TCP","233","5222  >  64144 [PSH, ACK] Seq=4562 Ack=605 Win=3725 Len=179 [TCP segment of a reassembled PDU]"
"890","37.562481","192.168.0.10","157.240.251.61","TCP","54","64144  >  5222 [ACK] Seq=605 Ack=4741 Win=513 Len=0"
"894","37.595354","192.168.0.10","157.240.251.61","TCP","124","64144  >  5222 [PSH, ACK] Seq=605 Ack=4741 Win=513 Len=70 [TCP segment of a reassembled PDU]"
"901","37.681160","157.240.251.61","192.168.0.10","TCP","56","5222  >  64144 [ACK] Seq=4741 Ack=675 Win=3725 Len=0"
"1009","41.068480","157.240.251.61","192.168.0.10","TCP","129","5222  >  64144 [PSH, ACK] Seq=4741 Ack=675 Win=3725 Len=75 [TCP segment of a reassembled PDU]"
"1011","41.075966","192.168.0.10","157.240.251.61","TCP","125","64144  >  5222 [PSH, ACK] Seq=675 Ack=4816 Win=513 Len=71 [TCP segment of a reassembled PDU]"
"1013","41.147674","157.240.251.61","192.168.0.10","TCP","56","5222  >  64144 [ACK] Seq=4816 Ack=746 Win=3725 Len=0"
"1142","49.935590","157.240.251.61","192.168.0.10","TCP","566","5222  >  64144 [ACK] Seq=4816 Ack=746 Win=3725 Len=512 [TCP segment of a reassembled PDU]"
"1143","49.937525","157.240.251.61","192.168.0.10","TCP","233","5222  >  64144 [PSH, ACK] Seq=5328 Ack=746 Win=3725 Len=179 [TCP segment of a reassembled PDU]"
"1146","49.937525","157.240.251.61","192.168.0.10","TCP","233","[TCP Retransmission] 5222  >  64144 [PSH, ACK] Seq=5328 Ack=746 Win=3725 Len=179"
"1148","49.937525","157.240.251.61","192.168.0.10","TCP","566","[TCP Out-Of-Order] 5222  >  64144 [ACK] Seq=4816 Ack=746 Win=3725 Len=512 [TCP segment of a reassembled PDU]"
"1149","49.937807","192.168.0.10","157.240.251.61","TCP","54","64144  >  5222 [ACK] Seq=746 Ack=5507 Win=516 Len=0"
"1150","49.937915","192.168.0.10","157.240.251.61","TCP","66","[TCP Dup ACK 1149#1] 64144  >  5222 [ACK] Seq=746 Ack=5507 Win=516 Len=0 SLE=5328 SRE=5507"
"1151","49.938000","192.168.0.10","157.240.251.61","TCP","66","[TCP Dup ACK 1149#2] 64144  >  5222 [ACK] Seq=746 Ack=5507 Win=516 Len=0 SLE=4816 SRE=5328"
"1156","49.976567","192.168.0.10","157.240.251.61","TCP","124","64144  >  5222 [PSH, ACK] Seq=746 Ack=5507 Win=516 Len=70 [TCP segment of a reassembled PDU]"
"1157","50.045802","157.240.251.61","192.168.0.10","TCP","56","5222  >  64144 [ACK] Seq=5507 Ack=816 Win=3725 Len=0"
"1271","53.179224","157.240.251.61","192.168.0.10","TCP","129","5222  >  64144 [PSH, ACK] Seq=5507 Ack=816 Win=3725 Len=75 [TCP segment of a reassembled PDU]"
"1272","53.184678","192.168.0.10","157.240.251.61","TCP","125","64144  >  5222 [PSH, ACK] Seq=816 Ack=5582 Win=516 Len=71 [TCP segment of a reassembled PDU]"
"1273","53.260890","157.240.251.61","192.168.0.10","TCP","56","5222  >  64144 [ACK] Seq=5582 Ack=887 Win=3725 Len=0"
"1352","55.738784","157.240.251.61","192.168.0.10","TCP","566","5222  >  64144 [ACK] Seq=5582 Ack=887 Win=3725 Len=512 [TCP segment of a reassembled PDU]"
"1353","55.740419","157.240.251.61","192.168.0.10","TCP","217","5222  >  64144 [PSH, ACK] Seq=6094 Ack=887 Win=3725 Len=163 [TCP segment of a reassembled PDU]"
"1355","55.740689","192.168.0.10","157.240.251.61","TCP","54","64144  >  5222 [ACK] Seq=887 Ack=6257 Win=513 Len=0"
"1358","55.770177","192.168.0.10","157.240.251.61","TCP","124","64144  >  5222 [PSH, ACK] Seq=887 Ack=6257 Win=513 Len=70 [TCP segment of a reassembled PDU]"
"1363","55.865832","157.240.251.61","192.168.0.10","TCP","56","5222  >  64144 [ACK] Seq=6257 Ack=957 Win=3725 Len=0"
"1423","57.089227","157.240.251.61","192.168.0.10","TCP","129","5222  >  64144 [PSH, ACK] Seq=6257 Ack=957 Win=3725 Len=75 [TCP segment of a reassembled PDU]"
"1424","57.094312","192.168.0.10","157.240.251.61","TCP","125","64144  >  5222 [PSH, ACK] Seq=957 Ack=6332 Win=513 Len=71 [TCP segment of a reassembled PDU]"
"1429","57.178549","157.240.251.61","192.168.0.10","TCP","56","5222  >  64144 [ACK] Seq=6332 Ack=1028 Win=3725 Len=0"
"1610","70.957857","157.240.251.61","192.168.0.10","TCP","566","5222  >  64144 [ACK] Seq=6332 Ack=1028 Win=3725 Len=512 [TCP segment of a reassembled PDU]"
"1611","70.957857","157.240.251.61","192.168.0.10","TCP","233","5222  >  64144 [PSH, ACK] Seq=6844 Ack=1028 Win=3725 Len=179 [TCP segment of a reassembled PDU]"
"1612","70.958256","192.168.0.10","157.240.251.61","TCP","54","64144  >  5222 [ACK] Seq=1028 Ack=7023 Win=516 Len=0"
"1616","70.997407","192.168.0.10","157.240.251.61","TCP","124","64144  >  5222 [PSH, ACK] Seq=1028 Ack=7023 Win=516 Len=70 [TCP segment of a reassembled PDU]"
"1617","71.090375","157.240.251.61","192.168.0.10","TCP","56","5222  >  64144 [ACK] Seq=7023 Ack=1098 Win=3725 Len=0"
"1747","74.356031","157.240.251.61","192.168.0.10","TCP","129","5222  >  64144 [PSH, ACK] Seq=7023 Ack=1098 Win=3725 Len=75 [TCP segment of a reassembled PDU]"
"1749","74.361249","192.168.0.10","157.240.251.61","TCP","125","64144  >  5222 [PSH, ACK] Seq=1098 Ack=7098 Win=516 Len=71 [TCP segment of a reassembled PDU]"
"1753","74.433327","157.240.251.61","192.168.0.10","TCP","56","5222  >  64144 [ACK] Seq=7098 Ack=1169 Win=3725 Len=0"
"1797","77.954767","157.240.251.61","192.168.0.10","TCP","566","5222  >  64144 [ACK] Seq=7098 Ack=1169 Win=3725 Len=512 [TCP segment of a reassembled PDU]"
"1798","77.956210","157.240.251.61","192.168.0.10","TCP","233","5222  >  64144 [PSH, ACK] Seq=7610 Ack=1169 Win=3725 Len=179 [TCP segment of a reassembled PDU]"
"1800","77.956548","192.168.0.10","157.240.251.61","TCP","54","64144  >  5222 [ACK] Seq=1169 Ack=7789 Win=513 Len=0"
"1804","77.986490","192.168.0.10","157.240.251.61","TCP","124","64144  >  5222 [PSH, ACK] Seq=1169 Ack=7789 Win=513 Len=70 [TCP segment of a reassembled PDU]"
"1806","78.068744","157.240.251.61","192.168.0.10","TCP","56","5222  >  64144 [ACK] Seq=7789 Ack=1239 Win=3725 Len=0"
"1891","81.311776","157.240.251.61","192.168.0.10","TCP","129","5222  >  64144 [PSH, ACK] Seq=7789 Ack=1239 Win=3725 Len=75 [TCP segment of a reassembled PDU]"
"1892","81.318162","192.168.0.10","157.240.251.61","TCP","125","64144  >  5222 [PSH, ACK] Seq=1239 Ack=7864 Win=513 Len=71 [TCP segment of a reassembled PDU]"
"1893","81.388472","157.240.251.61","192.168.0.10","TCP","56","5222  >  64144 [ACK] Seq=7864 Ack=1310 Win=3725 Len=0"
"2394","84.149693","157.240.251.61","192.168.0.10","TCP","566","5222  >  64144 [ACK] Seq=7864 Ack=1310 Win=3725 Len=512 [TCP segment of a reassembled PDU]"
"2395","84.149693","157.240.251.61","192.168.0.10","XMPP/XML","233","UNKNOWN PACKET "
"2408","84.150835","192.168.0.10","157.240.251.61","TCP","54","64144  >  5222 [ACK] Seq=1310 Ack=8555 Win=516 Len=0"
"2429","84.186836","192.168.0.10","157.240.251.61","TCP","124","64144  >  5222 [PSH, ACK] Seq=1310 Ack=8555 Win=516 Len=70 [TCP segment of a reassembled PDU]"
"2430","84.194977","157.240.251.61","192.168.0.10","TCP","233","[TCP Spurious Retransmission] 5222  >  64144 [PSH, ACK] Seq=8376 Ack=1310 Win=3725 Len=179"
"2431","84.195447","192.168.0.10","157.240.251.61","TCP","66","[TCP Dup ACK 2408#1] 64144  >  5222 [ACK] Seq=1380 Ack=8555 Win=516 Len=0 SLE=8376 SRE=8555"
"2435","84.257766","157.240.251.61","192.168.0.10","TCP","56","5222  >  64144 [ACK] Seq=8555 Ack=1380 Win=3725 Len=0"
"2437","84.344034","157.240.251.61","192.168.0.10","TCP","129","5222  >  64144 [PSH, ACK] Seq=8555 Ack=1380 Win=3725 Len=75 [TCP segment of a reassembled PDU]"
"2439","84.401011","192.168.0.10","157.240.251.61","TCP","54","64144  >  5222 [ACK] Seq=1380 Ack=8630 Win=516 Len=0"
"2448","84.558646","192.168.0.10","157.240.251.61","TCP","125","64144  >  5222 [PSH, ACK] Seq=1380 Ack=8630 Win=516 Len=71 [TCP segment of a reassembled PDU]"
"2454","84.665466","157.240.251.61","192.168.0.10","TCP","56","5222  >  64144 [ACK] Seq=8630 Ack=1451 Win=3725 Len=0"
"10668","100.682746","157.240.251.61","192.168.0.10","TCP","566","5222  >  64144 [ACK] Seq=8630 Ack=1451 Win=3725 Len=512 [TCP segment of a reassembled PDU]"
"10669","100.682746","157.240.251.61","192.168.0.10","TCP","233","5222  >  64144 [PSH, ACK] Seq=9142 Ack=1451 Win=3725 Len=179 [TCP segment of a reassembled PDU]"
"10672","100.683957","192.168.0.10","157.240.251.61","TCP","54","64144  >  5222 [ACK] Seq=1451 Ack=9321 Win=513 Len=0"
"10674","100.717216","192.168.0.10","157.240.251.61","TCP","124","64144  >  5222 [PSH, ACK] Seq=1451 Ack=9321 Win=513 Len=70 [TCP segment of a reassembled PDU]"
"10675","100.790061","157.240.251.61","192.168.0.10","TCP","56","5222  >  64144 [ACK] Seq=9321 Ack=1521 Win=3725 Len=0"
"10780","104.013737","157.240.251.61","192.168.0.10","TCP","129","5222  >  64144 [PSH, ACK] Seq=9321 Ack=1521 Win=3725 Len=75 [TCP segment of a reassembled PDU]"
"10781","104.020328","192.168.0.10","157.240.251.61","TCP","125","64144  >  5222 [PSH, ACK] Seq=1521 Ack=9396 Win=513 Len=71 [TCP segment of a reassembled PDU]"
"10782","104.100315","157.240.251.61","192.168.0.10","TCP","56","5222  >  64144 [ACK] Seq=9396 Ack=1592 Win=3725 Len=0"
"10812","106.776822","157.240.251.61","192.168.0.10","TCP","566","5222  >  64144 [ACK] Seq=9396 Ack=1592 Win=3725 Len=512 [TCP segment of a reassembled PDU]"
"10813","106.776974","157.240.251.61","192.168.0.10","TCP","217","5222  >  64144 [PSH, ACK] Seq=9908 Ack=1592 Win=3725 Len=163 [TCP segment of a reassembled PDU]"
"10814","106.777366","192.168.0.10","157.240.251.61","TCP","54","64144  >  5222 [ACK] Seq=1592 Ack=10071 Win=516 Len=0"
"10816","106.812688","192.168.0.10","157.240.251.61","TCP","124","64144  >  5222 [PSH, ACK] Seq=1592 Ack=10071 Win=516 Len=70 [TCP segment of a reassembled PDU]"
"10817","106.885033","157.240.251.61","192.168.0.10","TCP","56","5222  >  64144 [ACK] Seq=10071 Ack=1662 Win=3725 Len=0"
"10823","107.064369","157.240.251.61","192.168.0.10","TCP","129","5222  >  64144 [PSH, ACK] Seq=10071 Ack=1662 Win=3725 Len=75 [TCP segment of a reassembled PDU]"
"10824","107.110140","192.168.0.10","157.240.251.61","TCP","125","64144  >  5222 [PSH, ACK] Seq=1662 Ack=10146 Win=516 Len=71 [TCP segment of a reassembled PDU]"
"10843","107.192331","157.240.251.61","192.168.0.10","TCP","56","5222  >  64144 [ACK] Seq=10146 Ack=1733 Win=3725 Len=0"
"10927","112.979106","157.240.251.61","192.168.0.10","TCP","566","5222  >  64144 [ACK] Seq=10146 Ack=1733 Win=3725 Len=512 [TCP segment of a reassembled PDU]"
"10928","112.981515","157.240.251.61","192.168.0.10","TCP","233","5222  >  64144 [PSH, ACK] Seq=10658 Ack=1733 Win=3725 Len=179 [TCP segment of a reassembled PDU]"
"10929","112.981685","192.168.0.10","157.240.251.61","TCP","54","64144  >  5222 [ACK] Seq=1733 Ack=10837 Win=513 Len=0"
"10934","113.012834","192.168.0.10","157.240.251.61","TCP","124","64144  >  5222 [PSH, ACK] Seq=1733 Ack=10837 Win=513 Len=70 [TCP segment of a reassembled PDU]"
"10936","113.058019","157.240.251.61","192.168.0.10","TCP","233","[TCP Spurious Retransmission] 5222  >  64144 [PSH, ACK] Seq=10658 Ack=1733 Win=3725 Len=179"
"10937","113.058715","192.168.0.10","157.240.251.61","TCP","66","[TCP Dup ACK 10929#1] 64144  >  5222 [ACK] Seq=1803 Ack=10837 Win=513 Len=0 SLE=10658 SRE=10837"
"10938","113.084382","157.240.251.61","192.168.0.10","TCP","56","5222  >  64144 [ACK] Seq=10837 Ack=1803 Win=3725 Len=0"
