"No.","Time","Source","Destination","Protocol","Length","Info"
"13","0.667068","192.168.0.10","157.240.251.61","TCP","79","64144  >  5222 [PSH, ACK] Seq=1 Ack=1 Win=515 Len=25 [TCP segment of a reassembled PDU]"
"14","0.748218","157.240.251.61","192.168.0.10","TCP","56","5222  >  64144 [ACK] Seq=1 Ack=26 Win=3735 Len=0"
"153","10.804394","192.168.0.10","157.240.251.61","TCP","101","64144  >  5222 [PSH, ACK] Seq=26 Ack=1 Win=515 Len=47 [TCP segment of a reassembled PDU]"
"158","10.880764","157.240.251.61","192.168.0.10","TCP","56","5222  >  64144 [ACK] Seq=1 Ack=73 Win=3735 Len=0"
"162","11.661994","192.168.0.10","157.240.251.61","TCP","93","64144  >  5222 [PSH, ACK] Seq=73 Ack=1 Win=515 Len=39 [TCP segment of a reassembled PDU]"
"164","11.738791","157.240.251.61","192.168.0.10","TCP","56","5222  >  64144 [ACK] Seq=1 Ack=112 Win=3735 Len=0"
"165","11.872796","157.240.251.61","192.168.0.10","TCP","566","5222  >  64144 [ACK] Seq=1 Ack=112 Win=3735 Len=512 [TCP segment of a reassembled PDU]"
"166","11.872796","157.240.251.61","192.168.0.10","TCP","527","5222  >  64144 [PSH, ACK] Seq=513 Ack=112 Win=3735 Len=473 [TCP segment of a reassembled PDU]"
"167","11.873274","192.168.0.10","157.240.251.61","TCP","54","64144  >  5222 [ACK] Seq=112 Ack=986 Win=512 Len=0"
"1266","15.575784","192.168.0.10","157.240.251.61","TCP","1446","64144  >  5222 [ACK] Seq=112 Ack=986 Win=512 Len=1392 [TCP segment of a reassembled PDU]"
"1267","15.575784","192.168.0.10","157.240.251.61","TCP","1446","64144  >  5222 [ACK] Seq=1504 Ack=986 Win=512 Len=1392 [TCP segment of a reassembled PDU]"
"1268","15.575784","192.168.0.10","157.240.251.61","TCP","1446","64144  >  5222 [ACK] Seq=2896 Ack=986 Win=512 Len=1392 [TCP segment of a reassembled PDU]"
"1269","15.575784","192.168.0.10","157.240.251.61","TCP","596","64144  >  5222 [PSH, ACK] Seq=4288 Ack=986 Win=512 Len=542 [TCP segment of a reassembled PDU]"
"1272","15.629692","192.168.0.10","157.240.251.61","TCP","1446","64144  >  5222 [ACK] Seq=4830 Ack=986 Win=512 Len=1392 [TCP segment of a reassembled PDU]"
"1273","15.629692","192.168.0.10","157.240.251.61","TCP","1446","64144  >  5222 [ACK] Seq=6222 Ack=986 Win=512 Len=1392 [TCP segment of a reassembled PDU]"
"1274","15.629692","192.168.0.10","157.240.251.61","TCP","324","64144  >  5222 [PSH, ACK] Seq=7614 Ack=986 Win=512 Len=270 [TCP segment of a reassembled PDU]"
"1276","15.660123","157.240.251.61","192.168.0.10","TCP","56","5222  >  64144 [ACK] Seq=986 Ack=1504 Win=3746 Len=0"
"1277","15.660123","157.240.251.61","192.168.0.10","TCP","56","5222  >  64144 [ACK] Seq=986 Ack=4288 Win=3768 Len=0"
"1278","15.660123","157.240.251.61","192.168.0.10","TCP","56","5222  >  64144 [ACK] Seq=986 Ack=4830 Win=3768 Len=0"
"1279","15.762304","157.240.251.61","192.168.0.10","TCP","56","5222  >  64144 [ACK] Seq=986 Ack=6222 Win=3779 Len=0"
"1280","15.762304","157.240.251.61","192.168.0.10","TCP","56","5222  >  64144 [ACK] Seq=986 Ack=7614 Win=3790 Len=0"
"1281","15.762304","157.240.251.61","192.168.0.10","TCP","56","5222  >  64144 [ACK] Seq=986 Ack=7884 Win=3790 Len=0"
"1311","15.769223","192.168.0.10","157.240.251.61","TCP","1446","64144  >  5222 [ACK] Seq=7884 Ack=986 Win=512 Len=1392 [TCP segment of a reassembled PDU]"
"1312","15.769223","192.168.0.10","157.240.251.61","TCP","1446","64144  >  5222 [ACK] Seq=9276 Ack=986 Win=512 Len=1392 [TCP segment of a reassembled PDU]"
"1313","15.769223","192.168.0.10","157.240.251.61","TCP","1446","64144  >  5222 [ACK] Seq=10668 Ack=986 Win=512 Len=1392 [TCP segment of a reassembled PDU]"
"1314","15.769223","192.168.0.10","157.240.251.61","TCP","564","64144  >  5222 [PSH, ACK] Seq=12060 Ack=986 Win=512 Len=510 [TCP segment of a reassembled PDU]"
"1318","15.867705","157.240.251.61","192.168.0.10","TCP","139","5222  >  64144 [PSH, ACK] Seq=986 Ack=7884 Win=3790 Len=85 [TCP segment of a reassembled PDU]"
"1336","15.868186","157.240.251.61","192.168.0.10","TCP","56","5222  >  64144 [ACK] Seq=1071 Ack=9276 Win=3801 Len=0"
"1345","15.897762","157.240.251.61","192.168.0.10","TCP","56","5222  >  64144 [ACK] Seq=1071 Ack=10668 Win=3812 Len=0"
"1346","15.912813","192.168.0.10","157.240.251.61","TCP","54","64144  >  5222 [ACK] Seq=12570 Ack=1071 Win=511 Len=0"
"1349","15.974783","157.240.251.61","192.168.0.10","TCP","56","5222  >  64144 [ACK] Seq=1071 Ack=12060 Win=3822 Len=0"
"1350","15.974783","157.240.251.61","192.168.0.10","TCP","56","5222  >  64144 [ACK] Seq=1071 Ack=12570 Win=3822 Len=0"
"1377","15.975218","157.240.251.61","192.168.0.10","TCP","139","5222  >  64144 [PSH, ACK] Seq=1071 Ack=12570 Win=3822 Len=85 [TCP segment of a reassembled PDU]"
"1398","16.023613","192.168.0.10","157.240.251.61","TCP","54","64144  >  5222 [ACK] Seq=12570 Ack=1156 Win=511 Len=0"
"1433","16.107211","157.240.251.61","192.168.0.10","TCP","139","5222  >  64144 [PSH, ACK] Seq=1156 Ack=12570 Win=3822 Len=85 [TCP segment of a reassembled PDU]"
"1445","16.150716","192.168.0.10","157.240.251.61","TCP","54","64144  >  5222 [ACK] Seq=12570 Ack=1241 Win=516 Len=0"
"1477","16.273035","157.240.251.61","192.168.0.10","TCP","126","5222  >  64144 [PSH, ACK] Seq=1241 Ack=12570 Win=3822 Len=72 [TCP segment of a reassembled PDU]"
"1490","16.274481","192.168.0.10","157.240.251.61","TCP","120","64144  >  5222 [PSH, ACK] Seq=12570 Ack=1313 Win=516 Len=66 [TCP segment of a reassembled PDU]"
"1495","16.296599","157.240.251.61","192.168.0.10","TCP","126","5222  >  64144 [PSH, ACK] Seq=1313 Ack=12570 Win=3822 Len=72 [TCP segment of a reassembled PDU]"
"1496","16.298144","192.168.0.10","157.240.251.61","TCP","120","64144  >  5222 [PSH, ACK] Seq=12636 Ack=1385 Win=516 Len=66 [TCP segment of a reassembled PDU]"
"1524","16.384936","157.240.251.61","192.168.0.10","TCP","56","5222  >  64144 [ACK] Seq=1385 Ack=12636 Win=3822 Len=0"
"1535","16.385509","157.240.251.61","192.168.0.10","TCP","56","5222  >  64144 [ACK] Seq=1385 Ack=12702 Win=3822 Len=0"
"1536","16.390323","157.240.251.61","192.168.0.10","TCP","126","5222  >  64144 [PSH, ACK] Seq=1385 Ack=12702 Win=3822 Len=72 [TCP segment of a reassembled PDU]"
"1537","16.391709","192.168.0.10","157.240.251.61","TCP","120","64144  >  5222 [PSH, ACK] Seq=12702 Ack=1457 Win=515 Len=66 [TCP segment of a reassembled PDU]"
"1576","16.579433","157.240.251.61","192.168.0.10","TCP","56","5222  >  64144 [ACK] Seq=1457 Ack=12768 Win=3822 Len=0"
"2012","18.021718","157.240.251.61","192.168.0.10","TCP","122","5222  >  64144 [PSH, ACK] Seq=1457 Ack=12768 Win=3822 Len=68 [TCP segment of a reassembled PDU]"
"2015","18.021718","157.240.251.61","192.168.0.10","TCP","122","5222  >  64144 [PSH, ACK] Seq=1525 Ack=12768 Win=3822 Len=68 [TCP segment of a reassembled PDU]"
"2026","18.022108","192.168.0.10","157.240.251.61","TCP","54","64144  >  5222 [ACK] Seq=12768 Ack=1593 Win=515 Len=0"
"2037","18.024402","192.168.0.10","157.240.251.61","TCP","118","64144  >  5222 [PSH, ACK] Seq=12768 Ack=1593 Win=515 Len=64 [TCP segment of a reassembled PDU]"
"2038","18.025540","192.168.0.10","157.240.251.61","TCP","118","64144  >  5222 [PSH, ACK] Seq=12832 Ack=1593 Win=515 Len=64 [TCP segment of a reassembled PDU]"
"2065","18.105562","157.240.251.61","192.168.0.10","TCP","122","5222  >  64144 [PSH, ACK] Seq=1593 Ack=12768 Win=3822 Len=68 [TCP segment of a reassembled PDU]"
"2066","18.107991","192.168.0.10","157.240.251.61","TCP","118","64144  >  5222 [PSH, ACK] Seq=12896 Ack=1661 Win=514 Len=64 [TCP segment of a reassembled PDU]"
"2068","18.111466","157.240.251.61","192.168.0.10","TCP","56","5222  >  64144 [ACK] Seq=1661 Ack=12832 Win=3822 Len=0"
"2069","18.111466","157.240.251.61","192.168.0.10","TCP","56","5222  >  64144 [ACK] Seq=1661 Ack=12896 Win=3822 Len=0"
"2081","18.204642","157.240.251.61","192.168.0.10","TCP","56","5222  >  64144 [ACK] Seq=1661 Ack=12960 Win=3822 Len=0"
"4612","27.799253","192.168.0.10","157.240.251.61","TCP","1446","64144  >  5222 [ACK] Seq=12960 Ack=1661 Win=514 Len=1392 [TCP segment of a reassembled PDU]"
"4613","27.799253","192.168.0.10","157.240.251.61","TCP","1446","64144  >  5222 [ACK] Seq=14352 Ack=1661 Win=514 Len=1392 [TCP segment of a reassembled PDU]"
"4614","27.799253","192.168.0.10","157.240.251.61","TCP","898","64144  >  5222 [PSH, ACK] Seq=15744 Ack=1661 Win=514 Len=844 [TCP segment of a reassembled PDU]"
"4617","27.880152","157.240.251.61","192.168.0.10","TCP","56","5222  >  64144 [ACK] Seq=1661 Ack=14352 Win=3833 Len=0"
"4618","27.886646","157.240.251.61","192.168.0.10","TCP","56","5222  >  64144 [ACK] Seq=1661 Ack=16588 Win=3851 Len=0"
"4622","28.077791","157.240.251.61","192.168.0.10","TCP","139","5222  >  64144 [PSH, ACK] Seq=1661 Ack=16588 Win=3851 Len=85 [TCP segment of a reassembled PDU]"
"4634","28.123062","192.168.0.10","157.240.251.61","TCP","54","64144  >  5222 [ACK] Seq=16588 Ack=1746 Win=514 Len=0"
"4640","28.384449","157.240.251.61","192.168.0.10","TCP","126","5222  >  64144 [PSH, ACK] Seq=1746 Ack=16588 Win=3851 Len=72 [TCP segment of a reassembled PDU]"
"4641","28.386129","192.168.0.10","157.240.251.61","TCP","120","64144  >  5222 [PSH, ACK] Seq=16588 Ack=1818 Win=514 Len=66 [TCP segment of a reassembled PDU]"
"4669","28.484609","157.240.251.61","192.168.0.10","TCP","56","5222  >  64144 [ACK] Seq=1818 Ack=16654 Win=3851 Len=0"
"4786","28.891835","157.240.251.61","192.168.0.10","TCP","122","5222  >  64144 [PSH, ACK] Seq=1818 Ack=16654 Win=3851 Len=68 [TCP segment of a reassembled PDU]"
"4799","28.897475","192.168.0.10","157.240.251.61","TCP","118","64144  >  5222 [PSH, ACK] Seq=16654 Ack=1886 Win=514 Len=64 [TCP segment of a reassembled PDU]"
"4814","28.994494","157.240.251.61","192.168.0.10","TCP","56","5222  >  64144 [ACK] Seq=1886 Ack=16718 Win=3851 Len=0"
"5025","29.738147","192.168.0.10","157.240.251.61","TCP","1446","64144  >  5222 [ACK] Seq=16718 Ack=1886 Win=514 Len=1392 [TCP segment of a reassembled PDU]"
"5026","29.738147","192.168.0.10","157.240.251.61","TCP","1446","64144  >  5222 [ACK] Seq=18110 Ack=1886 Win=514 Len=1392 [TCP segment of a reassembled PDU]"
"5027","29.738147","192.168.0.10","157.240.251.61","TCP","946","64144  >  5222 [PSH, ACK] Seq=19502 Ack=1886 Win=514 Len=892 [TCP segment of a reassembled PDU]"
"5049","29.815813","157.240.251.61","192.168.0.10","TCP","56","5222  >  64144 [ACK] Seq=1886 Ack=18110 Win=3862 Len=0"
"5050","29.828420","157.240.251.61","192.168.0.10","TCP","56","5222  >  64144 [ACK] Seq=1886 Ack=19502 Win=3873 Len=0"
"5051","29.842324","157.240.251.61","192.168.0.10","TCP","56","5222  >  64144 [ACK] Seq=1886 Ack=20394 Win=3883 Len=0"
"5106","30.041158","157.240.251.61","192.168.0.10","TCP","139","5222  >  64144 [PSH, ACK] Seq=1886 Ack=20394 Win=3883 Len=85 [TCP segment of a reassembled PDU]"
"5121","30.091437","192.168.0.10","157.240.251.61","TCP","54","64144  >  5222 [ACK] Seq=20394 Ack=1971 Win=513 Len=0"
"5179","30.332652","157.240.251.61","192.168.0.10","TCP","126","5222  >  64144 [PSH, ACK] Seq=1971 Ack=20394 Win=3883 Len=72 [TCP segment of a reassembled PDU]"
"5205","30.335092","192.168.0.10","157.240.251.61","TCP","120","64144  >  5222 [PSH, ACK] Seq=20394 Ack=2043 Win=513 Len=66 [TCP segment of a reassembled PDU]"
"5237","30.462952","157.240.251.61","192.168.0.10","TCP","56","5222  >  64144 [ACK] Seq=2043 Ack=20460 Win=3883 Len=0"
"5313","30.759083","157.240.251.61","192.168.0.10","TCP","122","5222  >  64144 [PSH, ACK] Seq=2043 Ack=20460 Win=3883 Len=68 [TCP segment of a reassembled PDU]"
"5341","30.803984","192.168.0.10","157.240.251.61","TCP","54","64144  >  5222 [ACK] Seq=20460 Ack=2111 Win=513 Len=0"
"5345","30.828157","192.168.0.10","157.240.251.61","TCP","118","64144  >  5222 [PSH, ACK] Seq=20460 Ack=2111 Win=513 Len=64 [TCP segment of a reassembled PDU]"
"5379","30.931457","157.240.251.61","192.168.0.10","TCP","56","5222  >  64144 [ACK] Seq=2111 Ack=20524 Win=3883 Len=0"
"8725","43.250387","192.168.0.10","157.240.251.61","TCP","1446","64144  >  5222 [ACK] Seq=20524 Ack=2111 Win=513 Len=1392 [TCP segment of a reassembled PDU]"
"8726","43.250387","192.168.0.10","157.240.251.61","TCP","1446","64144  >  5222 [ACK] Seq=21916 Ack=2111 Win=513 Len=1392 [TCP segment of a reassembled PDU]"
"8727","43.250387","192.168.0.10","157.240.251.61","TCP","1446","64144  >  5222 [ACK] Seq=23308 Ack=2111 Win=513 Len=1392 [TCP segment of a reassembled PDU]"
"8728","43.250387","192.168.0.10","157.240.251.61","TCP","1446","64144  >  5222 [ACK] Seq=24700 Ack=2111 Win=513 Len=1392 [TCP segment of a reassembled PDU]"
"8729","43.250387","192.168.0.10","157.240.251.61","TCP","818","64144  >  5222 [PSH, ACK] Seq=26092 Ack=2111 Win=513 Len=764 [TCP segment of a reassembled PDU]"
"8744","43.344832","157.240.251.61","192.168.0.10","TCP","56","5222  >  64144 [ACK] Seq=2111 Ack=21916 Win=3894 Len=0"
"8745","43.344832","157.240.251.61","192.168.0.10","TCP","56","5222  >  64144 [ACK] Seq=2111 Ack=23308 Win=3905 Len=0"
"8755","43.361294","157.240.251.61","192.168.0.10","TCP","56","5222  >  64144 [ACK] Seq=2111 Ack=24700 Win=3916 Len=0"
"8756","43.361453","157.240.251.61","192.168.0.10","TCP","56","5222  >  64144 [ACK] Seq=2111 Ack=26092 Win=3927 Len=0"
"8757","43.361500","157.240.251.61","192.168.0.10","TCP","56","5222  >  64144 [ACK] Seq=2111 Ack=26856 Win=3938 Len=0"
"8792","43.550709","157.240.251.61","192.168.0.10","TCP","139","5222  >  64144 [PSH, ACK] Seq=2111 Ack=26856 Win=3938 Len=85 [TCP segment of a reassembled PDU]"
"8832","43.599343","192.168.0.10","157.240.251.61","TCP","54","64144  >  5222 [ACK] Seq=26856 Ack=2196 Win=512 Len=0"
"8928","43.859454","157.240.251.61","192.168.0.10","TCP","126","5222  >  64144 [PSH, ACK] Seq=2196 Ack=26856 Win=3938 Len=72 [TCP segment of a reassembled PDU]"
"8929","43.860926","192.168.0.10","157.240.251.61","TCP","120","64144  >  5222 [PSH, ACK] Seq=26856 Ack=2268 Win=512 Len=66 [TCP segment of a reassembled PDU]"
"8960","43.963549","157.240.251.61","192.168.0.10","TCP","56","5222  >  64144 [ACK] Seq=2268 Ack=26922 Win=3938 Len=0"
"9066","44.360952","157.240.251.61","192.168.0.10","TCP","122","5222  >  64144 [PSH, ACK] Seq=2268 Ack=26922 Win=3938 Len=68 [TCP segment of a reassembled PDU]"
"9068","44.363165","192.168.0.10","157.240.251.61","TCP","118","64144  >  5222 [PSH, ACK] Seq=26922 Ack=2336 Win=512 Len=64 [TCP segment of a reassembled PDU]"
"9114","44.578042","157.240.251.61","192.168.0.10","TCP","56","5222  >  64144 [ACK] Seq=2336 Ack=26986 Win=3938 Len=0"
"14627","63.608554","192.168.0.10","157.240.251.61","TCP","1446","64144  >  5222 [ACK] Seq=26986 Ack=2336 Win=512 Len=1392 [TCP segment of a reassembled PDU]"
"14628","63.608554","192.168.0.10","157.240.251.61","TCP","1446","64144  >  5222 [ACK] Seq=28378 Ack=2336 Win=512 Len=1392 [TCP segment of a reassembled PDU]"
"14629","63.608554","192.168.0.10","157.240.251.61","TCP","1346","64144  >  5222 [PSH, ACK] Seq=29770 Ack=2336 Win=512 Len=1292 [TCP segment of a reassembled PDU]"
"14644","63.708967","157.240.251.61","192.168.0.10","TCP","56","5222  >  64144 [ACK] Seq=2336 Ack=28378 Win=3949 Len=0"
"14645","63.708967","157.240.251.61","192.168.0.10","TCP","56","5222  >  64144 [ACK] Seq=2336 Ack=29770 Win=3960 Len=0"
"14661","63.709637","157.240.251.61","192.168.0.10","TCP","56","5222  >  64144 [ACK] Seq=2336 Ack=31062 Win=3970 Len=0"
"14731","63.935801","157.240.251.61","192.168.0.10","TCP","139","5222  >  64144 [PSH, ACK] Seq=2336 Ack=31062 Win=3970 Len=85 [TCP segment of a reassembled PDU]"
"14750","63.986834","192.168.0.10","157.240.251.61","TCP","54","64144  >  5222 [ACK] Seq=31062 Ack=2421 Win=511 Len=0"
"14846","64.309872","157.240.251.61","192.168.0.10","TCP","126","5222  >  64144 [PSH, ACK] Seq=2421 Ack=31062 Win=3970 Len=72 [TCP segment of a reassembled PDU]"
"14868","64.312079","192.168.0.10","157.240.251.61","TCP","120","64144  >  5222 [PSH, ACK] Seq=31062 Ack=2493 Win=511 Len=66 [TCP segment of a reassembled PDU]"
"14882","64.411552","157.240.251.61","192.168.0.10","TCP","56","5222  >  64144 [ACK] Seq=2493 Ack=31128 Win=3970 Len=0"
"15018","64.861890","157.240.251.61","192.168.0.10","TCP","122","5222  >  64144 [PSH, ACK] Seq=2493 Ack=31128 Win=3970 Len=68 [TCP segment of a reassembled PDU]"
"15022","64.865154","192.168.0.10","157.240.251.61","TCP","118","64144  >  5222 [PSH, ACK] Seq=31128 Ack=2561 Win=511 Len=64 [TCP segment of a reassembled PDU]"
"15033","65.028939","157.240.251.61","192.168.0.10","TCP","56","5222  >  64144 [ACK] Seq=2561 Ack=31192 Win=3970 Len=0"
"17212","72.479313","192.168.0.10","157.240.251.61","TCP","1446","64144  >  5222 [ACK] Seq=31192 Ack=2561 Win=511 Len=1392 [TCP segment of a reassembled PDU]"
"17213","72.479313","192.168.0.10","157.240.251.61","TCP","1446","64144  >  5222 [ACK] Seq=32584 Ack=2561 Win=511 Len=1392 [TCP segment of a reassembled PDU]"
"17214","72.479313","192.168.0.10","157.240.251.61","TCP","1410","64144  >  5222 [PSH, ACK] Seq=33976 Ack=2561 Win=511 Len=1356 [TCP segment of a reassembled PDU]"
"17258","72.674832","157.240.251.61","192.168.0.10","TCP","56","5222  >  64144 [ACK] Seq=2561 Ack=32584 Win=3981 Len=0"
"17259","72.681984","157.240.251.61","192.168.0.10","TCP","56","5222  >  64144 [ACK] Seq=2561 Ack=33976 Win=3992 Len=0"
"17260","72.689057","157.240.251.61","192.168.0.10","TCP","56","5222  >  64144 [ACK] Seq=2561 Ack=35332 Win=4003 Len=0"
"17317","72.877880","157.240.251.61","192.168.0.10","TCP","139","5222  >  64144 [PSH, ACK] Seq=2561 Ack=35332 Win=4003 Len=85 [TCP segment of a reassembled PDU]"
"17332","72.928975","192.168.0.10","157.240.251.61","TCP","54","64144  >  5222 [ACK] Seq=35332 Ack=2646 Win=516 Len=0"
"17422","73.201979","157.240.251.61","192.168.0.10","TCP","126","5222  >  64144 [PSH, ACK] Seq=2646 Ack=35332 Win=4003 Len=72 [TCP segment of a reassembled PDU]"
"17423","73.203713","192.168.0.10","157.240.251.61","TCP","120","64144  >  5222 [PSH, ACK] Seq=35332 Ack=2718 Win=516 Len=66 [TCP segment of a reassembled PDU]"
"17447","73.282567","157.240.251.61","192.168.0.10","TCP","56","5222  >  64144 [ACK] Seq=2718 Ack=35398 Win=4003 Len=0"
"17542","73.682510","157.240.251.61","192.168.0.10","TCP","122","5222  >  64144 [PSH, ACK] Seq=2718 Ack=35398 Win=4003 Len=68 [TCP segment of a reassembled PDU]"
"17564","73.684503","192.168.0.10","157.240.251.61","TCP","118","64144  >  5222 [PSH, ACK] Seq=35398 Ack=2786 Win=516 Len=64 [TCP segment of a reassembled PDU]"
"17585","73.776194","157.240.251.61","192.168.0.10","TCP","56","5222  >  64144 [ACK] Seq=2786 Ack=35462 Win=4003 Len=0"
"29312","101.386802","192.168.0.10","157.240.251.61","TCP","1446","64144  >  5222 [ACK] Seq=35462 Ack=2786 Win=516 Len=1392 [TCP segment of a reassembled PDU]"
"29313","101.386802","192.168.0.10","157.240.251.61","TCP","1446","64144  >  5222 [ACK] Seq=36854 Ack=2786 Win=516 Len=1392 [TCP segment of a reassembled PDU]"
"29314","101.386802","192.168.0.10","157.240.251.61","TCP","1446","64144  >  5222 [ACK] Seq=38246 Ack=2786 Win=516 Len=1392 [TCP segment of a reassembled PDU]"
"29315","101.386802","192.168.0.10","157.240.251.61","TCP","338","64144  >  5222 [PSH, ACK] Seq=39638 Ack=2786 Win=516 Len=284 [TCP segment of a reassembled PDU]"
"29357","101.511298","157.240.251.61","192.168.0.10","TCP","56","5222  >  64144 [ACK] Seq=2786 Ack=36854 Win=4014 Len=0"
"29358","101.525607","157.240.251.61","192.168.0.10","TCP","56","5222  >  64144 [ACK] Seq=2786 Ack=38246 Win=4025 Len=0"
"29359","101.525784","157.240.251.61","192.168.0.10","TCP","56","5222  >  64144 [ACK] Seq=2786 Ack=39638 Win=4036 Len=0"
"29363","101.526136","157.240.251.61","192.168.0.10","TCP","56","5222  >  64144 [ACK] Seq=2786 Ack=39922 Win=4036 Len=0"
"29432","101.770303","157.240.251.61","192.168.0.10","TCP","139","5222  >  64144 [PSH, ACK] Seq=2786 Ack=39922 Win=4036 Len=85 [TCP segment of a reassembled PDU]"
"29452","101.826880","192.168.0.10","157.240.251.61","TCP","54","64144  >  5222 [ACK] Seq=39922 Ack=2871 Win=515 Len=0"
"29545","102.075113","157.240.251.61","192.168.0.10","TCP","126","5222  >  64144 [PSH, ACK] Seq=2871 Ack=39922 Win=4036 Len=72 [TCP segment of a reassembled PDU]"
"29546","102.076998","192.168.0.10","157.240.251.61","TCP","120","64144  >  5222 [PSH, ACK] Seq=39922 Ack=2943 Win=515 Len=66 [TCP segment of a reassembled PDU]"
"29561","102.175054","157.240.251.61","192.168.0.10","TCP","56","5222  >  64144 [ACK] Seq=2943 Ack=39988 Win=4036 Len=0"
"29673","102.582451","157.240.251.61","192.168.0.10","TCP","122","5222  >  64144 [PSH, ACK] Seq=2943 Ack=39988 Win=4036 Len=68 [TCP segment of a reassembled PDU]"
"29689","102.584962","192.168.0.10","157.240.251.61","TCP","118","64144  >  5222 [PSH, ACK] Seq=39988 Ack=3011 Win=515 Len=64 [TCP segment of a reassembled PDU]"
"29721","102.789195","157.240.251.61","192.168.0.10","TCP","56","5222  >  64144 [ACK] Seq=3011 Ack=40052 Win=4036 Len=0"
"43775","152.909942","192.168.0.10","157.240.251.61","TCP","1446","64144  >  5222 [ACK] Seq=40052 Ack=3011 Win=515 Len=1392 [TCP segment of a reassembled PDU]"
"43776","152.909942","192.168.0.10","157.240.251.61","TCP","1446","64144  >  5222 [ACK] Seq=41444 Ack=3011 Win=515 Len=1392 [TCP segment of a reassembled PDU]"
"43777","152.909942","192.168.0.10","157.240.251.61","TCP","1446","64144  >  5222 [ACK] Seq=42836 Ack=3011 Win=515 Len=1392 [TCP segment of a reassembled PDU]"
"43778","152.909942","192.168.0.10","157.240.251.61","TCP","194","64144  >  5222 [PSH, ACK] Seq=44228 Ack=3011 Win=515 Len=140 [TCP segment of a reassembled PDU]"
"43784","152.961898","192.168.0.10","157.240.251.61","TCP","1446","64144  >  5222 [ACK] Seq=44368 Ack=3011 Win=515 Len=1392 [TCP segment of a reassembled PDU]"
"43785","152.961898","192.168.0.10","157.240.251.61","TCP","1446","64144  >  5222 [ACK] Seq=45760 Ack=3011 Win=515 Len=1392 [TCP segment of a reassembled PDU]"
"43786","152.961898","192.168.0.10","157.240.251.61","TCP","1446","64144  >  5222 [ACK] Seq=47152 Ack=3011 Win=515 Len=1392 [TCP segment of a reassembled PDU]"
"43787","152.961898","192.168.0.10","157.240.251.61","TCP","466","64144  >  5222 [PSH, ACK] Seq=48544 Ack=3011 Win=515 Len=412 [TCP segment of a reassembled PDU]"
"43814","153.063818","157.240.251.61","192.168.0.10","TCP","66","[TCP Window Update] 5222  >  64144 [ACK] Seq=3011 Ack=40052 Win=4048 Len=0 SLE=42836 SRE=44368"
"43817","153.063818","157.240.251.61","192.168.0.10","TCP","74","[TCP Dup ACK 29721#1] 5222  >  64144 [ACK] Seq=3011 Ack=40052 Win=4048 Len=0 SLE=48544 SRE=48956 SLE=42836 SRE=44368"
"43818","153.064087","192.168.0.10","157.240.251.61","TCP","1446","[TCP Retransmission] 64144  >  5222 [ACK] Seq=40052 Ack=3011 Win=515 Len=1392"
"43819","153.064156","192.168.0.10","157.240.251.61","TCP","1446","[TCP Retransmission] 64144  >  5222 [ACK] Seq=41444 Ack=3011 Win=515 Len=1392"
"43856","153.167109","157.240.251.61","192.168.0.10","TCP","74","5222  >  64144 [ACK] Seq=3011 Ack=41444 Win=4058 Len=0 SLE=48544 SRE=48956 SLE=42836 SRE=44368"
"43857","153.167109","157.240.251.61","192.168.0.10","TCP","66","5222  >  64144 [ACK] Seq=3011 Ack=44368 Win=4069 Len=0 SLE=48544 SRE=48956"
"43861","153.167203","192.168.0.10","157.240.251.61","TCP","1446","[TCP Retransmission] 64144  >  5222 [ACK] Seq=44368 Ack=3011 Win=515 Len=1392"
"43862","153.167203","192.168.0.10","157.240.251.61","TCP","1446","[TCP Retransmission] 64144  >  5222 [ACK] Seq=45760 Ack=3011 Win=515 Len=1392"
"43863","153.167270","192.168.0.10","157.240.251.61","TCP","1446","[TCP Retransmission] 64144  >  5222 [ACK] Seq=47152 Ack=3011 Win=515 Len=1392"
"43886","153.269244","157.240.251.61","192.168.0.10","TCP","66","5222  >  64144 [ACK] Seq=3011 Ack=45760 Win=4080 Len=0 SLE=48544 SRE=48956"
"43896","153.269695","157.240.251.61","192.168.0.10","TCP","66","5222  >  64144 [ACK] Seq=3011 Ack=47152 Win=4091 Len=0 SLE=48544 SRE=48956"
"43898","153.269695","157.240.251.61","192.168.0.10","TCP","56","5222  >  64144 [ACK] Seq=3011 Ack=48956 Win=4102 Len=0"
"43932","153.390002","157.240.251.61","192.168.0.10","TCP","139","5222  >  64144 [PSH, ACK] Seq=3011 Ack=48956 Win=4102 Len=85 [TCP segment of a reassembled PDU]"
"43955","153.439261","192.168.0.10","157.240.251.61","TCP","54","64144  >  5222 [ACK] Seq=48956 Ack=3096 Win=514 Len=0"
"43980","153.475215","157.240.251.61","192.168.0.10","TCP","139","5222  >  64144 [PSH, ACK] Seq=3096 Ack=48956 Win=4102 Len=85 [TCP segment of a reassembled PDU]"
"44010","153.517779","192.168.0.10","157.240.251.61","TCP","54","64144  >  5222 [ACK] Seq=48956 Ack=3181 Win=514 Len=0"
"44079","153.776680","157.240.251.61","192.168.0.10","TCP","126","5222  >  64144 [PSH, ACK] Seq=3181 Ack=48956 Win=4102 Len=72 [TCP segment of a reassembled PDU]"
"44097","153.778496","192.168.0.10","157.240.251.61","TCP","120","64144  >  5222 [PSH, ACK] Seq=48956 Ack=3253 Win=514 Len=66 [TCP segment of a reassembled PDU]"
"44102","153.821214","157.240.251.61","192.168.0.10","TCP","126","5222  >  64144 [PSH, ACK] Seq=3253 Ack=48956 Win=4102 Len=72 [TCP segment of a reassembled PDU]"
"44105","153.823171","192.168.0.10","157.240.251.61","TCP","120","64144  >  5222 [PSH, ACK] Seq=49022 Ack=3325 Win=513 Len=66 [TCP segment of a reassembled PDU]"
"44129","153.878216","157.240.251.61","192.168.0.10","TCP","56","5222  >  64144 [ACK] Seq=3325 Ack=49022 Win=4102 Len=0"
"44136","153.981779","157.240.251.61","192.168.0.10","TCP","56","5222  >  64144 [ACK] Seq=3325 Ack=49088 Win=4102 Len=0"
"44226","154.204973","157.240.251.61","192.168.0.10","TCP","122","5222  >  64144 [PSH, ACK] Seq=3325 Ack=49088 Win=4102 Len=68 [TCP segment of a reassembled PDU]"
"44227","154.207285","192.168.0.10","157.240.251.61","TCP","118","64144  >  5222 [PSH, ACK] Seq=49088 Ack=3393 Win=513 Len=64 [TCP segment of a reassembled PDU]"
"44250","154.291221","157.240.251.61","192.168.0.10","TCP","122","5222  >  64144 [PSH, ACK] Seq=3393 Ack=49088 Win=4102 Len=68 [TCP segment of a reassembled PDU]"
"44251","154.291296","157.240.251.61","192.168.0.10","TCP","56","5222  >  64144 [ACK] Seq=3461 Ack=49152 Win=4102 Len=0"
"44252","154.293383","192.168.0.10","157.240.251.61","TCP","118","64144  >  5222 [PSH, ACK] Seq=49152 Ack=3461 Win=513 Len=64 [TCP segment of a reassembled PDU]"
"44272","154.388688","157.240.251.61","192.168.0.10","TCP","56","5222  >  64144 [ACK] Seq=3461 Ack=49216 Win=4102 Len=0"
"45091","157.067655","192.168.0.10","157.240.251.61","TCP","1446","64144  >  5222 [ACK] Seq=49216 Ack=3461 Win=513 Len=1392 [TCP segment of a reassembled PDU]"
"45092","157.067655","192.168.0.10","157.240.251.61","TCP","1446","64144  >  5222 [ACK] Seq=50608 Ack=3461 Win=513 Len=1392 [TCP segment of a reassembled PDU]"
"45093","157.067655","192.168.0.10","157.240.251.61","TCP","1446","64144  >  5222 [ACK] Seq=52000 Ack=3461 Win=513 Len=1392 [TCP segment of a reassembled PDU]"
"45094","157.067655","192.168.0.10","157.240.251.61","TCP","338","64144  >  5222 [PSH, ACK] Seq=53392 Ack=3461 Win=513 Len=284 [TCP segment of a reassembled PDU]"
"45128","157.237425","157.240.251.61","192.168.0.10","TCP","56","5222  >  64144 [ACK] Seq=3461 Ack=50608 Win=4113 Len=0"
"45129","157.237425","157.240.251.61","192.168.0.10","TCP","56","5222  >  64144 [ACK] Seq=3461 Ack=52000 Win=4124 Len=0"
"45130","157.237425","157.240.251.61","192.168.0.10","TCP","56","5222  >  64144 [ACK] Seq=3461 Ack=53676 Win=4137 Len=0"
"45181","157.443026","157.240.251.61","192.168.0.10","TCP","139","5222  >  64144 [PSH, ACK] Seq=3461 Ack=53676 Win=4137 Len=85 [TCP segment of a reassembled PDU]"
"45219","157.489835","192.168.0.10","157.240.251.61","TCP","54","64144  >  5222 [ACK] Seq=53676 Ack=3546 Win=513 Len=0"
"45297","157.745496","157.240.251.61","192.168.0.10","TCP","126","5222  >  64144 [PSH, ACK] Seq=3546 Ack=53676 Win=4137 Len=72 [TCP segment of a reassembled PDU]"
"45307","157.746687","192.168.0.10","157.240.251.61","TCP","120","64144  >  5222 [PSH, ACK] Seq=53676 Ack=3618 Win=512 Len=66 [TCP segment of a reassembled PDU]"
"45325","157.854647","157.240.251.61","192.168.0.10","TCP","56","5222  >  64144 [ACK] Seq=3618 Ack=53742 Win=4137 Len=0"
"45448","158.254407","157.240.251.61","192.168.0.10","TCP","122","5222  >  64144 [PSH, ACK] Seq=3618 Ack=53742 Win=4137 Len=68 [TCP segment of a reassembled PDU]"
"45457","158.256911","192.168.0.10","157.240.251.61","TCP","118","64144  >  5222 [PSH, ACK] Seq=53742 Ack=3686 Win=512 Len=64 [TCP segment of a reassembled PDU]"
"45475","158.355364","157.240.251.61","192.168.0.10","TCP","56","5222  >  64144 [ACK] Seq=3686 Ack=53806 Win=4137 Len=0"
"56109","195.919563","192.168.0.10","157.240.251.61","TCP","1446","64144  >  5222 [ACK] Seq=53806 Ack=3686 Win=512 Len=1392 [TCP segment of a reassembled PDU]"
"56110","195.919563","192.168.0.10","157.240.251.61","TCP","1446","64144  >  5222 [ACK] Seq=55198 Ack=3686 Win=512 Len=1392 [TCP segment of a reassembled PDU]"
"56111","195.919563","192.168.0.10","157.240.251.61","TCP","1378","64144  >  5222 [PSH, ACK] Seq=56590 Ack=3686 Win=512 Len=1324 [TCP segment of a reassembled PDU]"
"56144","196.049639","157.240.251.61","192.168.0.10","TCP","56","5222  >  64144 [ACK] Seq=3686 Ack=55198 Win=4148 Len=0"
"56149","196.056108","157.240.251.61","192.168.0.10","TCP","56","5222  >  64144 [ACK] Seq=3686 Ack=56590 Win=4159 Len=0"
"56150","196.058737","157.240.251.61","192.168.0.10","TCP","56","5222  >  64144 [ACK] Seq=3686 Ack=57914 Win=4169 Len=0"
"56202","196.253377","157.240.251.61","192.168.0.10","TCP","139","5222  >  64144 [PSH, ACK] Seq=3686 Ack=57914 Win=4169 Len=85 [TCP segment of a reassembled PDU]"
"56225","196.304875","192.168.0.10","157.240.251.61","TCP","54","64144  >  5222 [ACK] Seq=57914 Ack=3771 Win=512 Len=0"
"56326","196.624722","157.240.251.61","192.168.0.10","TCP","126","5222  >  64144 [PSH, ACK] Seq=3771 Ack=57914 Win=4169 Len=72 [TCP segment of a reassembled PDU]"
"56347","196.626268","192.168.0.10","157.240.251.61","TCP","120","64144  >  5222 [PSH, ACK] Seq=57914 Ack=3843 Win=511 Len=66 [TCP segment of a reassembled PDU]"
"56357","196.749521","157.240.251.61","192.168.0.10","TCP","56","5222  >  64144 [ACK] Seq=3843 Ack=57980 Win=4169 Len=0"
"56474","197.055782","157.240.251.61","192.168.0.10","TCP","122","5222  >  64144 [PSH, ACK] Seq=3843 Ack=57980 Win=4169 Len=68 [TCP segment of a reassembled PDU]"
"56475","197.057509","192.168.0.10","157.240.251.61","TCP","118","64144  >  5222 [PSH, ACK] Seq=57980 Ack=3911 Win=511 Len=64 [TCP segment of a reassembled PDU]"
"56499","197.139926","157.240.251.61","192.168.0.10","TCP","56","5222  >  64144 [ACK] Seq=3911 Ack=58044 Win=4169 Len=0"
"57143","199.794648","192.168.0.10","157.240.251.61","TCP","1446","64144  >  5222 [ACK] Seq=58044 Ack=3911 Win=511 Len=1392 [TCP segment of a reassembled PDU]"
"57144","199.794648","192.168.0.10","157.240.251.61","TCP","1446","64144  >  5222 [ACK] Seq=59436 Ack=3911 Win=511 Len=1392 [TCP segment of a reassembled PDU]"
"57145","199.794648","192.168.0.10","157.240.251.61","TCP","98","64144  >  5222 [PSH, ACK] Seq=60828 Ack=3911 Win=511 Len=44 [TCP segment of a reassembled PDU]"
"57146","199.895380","157.240.251.61","192.168.0.10","TCP","56","5222  >  64144 [ACK] Seq=3911 Ack=59436 Win=4180 Len=0"
"57147","199.895380","157.240.251.61","192.168.0.10","TCP","56","5222  >  64144 [ACK] Seq=3911 Ack=60872 Win=4192 Len=0"
"57150","199.913976","192.168.0.10","157.240.251.61","TCP","1446","64144  >  5222 [ACK] Seq=60872 Ack=3911 Win=511 Len=1392 [TCP segment of a reassembled PDU]"
"57151","199.913976","192.168.0.10","157.240.251.61","TCP","1446","64144  >  5222 [ACK] Seq=62264 Ack=3911 Win=511 Len=1392 [TCP segment of a reassembled PDU]"
"57152","199.913976","192.168.0.10","157.240.251.61","TCP","1446","64144  >  5222 [ACK] Seq=63656 Ack=3911 Win=511 Len=1392 [TCP segment of a reassembled PDU]"
"57153","199.913976","192.168.0.10","157.240.251.61","TCP","274","64144  >  5222 [PSH, ACK] Seq=65048 Ack=3911 Win=511 Len=220 [TCP segment of a reassembled PDU]"
"57154","199.982915","157.240.251.61","192.168.0.10","TCP","56","5222  >  64144 [ACK] Seq=3911 Ack=62264 Win=4202 Len=0"
"57155","199.989190","157.240.251.61","192.168.0.10","TCP","66","[TCP Window Update] 5222  >  64144 [ACK] Seq=3911 Ack=62264 Win=4215 Len=0 SLE=63656 SRE=65268"
"57156","199.989655","157.240.251.61","192.168.0.10","TCP","56","5222  >  64144 [ACK] Seq=3911 Ack=65268 Win=4226 Len=0"
"57165","200.188857","157.240.251.61","192.168.0.10","TCP","139","5222  >  64144 [PSH, ACK] Seq=3911 Ack=65268 Win=4226 Len=85 [TCP segment of a reassembled PDU]"
"57179","200.189462","157.240.251.61","192.168.0.10","TCP","139","5222  >  64144 [PSH, ACK] Seq=3996 Ack=65268 Win=4226 Len=85 [TCP segment of a reassembled PDU]"
"57182","200.189822","192.168.0.10","157.240.251.61","TCP","54","64144  >  5222 [ACK] Seq=65268 Ack=4081 Win=516 Len=0"
"57203","200.491048","157.240.251.61","192.168.0.10","TCP","126","5222  >  64144 [PSH, ACK] Seq=4081 Ack=65268 Win=4226 Len=72 [TCP segment of a reassembled PDU]"
"57204","200.493287","192.168.0.10","157.240.251.61","TCP","120","64144  >  5222 [PSH, ACK] Seq=65268 Ack=4153 Win=516 Len=66 [TCP segment of a reassembled PDU]"
"57205","200.526999","157.240.251.61","192.168.0.10","TCP","126","5222  >  64144 [PSH, ACK] Seq=4153 Ack=65268 Win=4226 Len=72 [TCP segment of a reassembled PDU]"
"57206","200.528510","192.168.0.10","157.240.251.61","TCP","120","64144  >  5222 [PSH, ACK] Seq=65334 Ack=4225 Win=516 Len=66 [TCP segment of a reassembled PDU]"
"57208","200.592746","157.240.251.61","192.168.0.10","TCP","56","5222  >  64144 [ACK] Seq=4225 Ack=65334 Win=4226 Len=0"
"57209","200.599158","157.240.251.61","192.168.0.10","TCP","56","5222  >  64144 [ACK] Seq=4225 Ack=65400 Win=4226 Len=0"
"57210","200.898606","157.240.251.61","192.168.0.10","XMPP/XML","122","UNKNOWN PACKET "
"57211","200.898606","157.240.251.61","192.168.0.10","TCP","122","5222  >  64144 [PSH, ACK] Seq=4293 Ack=65400 Win=4226 Len=68 [TCP segment of a reassembled PDU]"
"57212","200.898874","192.168.0.10","157.240.251.61","TCP","54","64144  >  5222 [ACK] Seq=65400 Ack=4361 Win=515 Len=0"
"57213","200.900742","192.168.0.10","157.240.251.61","TCP","118","64144  >  5222 [PSH, ACK] Seq=65400 Ack=4361 Win=515 Len=64 [TCP segment of a reassembled PDU]"
"57214","200.901753","192.168.0.10","157.240.251.61","TCP","118","64144  >  5222 [PSH, ACK] Seq=65464 Ack=4361 Win=515 Len=64 [TCP segment of a reassembled PDU]"
"57215","201.001051","157.240.251.61","192.168.0.10","TCP","56","5222  >  64144 [ACK] Seq=4361 Ack=65464 Win=4226 Len=0"
"57216","201.001051","157.240.251.61","192.168.0.10","TCP","56","5222  >  64144 [ACK] Seq=4361 Ack=65528 Win=4226 Len=0"
"57258","202.517911","192.168.0.10","157.240.251.61","TCP","1446","64144  >  5222 [ACK] Seq=65528 Ack=4361 Win=515 Len=1392 [TCP segment of a reassembled PDU]"
"57259","202.517911","192.168.0.10","157.240.251.61","TCP","1446","64144  >  5222 [ACK] Seq=66920 Ack=4361 Win=515 Len=1392 [TCP segment of a reassembled PDU]"
"57260","202.517911","192.168.0.10","157.240.251.61","TCP","1446","64144  >  5222 [ACK] Seq=68312 Ack=4361 Win=515 Len=1392 [TCP segment of a reassembled PDU]"
"57261","202.517911","192.168.0.10","157.240.251.61","TCP","370","64144  >  5222 [PSH, ACK] Seq=69704 Ack=4361 Win=515 Len=316 [TCP segment of a reassembled PDU]"
"57262","202.602482","157.240.251.61","192.168.0.10","TCP","56","5222  >  64144 [ACK] Seq=4361 Ack=66920 Win=4237 Len=0"
"57263","202.698956","157.240.251.61","192.168.0.10","TCP","56","5222  >  64144 [ACK] Seq=4361 Ack=70020 Win=4261 Len=0"
"57264","202.932425","157.240.251.61","192.168.0.10","TCP","139","5222  >  64144 [PSH, ACK] Seq=4361 Ack=70020 Win=4261 Len=85 [TCP segment of a reassembled PDU]"
"57280","202.979335","192.168.0.10","157.240.251.61","TCP","54","64144  >  5222 [ACK] Seq=70020 Ack=4446 Win=515 Len=0"
"57284","203.340744","157.240.251.61","192.168.0.10","TCP","126","5222  >  64144 [PSH, ACK] Seq=4446 Ack=70020 Win=4261 Len=72 [TCP segment of a reassembled PDU]"
"57285","203.342765","192.168.0.10","157.240.251.61","TCP","120","64144  >  5222 [PSH, ACK] Seq=70020 Ack=4518 Win=514 Len=66 [TCP segment of a reassembled PDU]"
"57288","203.454482","157.240.251.61","192.168.0.10","TCP","56","5222  >  64144 [ACK] Seq=4518 Ack=70086 Win=4261 Len=0"
"57319","203.854555","157.240.251.61","192.168.0.10","TCP","122","5222  >  64144 [PSH, ACK] Seq=4518 Ack=70086 Win=4261 Len=68 [TCP segment of a reassembled PDU]"
"57320","203.856339","192.168.0.10","157.240.251.61","TCP","118","64144  >  5222 [PSH, ACK] Seq=70086 Ack=4586 Win=514 Len=64 [TCP segment of a reassembled PDU]"
"57323","203.962081","157.240.251.61","192.168.0.10","TCP","56","5222  >  64144 [ACK] Seq=4586 Ack=70150 Win=4261 Len=0"
